"sent_id","par_id","source","book_id","par_pos","sent_pos"
76409,26203,"На Белом доме будут установлены солнечные батареи",3195,1,1
76410,26204,"Министерство энергетики США сообщило, что в начале 2011 года в Белом доме будут установлены солнечные панели на крыше и нагреватель воды, работающий на солнечной энергии.",3195,2,1
76411,26205,"Министр энергетики Стивен Чу заявил в во вторник 5 октября, что резиденция президента будет служить примером использования солнечной энергии – ее доступности для американцев и надежности.",3195,3,1
76412,26205,"Заявления министра последовали на конференции в Вашингтоне, посвященной вопросам повышения «зелености» зданий правительственного аппарата.",3195,3,2
76413,26206,"Еще в конце 1970-х годов президент Джимми Картер установил солнечные батареи в Белом доме, однако они были демонтированы при администрации Рональда Рейгана.",3195,4,1
76414,26206,"При Джордже Буше-младшем в целях обеспечения электричеством подсобного помещения и обогревательной системы бассейна Белого дома солнечные батареи были установлены снова.",3195,4,2
