"sent_id","par_id","source","book_id","par_pos","sent_pos"
33407,10666,"1 октября Международная федерация шахмат ( ФИДЕ) опубликовала новый рейтинг спиcок лучших шахматистов.",1111,1,1
33408,10667,"Первые две строчки рейтинга остались неизменными.",1111,2,1
33409,10667,"Впереди по прежнему чемпион мира ФИДЕ Топалов, Веселин Топалов (Болгария), рейтинг которого остался неизменным (2813), а на втором месте Вишванатан Ананд.",1111,2,2
33410,10667,"На третье место переместился Владимир Крамник.",1111,2,3
33411,10667,"Четвёртое и пятое места в рейтинге занимают также российские шахматисты — Пётр Свидлер и Александр Морозевич.",1111,2,4
33412,10668,"В первой двадцатке — четыре шахматиста из России.",1111,3,1
33413,10669,"Рейтинг список ФИДЕ первых 20 шахматистов на 1 октября 2006 года",1111,4,1
33414,10670,"Рейтинг список ФИДЕ первых 20 шахматистов России на 1 октября 2006 года",1111,5,1
