"sent_pos","source"
0,"Свободу информации!"
1,"Ассоциация интернет-издателей начинает работу."
2,"Сегодня в редакции «Частного корреспондента» состоится первое учредительное заседание Ассоциации интернет-издателей, которая должна объединить производителей и публикаторов сетевого контента, заинтересованных в свободном распространении качественной информации."
3,"Ожидается, что в заседании примут участие ведущие представители издательской отрасли, библиотечного дела и СМИ."
4,"«Уже давно пора поддержать создание законных условий для использования лицензий Creative Commons в России."
5,"А наряду с этим выступить против лобби монополистов из числа государственных информационных агентств, которые пытаются требовать оплаты распространяемых ими новостей, в том числе от тех, кто не подписан на их новости», — заявил главный редактор «Частного корреспондента» Иван Засурский на круглом столе в рамках RIW-2009, посвящённом проблемам авторского права в интернете."
6,"«Стоит задуматься и над тем, насколько отвечают реальным потребностям общества введённые под влиянием лобби контентных корпораций исключительно длительные сроки охраны авторского права, во всяком случае для электронных публикаций."
7,"Столь длительные сроки делают практически невозможным легальное распространение книг, музыки, фильмов, установление прав на которые за давностью лет уже невозможно», — подчеркнул Засурский во время выступления."
8,"Подробнее об Ассоциации интернет-издателей можно прочитать в материале «Часкора» «Законы интернета»."
