"sent_pos","source"
0,"Депутаты заступились за вчерашних абитуриентов Студенты-первокурсники теперь будут получать стипендию с начала учебного года."
1,"Закрепление вполне справедливого права студента-очника первого курса получать стипендию с начала учебного года на законодательном уровне продиктовано той практикой, которая сложилась сегодня в отечественных ВУЗах."
2,"Как оказалось, руководство образовательных учреждений начинает начислять вчерашнему абитуриенту стипендию только после сдачи первой сессии, т.е."
3,"со второго семестра."
4,"Свои действия ректорат объясняет Положением о стипендиальном фонде, в котором оговорено, что стипендия выплачивается только тем студентам, которые учатся на «хорошо» и «отлично»."
5,"Другими словами, только после сессии становится понятно - кто достоин денежных поощрений, а кому ещё двойки и тройки исправить нужно."
6,"Чтобы приравнять первокурсников в правах на получение стипендии со всеми остальными студентами, депутаты во главе с вице-спикером Госдумы Светланой Журовой предложили Госдуме принять закон, который уточнил бы период выплаты стипендий для студентов всех курсов."
7,"3 июля Госдума одобрила этот документ в третьем чтении."
8,"По словам некоторых депутатов, данное уточнение позволит «восстановить справедливость в отношении студентов-первокурсников», сообщает Rosbalt.ru."
