"sent_pos","source"
0,"ФАС вступилась за SMS-сообщения на русском языке Антимонопольщики решили разобраться, почему SMS на русском языке стоит более чем в два раза дороже, чем сообщение на латинице."
1,"Федеральная антимонопольная служба вступилась за русскоговорящих абонентов связи."
2,"Ведомство собирается разобраться, почему SMS на русском языке стоит более чем в два раза дороже, чем сообщение на латинице."
3,"ФАС уже направила запрос сотовым операторам, в котором просит объяснить, на каком основании они ограничивают длину SMS-сообщений в зависимости от алфавита."
4,"«К нам поступили жалобы от граждан."
5,"В них говорится, что операторы ограничивают длину SMS на латинице 160 символами, а кириллические SMS - 70 символами."
6,"Таким образом, русскоговорящие граждане поставлены в невыгодные условия, так как вынуждены платить более чем в два раза больше за длинные SMS», - цитирует «Коммерсантъ» начальника управления контроля транспорта и связи Дмитрия Рутенберга."
7,"В настоящее сейчас ФАС изучает ответы от операторов, по итогам проверки может быть возбуждено дело."
8,"При этом в ведомстве не исключают, что у ФАС могут возникнуть вопросы и к производителям телефонов."
