"sent_id","par_id","source","book_id","par_pos","sent_pos"
6527,2059,"Актуальный Трифонов",85,1,1
6528,2059,"Советская литература — едва ли не единственное средство описания современного человека",85,1,2
6529,2060,"Меняющиеся время от времени няни наших детей — они ведь как таксисты .",85,2,1
6530,2060,"Излагают всю правду жизни в сконцентрированном и максимально обнажённом виде .",85,2,2
6531,2060,"Одна поразила вопросом , глядя на книжную полку :",85,2,3
6532,2060,"« Довлатов — это классик или современник ? »",85,2,4
6533,2060,"Другая сообщила , что в её родном областном центре N « Альтист Данилов » Владимира Орлова проходил по разряду современной прозы .",85,2,5
6534,2060,"И ведь правда , нет ничего более современного , чем проза 60 — 70-х годов прошлого века .",85,2,6
6535,2060,"О чём ещё раз напоминает актуальный юбилей — 85 лет со дня рождения Юрия Трифонова .",85,2,7
6536,2061,"Конечно , « Полукровка » Елены Чижовой — книга о советском антисемитизме в 1970-е годы — никогда в жизни не могла бы увидеть свет в доельцинскую эру .",85,3,1
6537,2061,"Но это проза той же интонации , которую мы можем найти в романах , повестях и рассказах И . Грековой , хрестоматийного автора позднесоветской литературы , чьи книги сейчас переиздаются одна за другой большими тиражами и становятся лидерами продаж .",85,3,2
6538,2061,"И , надо сказать , совершенно заслуженно .",85,3,3
6539,2061,"При этом ведь и у самой Грековой — Елены Сергеевны Вентцель была неподцензурная вещь — « Свежо предание » , об антисемитизме , только в ещё более ранние и страшные времена .",85,3,4
6540,2061,"А так вполне нормальный советский писатель , который сегодня соответствует лучшим образцам так называемой женской прозы , описывающей драмы и комедии городской жизни среднестатистического обывателя .",85,3,5
6541,2061,"И вот ведь не отличишь тогдашних героев от сегодняшних , даже если учитывать тот факт , что в прозе Грековой много коммунальных квартир .",85,3,6
6542,2062,"Можно переиздать значительное число наименований советской прозы , ну , например , « Бессонницу » Александра Крона , и читатель не заметит отличий в человеческой природе персонажей , пропуская мимо сознания характерные приметы времени .",85,4,1
6543,2062,"И тогда становится понятным , что на самом деле в жизни той среды , которая описывалась бытописателями городской жизни , мало что всерьёз изменилось .",85,4,2
6544,2062,"Нравственные дилеммы , проблемы , беды и радости , отношения отцов и детей — те же самые , что и в богоспасаемую брежневскую эру .",85,4,3
6545,2062,"Политические обстоятельства остаются за скобками , но так они и в современной прозе не слишком-то вторгаются в повествование .",85,4,4
6546,2062,"В романе « Елтышевы » финалиста « Нацбеста » - 2010 Романа Сенчина внешний мир присутствует только в виде телевизора .",85,4,5
6547,2062,"Да и тот всё время « рябит » — ни хрена не видно , что там вообще происходит .",85,4,6
6548,2063,"Действие знаменитого романа Юрия Трифонова « Старик » , того самого , который чем-то напоминает по интонации « Вишнёвый сад » , происходит летом 1972 года , в такую же страшную жару , как и горячим летом 2010-го .",85,5,1
6549,2063,"Совпадения уже не символические и не бытовые — метеорологические .",85,5,2
6550,2063,"« Все мучились от жары , все спрашивали друг у друга :",85,5,3
6551,2063,"« Как самочувствие ?",85,5,4
6552,2063,"Как вы переносите эту Африку ? »",85,5,5
6553,2063,"По мере развития повествования жара из мелкой неприятности превращается в настоящий кошмар :",85,5,6
6554,2063,"« Чугун давил , леса горели , Москва гибла в удушье , задыхалась от сизой , пепельной , бурой , красноватой , чёрной — в разные часы дня разного цвета — мглы , заполнявшей улицы и дома медленно текучим , стелящимся , как туман или как ядовитый газ , облаком , запах гари проникал всюду , спастись было нельзя …",85,5,7
6555,2063,"« Вечерняя Москва » полна траурных объявлений …",85,5,8
6556,2063,"Один старик сказал , что жара простоит до конца октября , потом станет легче » .",85,5,9
6557,2063,"Как это всё напоминает наши недавние ощущения и разговоры .",85,5,10
6558,2063,"И как похоже всё закончилось :",85,5,11
6559,2063,"« И однажды в конце августа как будто лопнула струна — жара прекратилась …",85,5,12
6560,2063,"те , что остались живы , испытали необычайную бодрость и как бы наслаждение жизнью …",85,5,13
6561,2063,"На третий день все забыли о недавних мучениях — чему помог зарядивший с утра мелкий , сеявший осеннюю скуку дождь » .",85,5,14
6562,2064,"Это самый точный отчёт в литературе о жаре - 72 .",85,6,1
6563,2064,"Так и вся проза Трифонова — она была самым точным отчётом о городской жизни застойного времени , в шокирующих деталях совпадающим с сегодняшними реалиями .",85,6,2
6564,2064,"Бытовыми реалиями .",85,6,3
6565,2065,"Слово « быт » преследовало Трифонова с тех пор , как один за другим стали появляться его рассказы конца 1960-х , предвестники знаменитых « московских повестей » , серия которых началась с 1969-го с « Обмена » .",85,7,1
6566,2065,"Повестей и романов , в которых советский обыватель с изумлением узнал сам себя , и потому зачитывал до дыр журнальные книжки с вещами Трифонова .",85,7,2
6567,2065,"А он прекрасно понимал эти достоинства своей прозы — в беседе с критиком Анатолием Бочаровым для журнала « Вопросы литературы » ещё в 1974 году , до « Другой жизни » , « Дома на набережной » , « Старика » , « Времени и места » , говорил :",85,7,3
6568,2065,"« Читателю должно быть не по себе , он должен поёживаться и думать :",85,7,4
6569,2065,"« Чёрт возьми , это как будто про меня … »",85,7,5
6570,2065,"Вот полстраны и поёживалось , переживая нравственный выбор обмена и алчную борьбу за дачную сторожку , борьбу , которая оказалась бессмысленной , потому что на месте дачного посёлка , площадке амбициозных ристалищ , внешняя непреодолимая сила собралась строить пансионат .",85,7,6
6571,2066,"Так вот всё это упорно называлось словом « быт » .",85,8,1
6572,2066,"Что , с одной стороны , было охранной грамотой Трифонова , с другой — его раздражало .",85,8,2
6573,2066,"В интервью Льву Аннинскому он говорил :",85,8,3
6574,2066,"« Я пишу о смерти ( « Обмен » ) — мне говорят , что я пишу о быте ; я пишу о любви ( « Долгое прощание » ) — говорят , что тоже о быте ; я пишу о распаде семьи ( « Предварительные итоги » ) — опять слышу про быт … »",85,8,4
6575,2066,"Бытом оказывалось всё то , что не являлось идеологически насыщенной или , скажем , производственной прозой .",85,8,5
6576,2066,"Вроде и не диссидентство никакое , но подлинно советской литературой , в « секретарском » смысле слова , это всё не назовёшь .",85,8,6
6577,2066,"« Какие-то вечные темы ! » — бросил Трифонову редактор в одном из « толстых » журналов .",85,8,7
6578,2066,"Вот именно что вечные , как мы теперь понимаем .",85,8,8
6579,2066,"Любовь , ненависть , предательство , распад под псевдонимом « быт » .",85,8,9
6580,2067,"И в персонажах Трифонова не было ничего специально изготовленного :",85,9,1
6581,2067,"« Иные читатели , может быть , опять поспешно назовут их мещанами .",85,9,2
6582,2067,"А они горожане , бог ты мой , горожане , и всё тут ! »",85,9,3
6583,2067,"Вот здесь , в этом самооправдании , — корни невероятной долговечности трифоновской прозы .",85,9,4
6584,2067,"Мы ведь тоже горожане , хотя и живём 30 , а то и 40 лет спустя …",85,9,5
6585,2068,"За два года до « Старика » жара стала климатическим фоном зачина самой знаменитой трифоновской повести « Дом на набережной » :",85,10,1
6586,2068,"« В один из нестерпимо жарких августовских дней 1972 года — Москва тем летом задыхалась от зноя и дымной мглы … »",85,10,2
6587,2068,"Совсем , как у Михаила Булгакова :",85,10,3
6588,2068,"« В час жаркого весеннего заката на Патриарших прудах … »",85,10,4
6589,2068,"И , как в « Старике » , действие закольцовывается и заканчивается осенью .",85,10,5
6590,2068,"Этот обруч держит повествование — Трифонов вообще мастер зачинов и концовок , они у него как отдельное произведение .",85,10,6
6591,2068,"« Образ той страшной московской жары , — объяснял писатель , — когда дымная мгла заволакивала небо , в этой вещи был совершенно необходим .",85,10,7
6592,2068,"Он всё сжимал , как обруч .",85,10,8
6593,2068,"В финале жара кончается .",85,10,9
6594,2068,"Обруч распался » .",85,10,10
6595,2069,"Во « Времени и месте » гораздо ближе , чем в « Доме на набережной » , Трифонов подошёл к другой главной теме — сталинизму .",85,11,1
6596,2069,"Подошёл настолько близко , что с публикацией романа возникли проблемы .",85,11,2
6597,2069,"Для него закончилась эпоха « московских повестей » и начинался новый творческий период — возвращение к монотеме , к прошлому , к аресту отца , определившему всю творческую , да и не только творческую жизнь Юрия Трифонова .",85,11,3
6598,2069,"Ещё ближе к самому откровенному и сокровенному он подступил в неоконченном романе « Исчезновение » .",85,11,4
6599,2070,"Последняя фраза рукописи , работу над которой прервала смерть ( « Исчезновение » не включили в четырёхтомник 1985 — 1987 годов , хотя на дворе уже была перестройка , а в 1985-м , под соусом 60-летия автора , опубликовали невинный фрагмент в « Литературке » ) , была такой , словно она специально предназначалась для величественной кончины :",85,12,1
6600,2070,"« Но прошло много лет … »",85,12,2
6601,2071,"Прошло много лет .",85,13,1
6602,2071,"И Юрий Трифонов остаётся главным советским послевоенным писателем и сохраняет статус автора актуального , глубже других проникающего в сознание современного человека .",85,13,2
6603,2071,"28 августа ему исполнилось бы 85 .",85,13,3
6604,2071,"Какой он старик .",85,13,4
6605,2071,"И как недавно , в сущности , состоялась эта жизнь , которую он прожил и описал .",85,13,5
6606,2071,"Жизнь , так поразительно похожая на нашу сегодняшнюю .",85,13,6
