"sent_pos","source"
97,"Впрочем , я тут же подумал , что это вообще относится ко всем отражениям , проекциям , и не так важно , знает ли аксолотль Хегеманн об аксолотле Кортасара ."
98,"Оба ― животные скорее экзотические , чем эзотерические ."
99,"И , кстати , чего в книге Хегеманн точно нет , так это эзотерики : героиня её сразу же чувствует и на дух не переносит ."
100,"Хотя , впрочем … « Смерть для меня ― это что-то слишком эзотеричное » , ― говорит она ."
101,"« Что же тут эзотеричного ?"
102,"― спрашивает её подруга ."
103,"― Смерть есть смерть , точка » ."
104,"― « Да … ты права , наверно » ."
105,"Дистанция В каком-то из интервью Хегеманн призывала не идентифицировать себя со своей героиней ."
106,"Говорила , что это скорее был « такой эксперимент » ."
107,"После того как оказалось , что описание некоторых « стробоскопических эффектов » она позаимствовала из книги Strobo , охотно веришь , что между нею и Мифти существует то , что раньше , по крайней мере , считали одним из необходимых условий возникновения литературы : дистанция ."
108,"И когда читаешь интервью с « обкраденным блогером » , который восклицает « То , что для неё роман , ― для меня моя жизнь ."
109,"Я всё это переживал на самом деле !"
110,"» ― а потом читаешь , после книги Хегеманн , его книгу , то видишь разницу и понимаешь , как важно это требование хотя бы короткой , но всё-таки дистанции между автором и героем , между автором и Ich-Erzähler ( рассказчиком ) ."
111,"Да , наверно , отстранение всё-таки сохраняется , или , точнее , работает , и всё это обстоит вовсе не так , что якобы это сохранение дистанции нужно только тем , кто хочет , чтобы всё оставалось на своих местах ."
112,"Всё и все ."
113,"Хотя так считает по крайней мере половина « расколотой нации » , видя во всей этой истории вокруг Хегеманн ещё одну манифестацию вседозволенности богемы , связанной с « литературным истеблишментом » и со средствами медиа ."
114,"Серьёзные дяди , критики , да , писали статьи в таком духе , что вундеркинд вунеркиндом ( вундеркинд , кстати , даже не потому , что написала в семнадцать лет книгу , а потому , что в двенадцать лет ― пьесу , которую поставили в театре , а в пятнадцать ― сценарий фильма ) , а неплохо бы … Ну , как в стихотворении Давида Самойлова , « и кто сказал , что гения нельзя пороть » … После чего звучал ответ из лагеря энтузиастов и сторонников книги , в котором было много таких творческих людей , как Дюрс Грюнбайн и Максим Биллер … А на следующий день снова : « богэма » , « вседозволенность » , « плагиат есть плагиат есть плагиат » , ― и этот спор , казалось , никогда не умолкнет ."
115,"Но вот он наконец умолк , а книгу я тем временем дочитал , убедившись , что ответ на вопрос , который был у меня перед этим , на самом деле не имеет никакого значения ."
116,"И вот уже совсем ни к чему ( ну , может быть , выплыло , потому что задумался о дистанциях ) вспомнились строчки одного писателя , который мало того , что сам дистанцию не сохранял , так был ещё и уверен , что её не существует и между другими авторами и их героями ."
117,"Поэтому , описывая в стародавней прозе свою тогдашнюю рабочую комнату , ну , какую-то там контору эпохи застоя , он писал , что там стоит аквариум , « в котором живёт Кортасар » ."
118,"Только об этом знает он один ― автор тех , не этих строчек ."
119,"Ну , то есть вот , насколько я помню , примерно так он тогда писал : « … ведь никто же не знает , что это тот самый аксолотль , который Кортасар » ."
