"sent_id","par_id","source","book_id","par_pos","sent_pos"
10332,3283,"Группа хакеров заявила, что взломала официальный сайт Центрального разведывательного управления Соединённых Штатов Америки.",169,1,1
10333,3283,"Интернет-портал ЦРУ перестал быть доступен для пользователей в среду вечером.",169,1,2
10334,3283,"Команда компьютерных взломщиков, известная под названием Lulz Security (в «послужном списке» которой уже имеется несколько громких дел) в сообщении в сети Твиттер заявила «Танго кончилось – ЦРУ точка gov».",169,1,3
10335,3284,"Lulz Security сообщила только об атаке на сайт ЦРУ.",169,2,1
10336,3284,"В среду вечером не было никаких подтверждений того, что хакеры получили доступ к секретным данным во внутренней компьютерной сети ЦРУ.",169,2,2
10337,3284,"Группа ранее уже брала на себя ответственность за атаки на вебсайты Сената США, компаний Sony, Nintendo и телевизионной системы общественного вещания.",169,2,3
10338,3285,"Предполагается, что члены этой группы живут в разных странах.",169,3,1
10339,3285,"Группа заявляет, что своими действиями пытается продемонстрировать слабость систем кибербезопасности.",169,3,2
