"sent_pos","source"
367,"«Я первое лето провела с ребенком на даче, муж приезжал только на выходные."
368,"Как же было тяжело!"
369,"Я просто плакала от усталости» Дача с удобствами, ни кур, ни коровы, ни огорода, ребенок вполне здоровый, муж на машине привозит продукты и памперсы."
370,"Но как же тяжело!"
371,"А как же не тяжело, если известны заранее условия задачи: «жизнь положить, ночей не спать, здоровье угробить»."
372,"Тут уж хочешь - не хочешь… Эта установка заставляет ребенка бояться и избегать."
373,"В результате мама, даже сидя с ребенком, почти с ним не общается и он откровенно тоскует."
374,"Нанимаются няни, они меняются, когда ребенок начинает к ним привязываться – ревность!"
375,"– и вот уже мы получаем новый круг – депривированого, недолюбленного ребенка, чем-то очень похожего на того, военного, только войны никакой нет."
376,"Призовой забег."
377,"Посмотрите на детей в каком-нибудь дорогом пансионе полного содержания."
378,"Тики, энурез, вспышки агрессии, истерики, манипуляции."
379,"Детдом, только с английским и теннисом."
380,"А у кого нет денег на пансион, тех на детской площадке в спальном районе можно увидеть."
381,"«Куда полез, идиот, сейчас получишь, я потом стирать должна, да?» Ну, и так далее, «сил моих на тебя нет, глаза б мои тебя не видели», с неподдельной ненавистью в голосе."
382,"Почему ненависть?"
383,"Так он же палач!"
384,"Он же пришел, чтобы забрать жизнь, здоровье, молодость, так сама мама сказала!"
385,"Другой вариант сценария разворачивает, когда берет верх еще одна коварная установка гиперотвественных: все должно быть ПРАВИЛЬНО!"
386,"Наилучшим образом!"
387,"И это – отдельная песня."
388,"Рано освоившие родительскую роль «дяди Федоры» часто бывают помешаны на сознательном родительстве."
389,"Господи, если они осилили в свое время родительскую роль по отношению к собственным папе с мамой, неужели своих детей не смогут воспитать по высшему разряду?"
390,"Сбалансированное питание, гимнастика для грудничков, развивающие занятия с года, английский с трех."
391,"Литература для родителей, читаем, думаем, пробуем."
392,"Быть последовательными, находить общий язык, не выходить из себя, все объяснять, ЗАНИМАТЬСЯ РЕБЕНКОМ."
393,"И вечная тревога, привычная с детства – а вдруг что не так?"
394,"А вдруг что-то не учли?"
395,"а если можно было и лучше?"
396,"И почему мне не хватает терпения?"
397,"И что ж я за мать (отец)?"
398,"В общем, если поколение детей войны жило в уверенности, что они – прекрасные родители, каких поискать, и у их детей счастливое детство, то поколение гиперотвественных почти поголовно поражено «родительским неврозом»."
399,"Они (мы) уверены, что они чего-то не учли, не доделали, мало «занимались ребенком (еще и работать посмели, и карьеру строить, матери-ехидны), они (мы) тотально не уверенны в себе как в родителях, всегда недовольны школой, врачами, обществом, всегда хотят для своих детей больше и лучше."
400,"Несколько дней назад мне звонила знакомая – из Канады!"
401,"– с тревожным вопросом: дочка в 4 года не читает, что делать?"
402,"Эти тревожные глаза мам при встрече с учительницей – у моего не получаются столбики!"
403,"«А-а-а, мы все умрем!», как любит говорить мой сын, представитель следующего, пофигистичного, поколения."
404,"И он еще не самый яркий, так как его спасла непроходимая лень родителей и то, что мне попалась в свое время книжка Никитиных, где говорилось прямым текстом: мамашки, не парьтесь, делайте как вам приятно и удобно и все с дитем будет хорошо."
405,"Там еще много всякого говорилось, что надо в специальные кубики играть и всяко развивать, но это я благополучно пропустила:) Оно само развилось до вполне приличных масштабов."
406,"К сожалению, у многих с ленью оказалось слабовато."
407,"И родительствовали они со страшной силой и по полной программе."
408,"Результат невеселый, сейчас вал обращений с текстом «Он ничего не хочет."
409,"Лежит на диване, не работает и не учится."
410,"Сидит, уставившись в компьютер."
411,"Ни за что не желает отвечать."
412,"На все попытки поговорить огрызается.»."
413,"А чего ему хотеть, если за него уже все отхотели?"
414,"За что ему отвечать, если рядом родители, которых хлебом не корми – дай поотвечать за кого-нибудь?"
415,"Хорошо, если просто лежит на диване, а не наркотики принимает."
416,"Не покормить недельку, так, может, встанет."
417,"Если уже принимает – все хуже."
418,"Но это поколение еще только входит в жизнь, не будем пока на него ярлыки вешать."
419,"Жизнь покажет."
420,"Чем дальше, чем больше размываются «берега», множатся, дробятся, причудлво преломляются последствия пережитого."
421,"Думаю, к четвертому поколению уже гораздо важнее конкретный семейный контекст, чем глобальная прошлая травма."
422,"Но нельзя не видеть, что много из сегодняшнего дня все же растет из прошлого."
