"sent_pos","source"
204,"Искренне считали, что ничего не должны «этой истеричке», которая осталась с их ребенком, и на каком-то глубинном уровне, может, были и правы, потому что нередко женщины просто юзали их, как осеменителей, и дети были им нужнее, чем мужики."
205,"Так что еще вопрос, кто кому должен."
206,"Обида, которую чувствовал мужчина, позволяла легко договориться с совестью и забить, а если этого не хватало, так вот ведь водка всюду продается."
207,"Ох, эти разводы семидесятых -- болезненные, жестокие, с запретом видеться с детьми, с разрывом всех отношений, с оскорблениями и обвинениями."
208,"Мучительное разочарование двух недолюбленных детей, которые так хотели любви и счастья, столько надежд возлагали друг на друга, а он/она – обманул/а, все не так, сволочь, сука, мразь… Они не умели налаживать в семье круговорот любви, каждый был голоден и хотел получать, или хотел только отдавать, но за это – власти."
209,"Они страшно боялись одиночества, но именно к нему шли, просто потому, что, кроме одиночества никогда ничего не видели."
210,"В результате – обиды, душевные раны, еще больше разрушенное здоровье, женщины еще больше зацикливаются на детях, мужчины еще больше пьют."
211,"У мужчин на все это накладывалась идентификация с погибшими и исчезнувшими отцами."
212,"Потому что мальчику надо, жизненно необходимо походить на отца."
213,"А что делать, если единственное, что о нем известно – что он погиб?"
214,"Был очень смелым, дрался с врагами – и погиб?"
215,"Или того хуже – известно только, что умер?"
216,"И о нем в доме не говорят, потому что он пропал без вести, или был репрессирован?"
217,"Сгинул – вот и вся информация?"
218,"Что остается молодому парню, кроме суицидального поведения?"
219,"Выпивка, драки, сигареты по три пачки в день, гонки на мотоциклах, работа до инфаркта."
220,"Мой отец был в молодости монтажник-высотник."
221,"Любимая фишка была – работать на высоте без страховки."
222,"Ну, и все остальное тоже, выпивка, курение, язва."
223,"Развод, конечно, и не один."
224,"В 50 лет инфаркт и смерть."
225,"Его отец пропал без вести, ушел на фронт еще до рождения сына."
226,"Неизвестно ничего, кроме имени, ни одной фотографии, ничего."
227,"Вот в таком примерно антураже растут детки, третье уже поколение."
228,"В моем классе больше, чем у половины детей родители были в разводе, а из тех, кто жил вместе, может быть, только в двух или трех семьях было похоже на супружеское счастье."
229,"Помню, как моя институтская подруга рассказывала, что ее родители в обнимку смотрят телевизор и целуются при этом."
230,"Ей было 18, родили ее рано, то есть родителям было 36-37."
231,"Мы все были изумлены."
232,"Ненормальные, что ли?"
233,"Так не бывает!"
234,"Естественно, соответствующий набор слоганов: «Все мужики – сволочи», «Все бабы – суки», «Хорошее дело браком не назовут»."
235,"А что, жизнь подтверждала."
236,"Куда ни глянь… Но случилось и хорошее."
237,"В конце 60-х матери получили возможность сидеть с детьми до года."
238,"Они больше не считались при этом тунеядками."
239,"Вот кому бы памятник поставить, так автору этого нововведения."
240,"Не знаю только, кто он."
241,"Конечно, в год все равно приходилось отдавать, и это травмировало, но это уже несопоставимо, и об этой травме в следующий раз."
242,"А так-то дети счастливо миновали самую страшную угрозу депривации, самую калечащую – до года."
243,"Ну, и обычно народ крутился еще потом, то мама отпуск возьмет, то бабушки по очереди, еще выигрывали чуток."
244,"Такая вот игра постоянная была – семья против «подступающей ночи», против «Страшной бабы», против железной пятки Родины-матери."
245,"Такие кошки-мышки."
246,"А еще случилось хорошее – отдельно жилье стало появляться."
247,"Хрущобы пресловутые."
248,"Тоже поставим когда-нибудь памятник этим хлипким бетонным стеночкам, которые огромную роль выполнили – прикрыли наконец семью от всевидящего ока государства и общества."
249,"Хоть и слышно было все сквозь них, а все ж какая-никакая – автономия."
250,"Граница."
251,"Защита."
252,"Берлога."
253,"Шанс на восстановление."
254,"Третье поколение начинает свою взрослую жизнь со своим набором травм, но и со своим довольно большим ресурсом."
255,"Нас любили."
256,"Пусть не так, как велят психологи, но искренне и много."
257,"У нас были отцы."
258,"Пусть пьющие и/или «подкаблучники» и/или «бросившие мать козлы» в большинстве, но у них было имя, лицо и они нас тоже по своему любили."
259,"Наши родители не были жестоки."
260,"У нас был дом, родные стены."
261,"Не у все все одинаково, конечно, были семье более и менее счастливые и благополучные."
262,"Но в общем и целом."
263,"Короче, с нас причитается."
264,"Итак, третье поколение."
265,"Не буду здесь жестко привязываться к годам рождения, потому что кого-то родили в 18, кого-то – в 34, чем дальше, тем больше размываются отчетливые «берега» потока."
266,"Здесь важна передача сценария, а возраст может быть от 50 до 30."
267,"Короче, внуки военного поколения, дети детей войны."
268,"«С нас причитается» - это, в общем, девиз третьего поколения."
269,"Поколения детей, вынужденно ставших родителями собственных родителей."
270,"В психологи такое называется «парентификация»."
271,"А что было делать?"
272,"Недолюбленные дети войны распространяли вокруг столь мощные флюиды беспомощности, что не откликнуться было невозможно."
273,"Поэтому дети третьего поколения были не о годам самостоятельны и чувствовали постоянную ответственность за родителей."
274,"Детство с ключом на шее, с первого класса самостоятельно в школу – в музыкалку – в магазин, если через пустырь или гаражи – тоже ничего."
275,"Уроки сами, суп разогреть сами, мы умеем."
276,"Главное, чтобы мама не расстраивалась."
277,"Очень показательны воспоминания о детстве: «Я ничего у родителей не просила, всегда понимала, что денег мало, старалась как-то зашить, обойтись», «Я один раз очень сильно ударился головой в школе, было плохо, тошнило, но маме не сказал – боялся расстроить."
278,"Видимо, было сотрясение, и последствия есть до сих пор», «Ко мне сосед приставал, лапать пытался, то свое хозяйство показывал."
279,"Но я маме не говорила, боялась, что ей плохо с сердцем станет», «Я очень по отцу тосковал, даже плакал потихоньку."
280,"Но маме говорил, что мне хорошо и он мне совсем не нужен."
281,"Она очень зилась на него после развода»."
282,"У Дины Рубинной есть такой рассказ пронзительный «Терновник»."
283,"Классика: разведенная мама, шестилетний сын, самоотверженно изображающий равнодушие к отцу, которого страстно любит."
284,"Вдвоем с мамой, свернувшись калачиком, в своей маленькой берлоге против чужого зимнего мира."
285,"И это все вполне благополучные семьи, бывало и так, что дети искали пьяных отцов по канавам и на себе притаскивали домой, а мамочку из петли вытаскивали собственными руками или таблетки от нее прятали."
286,"Лет эдак в восемь."
287,"А еще разводы, как мы помним, или жизнь в стиле кошка с собакой» (ради детей, конечно)."
288,"И дети-посредники, миротворцы, которые душу готовы продать, чтобы помирить родителей, чтобы склеить снова семейное хрупкое благополучие."
289,"Не жаловаться, не обострять, не отсвечивать, а то папа рассердится, а мама заплачет, и скажет, что «лучше бы ей сдохнуть, чем так жить», а это очень страшно."
290,"Научиться предвидеть, сглаживать углы, разряжать обстановку."
291,"Быть всегда бдительным, присматривать за семьей."
292,"Ибо больше некому."
293,"Символом поколения можно считать мальчика дядю Федора из смешного мультика."
294,"Смешной-то смешной, да не очень."
295,"Мальчик-то из всей семьи самый взрослый."
296,"А он еще и в школу не ходит, значит, семи нет."
297,"Уехал в деревню, живет там сам, но о родителях волнуется."
298,"Они только в обморок падают, капли сердечные пьют и руками беспомощно разводят."
299,"Или помните мальчика Рому из фильма «Вам и не снилось»?"
300,"Ему 16, и он единственный взрослый из всех героев фильма."
301,"Его родители – типичные «дети войны», родители девочки – «вечные подростки», учительница, бабушка… Этих утешить, тут поддержать, тех помирить, там помочь, здесь слезы вытереть."
302,"И все это на фоне причитаний взрослых, мол, рано еще для любви."
303,"Ага, а их всех нянчить – в самый раз."
304,"Так все детство."
305,"А когда настала пора вырасти и оставить дом – муки невозможной сепарации, и вина, вина, вина, пополам со злостью, и выбор очень веселый: отделись – и это убьет мамочку, или останься и умри как личность сам."
306,"Впрочем, если ты останешься, тебе все время будут говорить, что нужно устраивать собственную жизнь, и что ты все делаешь не так, нехорошо и неправильно, иначе уже давно была бы своя семья."
307,"При появлении любого кандидата он, естественно, оказывался бы никуда не годным, и против него начиналась бы долгая подспудная война до победного конца."
308,"Про это все столько есть фильмов и книг, что даже перечислять не буду."
309,"Интересно, что при все при этом и сами они, и их родители воспринимали свое детство как вполне хорошее."
310,"В самом деле: дети любимые, родители живы, жизнь вполне благополучная."
311,"Впервые за долгие годы – счастливое детство без голода, эпидемий, войны и всего такого."
312,"Ну, почти счастливое."
313,"Потому что еще были детский сад, часто с пятидневкой, и школа, и лагеря и прочие прелести советского детства, которые были кому в масть, а кому и не очень."
314,"И насилия там было немало, и унижений, а родители-то беспомощные, защитить не могли."
315,"Или даже на самом деле могли бы, но дети к ним не обращались, берегли."
316,"Я вот ни разу маме не рассказывала, что детском саду тряпкой по морде бьют и перловку через рвотные спазмы в рот пихают."
317,"Хотя теперь, задним числом, понимаю, что она бы, пожалуй, этот сад разнесла бы по камешку."
318,"Но тогда мне казалось – нельзя."
319,"Это вечная проблема – ребенок некритичен, он не может здраво оценить реальное положение дел."
320,"Он все всегда принимает на свой счет и сильно преувеличивает."
321,"И всегда готов принести себя в жертву."
322,"Так же, как дети войны приняли обычные усталость и горе за нелюбовь, так же их дети принимали некоторую невзрослость пап и мам за полную уязвимость и беспомощность."
323,"Хотя не было этого в большинстве случаев, и вполне могли родители за детей постоять, и не рассыпались бы, не умерили от сердечного приступа."
324,"И соседа бы укоротили, и няньку, и купили бы что надо, и разрешили с папой видеться."
325,"Но – дети боялись."
326,"Преувеличивали, перестраховывались."
327,"Иногда потом, когда все раскрывалось, родители в ужасе спрашивали: «Ну, почему ты мне сказал?"
328,"Да я бы, конечно…» Нет ответа."
329,"Потому что – нельзя."
330,"Так чувствовалось, и все."
331,"Третье поколение стало поколением тревоги, вины, гиперотвественности."
332,"У всего этого были свои плюсы, именно эти люди сейчас успешны в самых разных областях, именно они умеют договариваться и учитывать разные точки зрения."
333,"Предвидеть, быть бдительными, принимать решения самостоятельно, не ждать помощи извне – сильные стороны."
334,"Беречь, заботиться, опекать."
335,"Но есть у гиперотвественности, как у всякого «гипер» и другая сторона."
336,"Если внутреннему ребенку военных детей не хватало любви и безопасности, то внутреннему ребенку «поколения дяди Федора» не хватало детскости, беззаботности."
337,"А внутренний ребенок – он свое возьмет по-любому, он такой."
338,"Ну и берет."
339,"Именно у людей этого поколения часто наблюдается такая штука, как «агрессивно-пассивное поведение»."
340,"Это значит, что в ситуации «надо, но не хочется» человек не протестует открыто: «не хочу и не буду!», но и не смиряется «ну, надо, так надо»."
341,"Он всякими разными, порой весьма изобретательными способами, устраивает саботаж."
342,"Забывает, откладывает на потом, не успевает, обещает и не делает, опаздывает везде и всюду и т. п. Ох, начальники от этого воют прямо: ну, такой хороший специалист, профи, умница, талант, но такой неорганизованный… Часто люди этого поколения отмечают у себя чувство, что они старше окружающих, даже пожилых людей."
343,"И при этом сами не ощущают себя «вполне взрослыми», нет «чувства зрелости»."
344,"Молодость как-то прыжком переходит в пожилой возраст."
345,"И обратно, иногда по нескольку раз в день."
346,"Еще заметно сказываются последствия «слияния» с родителями, всего этого «жить жизнью ребенка»."
347,"Многие вспоминают, что в детстве родители и/или бабушки не терпели закрытых дверей: «Ты что, что-то скрываешь?»."
348,"А врезать в свою дверь защелку было равносильно «плевку в лицо матери»."
349,"Ну, о том, что нормально проверить карманы, стол, портфель и прочитать личный дневник... Редко какие родители считали это неприемлемым."
350,"Про сад и школу вообще молчу, одни туалеты чего стоили, какие нафиг границы… В результате дети, выросший в ситуации постоянного нарушения границ, потом блюдут эти границы сверхревностно."
351,"Редко ходят в гости и редко приглашают к себе."
352,"Напрягает ночевка в гостях (хотя раньше это было обычным делом)."
353,"Не знают соседей и не хотят знать – а вдруг те начнут в друзья набиваться?"
354,"Мучительно переносят любое вынужденное соседство (например, в купе, в номере гостиницы), потому что не знают, не умеют ставить границы легко и естественно, получая при этом удовольствие от общения, и ставят «противотанковые ежи» на дальних подступах."
355,"А что с семьей?"
356,"Большинство и сейчас еще в сложных отношения со своими родителями (или их памятью), у многих не получилось с прочным браком, или получилось не с первой попытки, а только после отделения (внутреннего) от родителей."
357,"Конечно, полученные и усвоенный в детстве установки про то, что мужики только и ждут, чтобы «поматросить и бросить», а бабы только и стремятся, что «подмять под себя», счастью в личной жизни не способствуют."
358,"Но появилась способность «выяснять отношения», слышать друг друга, договариваться."
359,"Разводы стали чаще, поскольку перестали восприниматься как катастрофа и крушение всей жизни, но они обычно менее кровавые, все чаще разведенные супруги могут потом вполне конструктивно общаться и вместе заниматься детьми."
360,"Часто первый ребенок появлялся в быстротечном «осеменительском» браке, воспроизводилась родительская модель."
361,"Потом ребенок отдавался полностью или частично бабушке в виде «откупа», а мама получала шанс таки отделиться и начать жить своей жизнью."
362,"Кроме идеи утешить бабушку, здесь еще играет роль многократно слышанное в детстве «я на тебя жизнь положила»."
363,"То есть люди выросли с установкой, что растить ребенка, даже одного – это нечто нереально сложное и героическое."
364,"Часто приходится слышать воспоминания, как тяжело было с первенцем."
365,"Даже у тех, кто родил уже в эпоху памперсов, питания в баночках, стиральных машин-автоматов и прочих прибамбасов."
366,"Не говоря уже о центральном отоплении, горячей воде и прочих благах цивилизации."
