"sent_pos","source"
0,"Как же она все-таки передается, травма?"
1,"Понятно, что можно всегда все объяснить «потоком», «переплетениями», «родовой памятью» и т. д., и, вполне возможно, что совсем без мистики и не обойдешься, но если попробовать?"
2,"Взять только самый понятный, чисто семейный аспект, родительско-детские отношения, без политики и идеологии."
3,"О них потом как-нибудь."
4,"Живет себе семья."
5,"Молодая совсем, только поженились, ждут ребеночка."
6,"Или только родили."
7,"А может, даже двоих успели."
8,"Любят, счастливы, полны надежд."
9,"И тут случается катастрофа."
10,"Маховики истории сдвинулись с места и пошли перемалывать народ."
11,"Чаще всего первыми в жернова попадают мужчины."
12,"Революции, войны, репрессии – первый удар по ним."
13,"И вот уже молодая мать осталась одна."
14,"Ее удел – постоянная тревога, непосильный труд (нужно и работать, и ребенка растить), никаких особых радостей."
15,"Похоронка, «десять лет без права переписки», или просто долгое отсутствие без вестей, такое, что надежда тает."
16,"Может быть, это и не про мужа, а про брата, отца, других близких."
17,"Каково состояние матери?"
18,"Она вынуждена держать себя в руках, она не может толком отдаться горю."
19,"На ней ребенок (дети), и еще много всего."
20,"Изнутри раздирает боль, а выразить ее невозможно, плакать нельзя, «раскисать» нельзя."
21,"И она каменеет."
22,"Застывает в стоическом напряжении, отключает чувства, живет, стиснув зубы и собрав волю в кулак, делает все на автомате."
23,"Или, того хуже, погружается в скрытую депрессию, ходит, делает, что положено, хотя сама хочет только одного – лечь и умереть."
24,"Ее лицо представляет собой застывшую маску, ее руки тяжелы и не гнутся."
25,"Ей физически больно отвечать на улыбку ребенка, она минимизирует общение с ним, не отвечает на его лепет."
26,"Ребенок проснулся ночью, окликнул ее – а она глухо воет в подушку."
27,"Иногда прорывается гнев."
28,"Он подполз или подошел, теребит ее, хочет внимания и ласки, она когда может, отвечает через силу, но иногда вдруг как зарычит: «Да, отстань же» , как оттолкнет, что он аж отлетит."
29,"Нет, она не него злится – на судьбу, на свою поломанную жизнь, на того, кто ушел и оставил и больше не поможет."
30,"Только вот ребенок не знает всей подноготной происходящего."
31,"Ему не говорят, что случилось (особенно если он мал)."
32,"Или он даже знает, но понять не может."
33,"Единственное объяснение, которое ему в принципе может прийти в голову: мама меня не любит, я ей мешаю, лучше бы меня не было."
34,"Его личность не может полноценно формироваться без постоянного эмоционального контакта с матерью, без обмена с ней взглядами, улыбками, звуками, ласками, без того, чтобы читать ее лицо, распознавать оттенки чувств в голосе."
35,"Это необходимо, заложено природой, это главная задача младенчества."
36,"А что делать, если у матери на лице депрессивная маска?"
37,"Если ее голос однообразно тусклый от горя, или напряжено звенящий от тревоги?"
38,"Пока мать рвет жилы, чтобы ребенок элементарно выжил, не умер от голода или болезни, он растет себе, уже травмированный."
39,"Не уверенный, что его любят, не уверенный, что он нужен, с плохо развитой эмпатией."
40,"Даже интеллект нарушается в условиях депривации."
41,"Помните картину «Опять двойка»?"
42,"Она написана в 51."
43,"Главному герою лет 11 на вид."
44,"Ребенок войны, травмированный больше, чем старшая сестра, захватившая первые годы нормальной семейной жизни, и младший брат, любимое дитя послевоенной радости – отец живой вернулся."
45,"На стене – трофейные часы."
46,"А мальчику трудно учиться."
47,"Конечно, у всех все по-разному."
48,"Запас душевных сил у разных женщин разный."
49,"Острота горя разная."
50,"Характер разный."
51,"Хорошо, если у матери есть источники поддержки – семья, друзья, старшие дети."
52,"А если нет?"
53,"Если семья оказалась в изоляции, как «враги народа», или в эвакуации в незнакомом месте?"
54,"Тут или умирай, или каменей, а как еще выжить?"
55,"Идут годы, очень трудные годы, и женщина научается жить без мужа."
56,"«Я и лошадь, я и бык, я и баба, и мужик»."
57,"Конь в юбке."
58,"Баба с яйцами."
59,"Назовите как хотите, суть одна."
60,"Это человек, который нес-нес непосильную ношу, да и привык."
61,"Адаптировался."
62,"И по-другому уже просто не умеет."
63,"Многие помнят, наверное, бабушек, которые просто физически не могли сидеть без дела."
64,"Уже старенькие совсем, все хлопотали, все таскали сумки, все пытались рубить дрова."
65,"Это стало способом справляться с жизнью."
66,"Кстати, многие из них стали настолько стальными – да, вот такая вот звукопись – что прожили очень долго, их и болезни не брали, и старость."
67,"И сейчас еще живы, дай им Бог здоровья."
68,"В самом крайнем своем выражении, при самом ужасном стечении событий, такая женщина превращалась в монстра, способного убить своей заботой."
69,"И продолжала быть железной, даже если уже не было такой необходимости, даже если потом снова жила с мужем, и детям ничего не угрожало."
70,"Словно зарок выполняла."
71,"Ярчайший образ описан в книге Павла Санаева «Похороните меня за плинтусом»."
72,"А вот что пишет о «Страшной бабе» Екатерина Михайлова («Я у себя одна» книжка называется): «Тусклые волосы, сжатый в ниточку рот…, чугунный шаг… Скупая, подозрительная, беспощадная, бесчувственная."
73,"Она всегда готова попрекнуть куском или отвесить оплеуху: «Не напасешься на вас, паразитов."
74,"Ешь, давай!»…."
75,"Ни капли молока не выжать из ее сосцов, вся она сухая и жесткая…» Там еще много очень точного сказано, и если кто не читал эти две книги, то надо обязательно."
76,"Самое страшное в этой патологически измененной женщине – не грубость, и не властность."
77,"Самое страшное – любовь."
78,"Когда, читая Санаева, понимаешь, что это повесть о любви, о такой вот изуродованной любви, вот когда мороз-то продирает."
79,"У меня была подружка в детстве, поздний ребенок матери, подростком пережившей блокаду."
80,"Она рассказывала, как ее кормили, зажав голову между голенями и вливая в рот бульон."
81,"Потому что ребенок больше не хотел и не мог, а мать и бабушка считали, что надо."
82,"Их так пережитый голод изнутри грыз, что плач живой девочки, родной, любимой, голос этого голода перекрыть не мог."
83,"А другую мою подружку мама брала с собой, когда делала подпольные аборты."
84,"И она показывала маленькой дочке полный крови унитаз со словами: вот, смотри, мужики-то, что они с нами делают."
85,"Вот она, женская наша доля."
86,"Хотела ли она травмировать дочь?"
87,"Нет, только уберечь."
88,"Это была любовь."
89,"А самое ужасное – что черты «Страшной бабы» носит вся наша система защиты детей до сих пор."
90,"Медицина, школа, органы опеки."
91,"Главное – чтобы ребенок был «в порядке»."
92,"Чтобы тело было в безопасности."
93,"Душа, чувства, привязанности – не до этого."
94,"Спасти любой ценой."
95,"Накормить и вылечить."
96,"Очень-очень медленно это выветривается, а нам-то в детстве по полной досталось, няньку, которая половой тряпкой по лицу била, кто не спал днем, очень хорошо помню."
97,"Но оставим в стороне крайние случаи."
98,"Просто женщина, просто мама."
99,"Просто горе."
100,"Просто ребенок, выросший с подозрением, что не нужен и нелюбим, хотя это неправда и ради него только и выжила мама и вытерпела все."
101,"И он растет, стараясь заслужить любовь, раз она ему не положена даром."
102,"Помогает."
103,"Ничего не требует."
104,"Сам собой занят."
105,"За младшими смотрит."
106,"Добивается успехов."
107,"Очень старается быть полезным."
108,"Только полезных любят."
109,"Только удобных и правильных."
110,"Тех, кто и уроки сам сделает, и пол в доме помоет, и младших уложит, ужин к приходу матери приготовит."
111,"Слышали, наверное, не раз такого рода расказы про послевоенное детство?"
112,"""Нам в голову прийти не могло так с матерью разговаривать!"""
113,"-- это о современной молодежи."
114,"Еще бы."
115,"Еще бы."
116,"Во-первых, у железной женщины и рука тяжелая."
117,"А во-вторых -- кто ж будет рисковать крохами тепла и близости?"
118,"Это роскошь, знаете ли, родителям грубить."
119,"Травма пошла на следующий виток."
120,"Настанет время, и сам этот ребенок создаст семью, родит детей."
121,"Годах примерно так в 60-х."
122,"Кто-то так был «прокатан» железной матерью, что оказывался способен лишь воспроизводить ее стиль поведения."
123,"Надо еще не забывать, что матерей-то многие дети не очень сильно и видели, в два месяца – ясли, потом пятидневка, все лето – с садом на даче и т ."
124,"д. То есть «прокатывала» не только семья, но и учреждения, в которых «Страшных баб» завсегда хватало."
125,"Но рассмотрим вариант более благополучный."
126,"Ребенок был травмирован горем матери, но вовсе душу ему не отморозило."
127,"А тут вообще мир и оттепель, и в космос полетели, и так хочется жить, и любить, и быть любимым."
128,"Впервые взяв на руки собственного, маленького и теплого ребенка, молодая мама вдруг понимает: вот он."
129,"Вот тот, кто наконец-то полюбит ее по-настоящему, кому она действительно нужна."
130,"С этого момента ее жизнь обретает новый смысл."
131,"Она живет ради детей."
132,"Или ради одного ребенка, которого она любит так страстно, что и помыслить не может разделить эту любовь еще на кого-то."
133,"Она ссорится с собственной матерью, которая пытается отстегать внука крапивой – так нельзя."
134,"Она обнимает и целует свое дитя, и спит с ним вместе, и не надышится на него, и только сейчас, задним числом осознает, как многого она сама была лишена в детстве."
135,"Она поглощена этим новым чувством полностью, все ее надежды, чаяния – все в этом ребенке."
136,"Она «живет его жизнью», его чувствами, интересами, тревогами."
137,"У них нет секретов друг о друга."
138,"С ним ей лучше, чем с кем бы то ни было другим."
139,"И только одно плохо – он растет."
140,"Стремительно растет, и что же потом?"
141,"Неужто снова одиночество?"
142,"Неужто снова – пустая постель?"
143,"Психоаналитики тут бы много чего сказали, про перемещенный эротизм и все такое, но мне сдается, что нет тут никакого эротизма особого."
144,"Лишь ребенок, который натерпелся одиноких ночей и больше не хочет."
145,"Настолько сильно не хочет, что у него разум отшибает."
146,"«Я не могу уснуть, пока ты не придешь»."
147,"Мне кажется, у нас в 60-70-е эту фразу чаще говорили мамы детям, а не наоборот."
148,"Что происходит с ребенком?"
149,"Он не может не откликнуться на страстный запрос его матери о любви."
150,"Это вывшее его сил."
151,"Он счастливо сливается с ней, он заботится, он боится за ее здоровье."
152,"Самое ужасное – когда мама плачет, или когда у нее болит сердце."
153,"Только не это."
154,"«Хорошо, я останусь, мама."
155,"Конечно, мама, мне совсем не хочется на эти танцы»."
156,"Но на самом деле хочется, ведь там любовь, самостоятельная жизнь, свобода, и обычно ребенок все-таки рвет связь, рвет больно, жестко, с кровью, потому что добровольно никто не отпустит."
157,"И уходит, унося с собой вину, а матери оставляя обиду."
158,"Ведь она «всю жизнь отдала, ночей не спала»."
159,"Она вложила всю себя, без остатка, а теперь предъявляет вексель, а ребенок не желает платить."
160,"Где справедливость?"
161,"Тут и наследство ""железной"" женщины пригождается, в ход идут скандалы, угрозы, давление."
162,"Как ни странно, это не худший вариант."
163,"Насилие порождает отпор и позволяет-таки отделиться, хоть и понеся потери."
164,"Некоторые ведут свою роль так искусно, что ребенок просто не в силах уйти."
165,"Зависимость, вина, страх за здоровье матери привязывают тысячами прочнейших нитей, про это есть пьеса Птушкиной «Пока она умирала», по которой гораздо более легкий фильм снят, там Васильева маму играет, а Янковский – претендента на дочь."
166,"Каждый Новый год показывают, наверное, видели все."
167,"А лучший – с точки зрения матери – вариант, если дочь все же сходит ненадолго замуж и останется с ребенком."
168,"И тогда сладкое единение можно перенести на внука и длить дальше, и, если повезет, хватит до самой смерти."
169,"И часто хватает, поскольку это поколение женщин гораздо менее здорово, они часто умирают намного раньше, чем их матери, прошедшие войну."
170,"Потому что стальной брони нет, а удары обиды разрушают сердце, ослабляют защиту от самых страшных болезней."
171,"Часто свои неполадки со здоровьем начинают использовать как неосознанную манипуляцию, а потом трудно не заиграться, и вдруг все оказывается по настоящему плохо."
172,"При этом сами они выросли без материнской внимательной нежной заботы, а значит, заботиться о себе не привыкли и не умеют, не лечатся, не умеют себя баловать, да, по большому счету, не считают себя такой уж большой ценностью, особенно если заболели и стали «бесполезны»."
173,"Но что-то мы все о женщинах, а где же мужчины?"
174,"Где отцы?"
175,"От кого-то же надо было детей родить?"
176,"С этим сложно."
177,"Девочка и мальчик, выросшие без отцов, создают семью."
178,"Они оба голодны на любовь и заботу."
179,"Она оба надеются получить их от партнера."
180,"Но единственная модель семьи, известная им – самодостаточная «баба с яйцами», которой, по большому счету, мужик не нужен."
181,"То есть классно, если есть, она его любит и все такое."
182,"Но по-настоящему он ни к чему, не пришей кобыле хвост, розочка на торте."
183,"«Посиди, дорогой, в сторонке, футбол посмотри, а то мешаешь полы мыть."
184,"Не играй с ребенком, ты его разгуливаешь, потом не уснет."
185,"Не трогай, ты все испортишь."
186,"Отойди, я сама» И все в таком духе."
187,"А мальчики-то тоже мамами выращены."
188,"Слушаться привыкли."
189,"Психоаналитики бы отметили еще, что с отцом за маму не конкурировали и потому мужчинами себя не почувствовали."
190,"Ну, и чисто физически в том же доме нередко присутствовала мать жены или мужа, а то и обе."
191,"А куда деваться?"
192,"Поди тут побудь мужчиной… Некоторые мужчины находили выход, становясь «второй мамой»."
193,"А то и единственной, потому что сама мама-то, как мы помним, «с яйцами» и железом погромыхивает."
194,"В самом хорошем варианте получалось что-то вроде папы дяди Федора: мягкий, заботливый, чуткий, все разрешающий."
195,"В промежуточном – трудоголик, который просто сбегал на работу от всего от этого."
196,"В плохом --- алкоголик."
197,"Потому что мужчине, который даром не нужен своей женщине, который все время слышит только «отойди, не мешай», а через запятую «что ты за отец, ты совершенно не занимаешься детьми» (читай «не занимаешься так, как Я считаю нужным»), остается или поменять женщину – а на кого, если все вокруг примерно такие?"
198,"– или уйти в забытье."
199,"С другой стороны, сам мужчина не имеет никакой внятной модели ответственного отцовства."
200,"На их глазах или в рассказах старших множество отцов просто встали однажды утром и ушли – и больше не вернулись."
201,"Вот так вот просто."
202,"И ничего, нормально."
203,"Поэтому многие мужчины считали совершенно естественным, что, уходя из семьи, они переставали иметь к ней отношение, не общались с детьми, не помогали."
