"sent_id","par_id","source","book_id","par_pos","sent_pos"
46154,14928,"Чище, но дороже",1672,1,1
46155,14928,"Власти готовят новый техрегламент по качеству питьевой воды.",1672,1,2
46156,14929,"Новые стандарты качества бутилированной воды могут быть введены в России уже через несколько месяцев, объявил председатель комитета Госдумы по экономической политике и предпринимательству, член правительственной комиссии по реализации государственной программы «Чистая вода» Евгений Фёдоров.",1672,2,1
46157,14929,"Сейчас готовится техрегламент, который определяет требования к бутилированной воде.",1672,2,2
46158,14929,"Кроме того, в Минздравсоцразвития обсуждается проект специального техрегламента по водопроводной воде.",1672,2,3
46159,14929,"При этом, как обещают, требования к воде будут даже выше, чем в странах Евросоюза: качество воды предлагается оценивать по 88 показателям, а в ЕС его оценивают по 48 показателям.",1672,2,4
46160,14930,"Авторы проекта считают, что введение высоких стандартов качества воды во многом позволит решить проблему качества и продолжительности жизни россиян.",1672,3,1
46161,14930,"При этом остаётся открытым вопрос, должен ли стандарт бытовой воды соответствовать стандарту питьевой воды.",1672,3,2
46162,14930,"С точки зрения здоровья это необходимо, но вода при этом подорожает примерно на треть.",1672,3,3
