"sent_id","par_id","source","book_id","par_pos","sent_pos"
107604,37557,"Yahoo! заглядывается на SUP",3936,1,1
107605,37558,"Алишер Усманов и Александр Мамут ведут переговоры о продаже части своей доли в компании SUP.",3936,2,1
107606,37559,"Владельцы компании SUP, владеющей сервисом блогов LiveJournal, сайтом Championat.com, Quto.ru и Redigo.ru, рекламным агентством +SOL, а также интернет-изданием Gazeta.ru, ведут переговоры о продаже части своей доли.",3936,3,1
107607,37559,"Покупкой доли в SUP, которую инвестбанки оценивают в сотни миллионов долларов, интересовался, в частности, американский интернет-гигант Yahoo!, пишет media-atlas.ru.",3936,3,2
107608,37560,"Источник в окружении Алишера Усманова поясняет, что SUP всегда был заинтересован в стратегическом партнёрстве с сильным иностранным игроком, который принесёт в компанию не только деньги, но и синергию, и технологическую экспертизу.",3936,4,1
107609,37560,"В состав SUP входят сервис блогов LiveJournal.com, общественно-политическое СМИ Gazeta.ru, спортивный сайт Championat.com, социальная сеть для болельщиков Fanat.ru, онлайн-сервис по подбору автомобилей Quto.ru, сайт о путешествиях Redigo.ru, а также селлинговое агентство +SOL (продаёт рекламу на сайтах SUP, а также порталах Kommersant.ru, Gismeteo, MSN, Eurosport, Kinopoisk.ru, Facebook, Babyblog, Translate, Promodj).",3936,4,2
107610,37560,"Финансовые показатели не раскрываются.",3936,4,3
107611,37560,"Общая выручка SUP в 2008 году оценивалась в 18—21 млн долларов.",3936,4,4
