"sent_pos","source"
0,"Правозащитные организации критикуют выпуск версии поисковой машины «Гугл» в Китае."
1,"«Общество народов, находящихся под угрозой» обвиняет «Гугл» в оппортунистической самоцензуре."
2,"Представитель организации «Репортёры без границ» говорит о позоре."
3,"Чтобы получить разрешение для организации китайской интернет страницы, «Гугл» согласился удалить адреса по определённым темам, таких как: Тайвань или демократические движения."
4,"Ещё раньше, под давлением властей Китая, оснастили свои поисковые машины соответствующими фильтрами также Yahoo и Microsoft."
