"sent_pos","source"
0,"2001—2010-й: книги, которые потрясали На арене — самые громкие авторы нулевых В список, представленный ниже, попали книги, по поводу которых шумели."
1,"Иногда шум был громким, иногда не очень, иногда почти неслышным, но всё-таки был."
2,"Но от качества книги уровень шума никак не зависел: он зависел от других, внелитературных факторов."
3,"2001-й."
4,"На прилавки книжных магазинов легла первая часть книги Александра Солженицына «Двести лет вместе» (М.: Русский путь, серия «Исследования новейшей русской истории»)."
5,"Том начинался беглым очерком о евреях на Руси — с древних времён до первого «значительного исторического скрещения еврейской и русской судьбы» при Екатерине II."
6,"А заканчивался 1916 годом."
7,"Цитата: «Сила их (евреев."
8,"— В.Ш.) развития, напора, таланта вселилась в русское общественное сознание."
9,"Понятия о наших целях, о наших интересах, импульсы к нашим решениям — мы слили с их понятиями."
10,"Мы приняли их взгляд на нашу историю и на выходы из неё»."
11,"Мысль чрезвычайно лестная для евреев, хотя и небесспорная."
12,"Тем не менее Солженицына обвинили в «просвещённом антисемитизме», в «оправдании погромной психологии» и т.п."
13,"Громче всех — Леонид Касис в статье «Еврейская энциклопедия — орган антисемитской мысли?"
14,"!» (НГ Ex libris, 12.07.2001)."
15,"Ему отвечала Наталья Солженицына, редактор книги: «Солженицын писал эту книгу, исходя «из доброжелательных поисков на будущее» и в надежде, что она «сослужит взаимному согласию» (НГ Ex libris, 17.07.2001)."
16,"2002-й."
17,"Вторую часть книги «Двести лет вместе», посвящённую такому близкому советскому времени (1917—1995), ожидали с болезненным нетерпением."
18,"Хотя там было всё то же, что в «Архипелаге ГУЛАГ»: евреи — большевики и чекисты, надзиратели и зэки."
19,"Цитата: «До лагерей и я так думал: «…никаких наций вообще нет, есть человечество."
20,"А в лагерь присылаешься и узнаёшь: если у тебя удачная нация — ты счастливчик, ты обеспечен, ты выжил!"
21,"Если общая нация — не обижайся."
22,"Ибо национальность — едва ли не главный признак, по которому зэки отбираются в спасительный корпус придурков… русские в «своих собственных русских» лагерях — опять последняя нация, как были у немцев…» И далее: евреи на Великой Отечественной, дело врачей, исход 1970-х, Александр Галич как абсолютное воплощение еврейского самосознания… Масштабный замысел Солженицына был перевернуть!"
23,"«Я призываю обе стороны — и русскую, и еврейскую — к терпеливому взаимопониманию и признанию своей доли греха…»."
24,"Перевернуть не перевернул, но удовольствие доставил."
25,"Ещё одно громкое событие года — роман «Господин Гексоген» Александра Проханова (М.: Ad Marginem)."
26,"Со страшненьким черепом Ленина на обложке (художник Андрей Бондаренко)."
27,"О том, как наши спецслужбы взрывали наши дома."
28,"И об операции по приходу во власть Избранника."
29,"С конспирологией, конечно."
30,"Автора клеймили «антисемитом», «одиозным публицистом» и т.п. И попрекали дружбой с Березовским."
31,"Однако молодые критики восхищались языком Проханова, его красочными глюками, его исключительным чувством (имперского советского) прошлого и предчувствием будущего."
32,"А также «мощнейшим техногенным пафосом» (Лев Пирогов)."
33,"«Яркое событие, такая бешеная и безумная книга» (Михаил Трофименков)."
34,"Цитата: «Все собравшиеся, увидев Избранника, потянулись к нему, словно к магниту."
35,"Избранник улыбался им всем и никому в отдельности."
36,"Здоровался со всеми сразу, прижимая руку к груди, глядя сквозь них в далёкие пространства, где блуждали лучи и синие тени."
37,"Лишь один Гречишников приблизился к Избраннику, обменялся рукопожатием, что-то негромко, наклонившись, говорил ему."
38,"Тот тихо внимал, улыбался, послушный, согласный со всем наперёд, но Белосельцеву издали чудилась в Избраннике странная отрешённость, невнимание к тому, о чём говорит Гречишников."
39,"Словно эти слова не имели для него смысла, а смысл имели блуждающие сквозь тучи лучи осеннего солнца, поджигавшие на далёких лесах красные и жёлтые пятна»."
40,"Собственно, с «Господина Гексогена» и пошла нынешняя слава Проханова."
41,"Получив за роман премию «Национальный бестселлер — 2002», он передал её в Фонд защиты Эдуарда Лимонова (который сидел тогда в саратовской тюрьме)."
42,"Стоит также вспомнить о книге Ирины Денежкиной «Дай мне!» (СПб: Лимбус Пресс)."
43,"Это жёсткая и сентиментальная проза, исполненная в духе «грязного реализма», своего рода предтеча сериала «Школа»."
44,"2003-й."
45,"Самая громкая книга года — «Байки кремлёвского диггера» Елены Трегубовой (М.: Ad Marginem, Коллекция «Трэш»)."
46,"Журналистка «Коммерсанта», проработавшая четыре года в кремлёвском пуле, рассказала о том, что видела, слышала и как это поняла."
47,"Вот названия главок: «Как я уволила из Кремля Шабдурасулова», «Как я стала юмашевской совестью», «Мой «друг» Володя Путин», «Как Путин кормил меня суши», «Одна ночь с Александром Стальевичем», «Кремлёвская пресс-хата», «Как Путин испортил мне Пасху», «Динамо-машина им. Б.А. Березовского», «Когда был Лесин маленьким»… Конечно, Трегубова слишком активно тянула одеяло на себя («Увидев меня, Лужков, разумеется, пригласил сесть с ним за стол»)."
48,"Конечно, её манера амикошонствовать, запросто называя обитателей политического олимпа Борька, Валя, Славка, Володя, раздражала… Но ничего более подробного из жизни «принимающих решения» никто не написал."
49,"Потом был взрыв у дверей её квартиры."
50,"Потом книга «Прощание кремлёвского диггера»."
51,"И политическое убежище в Англии."
52,"2004-й."
53,"Событием года можно считать «Священную книгу оборотня» Виктора Пелевина (М.: Эксмо)."
54,"Очень непростая love story лисички А Хули и генерал-лейтенанта ФСБ Саши Серого, он же волк-оборотень в погонах, а потом и сверхоборотень Пёс Пиздец."
55,"Лисичка при помощи хвоста и виртуальных секс-услуг откачивает у клиентов жизненную энергию."
56,"Генерал при помощи черепа пёстрой коровы и жутковатых камланий с воем откачивает нефть у российской земли."
57,"Цитата: «Он начал выть ещё человеком, но вой превратил его в волка даже быстрее, чем любовное возбуждение."
58,"Покачнувшись, он выгнулся дугой и повалился на спину."
59,"Трансформация произошла с такой скоростью, что он был уже почти полностью волком, когда его спина коснулась шинели."
60,"Ни на секунду не прекращая выть, этот волк несколько секунд бился в снегу, поднимая вокруг себя белое облако, а затем поднялся на лапы»."
61,"Вот какие люди у нас в ФСБ!"
62,"Сквозь причудливый сюжет просвечивало вполне реальное дело ЮКОСа, о чём напоминала весёлая надпись у входа на детскую площадку Нефтеперегоньевска: «Кукис-Юкис-Юкси-Пукс!» 2005-й."
63,"На арену вышла Оксана Робски, изящно помахивая дебютным романом «Casual/Повседневное» (М.: Росмэн)."
64,"Сюжет романа был прост, как античная драма."
65,"Вдова олигарха заказывает убийцу своего мужа."
66,"Заказ исполнен, но оказывается, что вдова ошиблась."
67,"Она исправляет ошибку, выясняет отношения с беременной любовницей убитого мужа и т.п. А под конец, устав от передряг, улетает в Индию, где находит новую любовь."
68,"Это был голос непосредственно из недр «праздного класса» (согласно определению Т. Веблена)."
69,"Цитата: «Вся Москва уехала в горы."
70,"Те, кто ещё не уехал, собирали чемоданы, чтобы уехать сразу после Нового года."
71,"Те, у кого есть потребность в знакомых лицах и близости к олигархам, уехали в Куршевель."
72,"Все остальные — в Санкт-Мориц…» Оксана Робски породила целое (пара)литературное течение — так называемый светский реализм."
73,"Такие романы составлялись, как конструктор «Лего»."
74,"Их героини были (относительно) молоды и материально обеспечены."
75,"Они презирали социально неоднородных (водителей, домработниц, «каких-то беженцев»), иногда злоупотребляли кокаином, не пренебрегали лесбийскими утехами."
76,"Кто-то мечтал переспать с Путиным («Власть — это очень сексуально»)."
77,"Забавная черта: в каждом романе обязательно присутствовал минет, правда какой-то малоинтересный — технический и неэротичный."
78,"Романы писали женщины."
79,"Или под женскими именами."
80,"2006-й."
81,"И вот появился мужчина, жаждущий сказать всю правду о гламурье, — Сергей Минаев с романом «Духless."
82,"Повесть о ненастоящем человеке»."
83,"Роман был написан крайне небрежно, переполнен штампами и пошлостями."
84,"Типа: «Миром давно уже не правит капитал."
85,"Лицемерие и ханжество — вот истинные короли мира»."
86,"Слово «духовность» и производные от него — на каждом шагу."
87,"Разговоры в офисе как в советском производственном романе: — Он тебе план делает?"
88,"— Ну, да."
89,"— Квартальный план выполнил?"
90,"Прирост есть?"
91,"— Ну, да, но ведь отчёты."
92,"Есть же производственная дисциплина..."
93,"Главный герой — коммерческий директор, а «это такая современная разновидность дорогой проститутки»."
94,"Спектр его услуг: классика; ролевые игры по желанию клиента; куннилингус; глубокий минет и т.п. Это метафоры, предназначение которых — показать, как низко вынужден порой падать человек."
95,"Правда, за 500 евро в день."
96,"В 2007 году «Духless» получил антипремию «Полный абзац»."
97,"Сергей Минаев писал о «поколении 1970—1976 годов рождения, таком многообещающем и таком перспективном."
98,"Чей старт был столь ярок, и чья жизнь была столь бездарно растрачена…» Об этом же поколении — лучшая книга 2006 года, роман Захара Прилепина «Санькя» (М.: Ad Marginem)."
99,"Действие его происходит на другом полюсе социума: герой Прилепина — неформал-маргинал."
100,"Хотя «бездарно растраченную жизнь» можно отнести и к нему."
101,"Санькя — член «Союза созидающих»."
102,"То есть «эсэсовец»."
103,"Он приезжает из провинциального городка в Москву — бузить."
104,"Две цитаты: «А мы ведь — случайность… Нас случайным сквозняком согнало."
105,"Революция приходит не сверху и не снизу — она наступает, когда истончаются все истины…»; «…я русский."
106,"Этого достаточно."
107,"Мне не надо никакой идеи…» «Санькя» вызвал бурю возмущения."
108,"Возмущались банкир Пётр Авен, телеведущая Тина Канделаки, агитпроп русского капитализма Валерия Новодворская («Прилепин — очень хороший писатель, лучше, чем Лимонов."
109,"Но враг»), а также Ксения Собчак и, что интересно, Сергей Минаев."
110,"На стороне «Саньки» были Михаил Швыдкой, тогда глава Федерального агентства по культуре и кинематографии, политолог Станислав Белковский, кинорежиссёр и сценарист Авдотья Смирнова, писатель Герман Садулаев."
111,"Захар Прилепин получил премию «Ясная Поляна» с формулировкой «за выдающееся произведение современной литературы — роман «Санькя»."
112,"…Есть литература, и есть жизнь."
113,"Есть и точки, где они сходятся."
114,"Как сошлись они в нынешнем декабре на Манеже, на площади Киевского вокзала."
115,"На улицах и площадях других русских городов, где бузили такие, как Санькя."
116,"В том же 2006-м Владимир Сорокин выпустил роман «День опричника» (М.: Захаров), соединявший в себе привычный для него жанр антиутопии и непривычный (но органичный) жанр политической сатиры."
117,"С посвящением «Григорию Лукьяновичу Скуратову-Вельскому, по прозвищу Малюта»."
118,"Время действия — 2027 год."
119,"Место действия — Россия (Москва), отгороженная от остального мира Великой Русской Стеной."
120,"Но со всеми удобствами, которые может дать high tech."
121,"Идеология согласно триаде графа Уварова: «Православие, самодержавие, народность»."
122,"Короче, Святая Русь в соответствующих декорациях."
123,"Цитата: «Снимает Поярок заслонку, берут наши ухваты печные, кочергу, да ими из печи на свет Божий и вытягивают столбового с супругою."
124,"Обоя в саже поизмазались, упираются."
125,"Столбовому сразу руки вяжем, в рот — кляп — и под локти — на двор."
126,"А жену… с женой по-весёлому обойтись придётся."
127,"Положено так."
128,"Притягивают её верёвками к столу разделочному, мясному."
129,"Хороша жена у Ивана Ивановича: стройна телом, лепа лицом, сисяста, жопаста, порывиста."
130,"Но сперва — столбовой."
131,"<…> Встаём все под ворота, поднимаем столбового на руках своих: — Слово и дело!"
132,"Миг — и закачался Иван Иванович в петле, задёргался, захрипел, засопел, запердел прощальным пропердом."
133,"Снимаем шапки, крестимся."
134,"Надеваем."
135,"Ждём, покуда из столбового дух изыдет»."
136,"Неужели у нас одно будущее — наше (страшное) прошлое?"
137,"2007-й."
138,"Событие — это, пожалуй, Лев Данилкин с книгой «Человек с яйцом: Жизнь и мнения Александра Проханова» (М.: Ad Marginem)."
139,"Не то чтобы вокруг книги было много шума."
140,"Но какая-то волна шла: упрямый замысел — написать книгу о «красно-коричневом» «соловье Генштаба» — себя оправдал."
141,"«Глянцевый литкритик Лев Данилкин дебютировал в «большой форме» с лирико-эпической биографией Александра Проханова», — писал журнал Time Out, не без ехидства."
142,"Сам Данилкин называл своего героя «советским Прустом», не без иронии."
143,"Цитата: «История про то, как общество на протяжении десятилетий делало всё возможное, чтобы представить его, писателя от бога, графоманом, подлецом, фашистом и скоморохом; я думаю, общество пыталось маргинализовать его всеми правдами и неправдами потому, что он всегда был для него живым упрёком, он был ярче, нелепее, храбрее, чем все остальные»."
144,"Ну да, «ярче, нелепее, храбрее»… А вот насчёт усилий общества по дискриминации Проханова — явный перебор."
145,"2008-й."
146,"Лёгкий шум поднялся по поводу романа Владимира Маканина «Асан» (М.: Эксмо)."
147,"О чеченской войне."
148,"Главный герой — майор с толстовской фамилией Жилин (притом Александр Сергеевич), спекулирующий бензином."
149,"Кому-то роман понравился — как «последняя правда» о Чечне."
150,"Но недовольных было больше."
151,"И они были убедительнее."
152,"Вот самый мягкий пример критики: «Асан» — удивительный пример беллетристической риторики или усилия по стяжанию художественности."
153,"Маканин — оригинальный мыслитель, то есть очень умный человек."
154,"Но человек без художественной свободы» (Николай Александров)."
155,"«Асан» получил «Большую книгу — 2008»."
156,"А по результатам голосования в ЖЖ — антипремию «НацВорст»."
157,"Как худшая книга 2008 года, «самая бездарная, скучная и глупая»."
158,"Цитата: «…Отовсюду плывёт сладкий предгорный воздух!"
159,"Это чистый кислород!.."
160,"Это Кавказ!"
161,"Распахнувшийся Кавказ окутывает мозги."
162,"Окутывает и нежит молодую душу… Кавказ зовёт к себе… Новобранцы счастливы!"
163,"Нет-нет и они встают в полный рост — в прыгающем кузове движущегося грузовика."
164,"Трясут автоматами."
165,"(Если Жора или сержант оружие отнять не успели.)"
166,"Падают и опять встают… И вот уже стреляют, стреляют!"
167,"Где эти чёртовы чечены?"
168,"Где война?.."
169,"Командиры, ау-ууу!.."
170,"Некоторые рвутся воевать прямо здесь и сейчас… Сколько можно медлить!"
171,"Надо ввязаться в какой-нибудь бой, прежде чем развезёт от жары»."
172,"И так далее."
173,"2009-й."
