"sent_pos","source"
174,"Интрига года была закручена вокруг «Околоноля» Натана Дубовицкого («Русский пионер», 2009, спецвыпуск )."
175,"Публика гадала, кто же скрывается за добропорядочным еврейским именем."
176,"На самом ли деле (как предположила газета «Ведомости») это Владислав Сурков, наш главный идеолог, серый кардинал, изобретатель «суверенной демократии» и других штук?"
177,"Или это какой-нибудь литературный негр?"
178,"А может быть, группа негров?"
179,"С одной стороны, трудно было представить, что топ-чиновник сочиняет романы."
180,"Да ещё социально острые."
181,"С другой, имя жены Суркова — Наталья Дубовицкая."
182,"И вроде бы Сурков признался в своём авторстве Виктору Ерофееву."
183,"А ещё Сурков написал рецензию, где критически отозвался о произведении и с иронией прокомментировал версию о своём авторстве («Русский пионер», 2009, № 11)."
184,"Однако тут же, выступая на литературных чтениях журнала, вдруг сказал: «Это прекрасный роман»."
185,"Говорили, что «Околоноля» будут «читать, надеясь найти между строк скрытое послание и больше узнать о механизме принятия решений в Кремле»."
186,"Но о «механизме принятия решений» в романе почти ничего не было."
187,"Разве что мысль о том, что весь бизнес РФ крышуют чекисты."
188,"Цитата: «…Мы власть… Настоящая власть не применима, как атомная бомба."
189,"Мы правим, не вмешиваясь."
190,"Поддерживаем порядок, оставаясь невидимыми."
191,"Как говорят китайцы, власть — дракон в тумане»."
192,"Главный герой романа Егор Самоходов входит в полукриминальный издательский бизнес (левые тиражи, нелицензированные учебники, фальсификации и т.п.) Так что послание скорее такое: бизнес на культурных ценностях ничуть не лучше любого другого."
193,"А то и хуже."
194,"Цитата: «А войну за сбыты Набокова в южной Москве помнишь?"
195,"Семь трупов."
196,"За розницу Тютчева помнишь?"
197,"Между «яснополянскими» и «солнцевскими»… Ну тогда двумя взрывами магазинов обошлось, ночью, без жертв."
198,"Зато за опт обэриутов когда мы с «крокодилерами» схлестнулись!"
199,"Одиннадцать жмуриков!» 2010-й."
200,"Обсуждают «Литературную матрицу» (СПб."
201,": Лимбус Пресс) — альтернативный учебник литературы в двух томах, написанный писателями."
202,"Спорят в основном о том, будут ли школьники его читать."
203,"И начнут ли (научатся ли) после этого (если прочитают) любить/понимать литературу."
204,"Сама идея замечательная."
205,"Что до исполнения, то это кому (из классиков) как повезло… Цитата: «Главное, чего хотелось бы составителям этой книги, — чтобы тот, кто прочтёт из неё хоть несколько статей, почувствовал необходимость заглянуть в тексты произведений русской литературы, входящих в школьную программу."
206,"Чтобы он читал эти тексты так, как читают их авторы этой книги, — не сдерживая слёз, сжимая кулаки, хохоча и замирая от восторга, гневаясь и сходя с ума."
207,"Потому что школьная программа по литературе — это на самом-то деле программа для активации человеческого в человеке, и надо только понять, где тут кнопка «enter» и как её нажать»."
208,"Про кнопку «enter» могу сказать одно: нажать её может (и должен) учитель, который ведёт литературу."
209,"Собственно, от учителя всё и зависит."
210,"Но тут уж тоже кому как повезёт… В центр споров и раздоров попал и роман Елены Колядиной «Цветочный крест» (журнал «Вологодская литература», 2010, № 7), получивший «Русский Букер»."
211,"О красавице Феодосье, которую обвинили в колдовстве и отправили на костёр."
212,"Время действия — XVII век, место — город Тотьма."
213,"Язык напоминает о «Дне опричника» Сорокина."
214,"Колядину обвиняют в богохульстве, попрекают лексикой (особенно словами «муди», «елда» и т.п.), а также ляпами и неточностями."
215,"Те же, кому роман понравился, превозносят её за гениальность и смелость."
216,"Самая цитируемая фраза романа — первая: «В афедрон давала ли?» Что ж, неплохая кода для нулевых."
217,"Аминь."
