"sent_id","par_id","source","book_id","par_pos","sent_pos"
14531,4704,"Шаттл «Дискавери» завершил свой 39-й и последний полёт в космос.",263,1,1
14532,4704,"В 19.58 мск он приземлился на космодроме на мысе Канаверал во Флориде.",263,1,2
14533,4705,"Полёт, который первоначально должен был продлится 11 дней, занял 13 суток.",263,2,1
14534,4705,"После своего возвращения на Землю навсегда, челнок займёт почётное место в американском музее аэронавтики.",263,2,2
14535,4705,"Программа «Спейс шаттл» близка к своему завершению: после «Дискавери», в космос по разу отправятся также шаттлы «Индевор» (в конце апреля 2011 г.) и «Атлантис» (в конце июня 2011 г.).",263,2,3
