"sent_id","par_id","source","book_id","par_pos","sent_pos"
14568,4717,"В понедельник 21 марта 2011 года в Демократическая Республика Конго (Африка) потерпел крушение четырёхмоторный грузовой самолёт «Ан-12» принадлежащий конголезской авиакомпании «Trans Air Congo».",266,1,1
14569,4717,"«Антонов» совершал рейс по маршруту Браззавиль – Пуэнт-Нуар, однако, до пункта назначения летательный аппарат не дотянул, и рухнул прямо на жилые кварталы находящиеся неподалёку от взлетно-посадочной полосы аэропорта города Пуэнт-Нуар.",266,1,2
14570,4718,"По предварительным данным, причиной трагедии стала техническая неисправность воздушного судна.",266,2,1
14571,4718,"Жертвами катастрофы самолёта стали 23 человека, в числе которых оказались все три члена экипажа - граждане Российской Федерации: Иван Панин (КВС), Николай Курятник (штурман) и Леонид Жаворонков (бортмеханник).",266,2,2
14572,4718,"Все погибшие в этой катастрофе россияне - тверичане, которые ранее вместе проходили службу в Мигалове.",266,2,3
14573,4718,"Среди погибших пассажиров самолёта оказался гражданин Республики Казахстан Айджан Айткалиев.",266,2,4
14574,4718,"Значительную часть пострадавших составили жители домов на которые упал «Ан-12».",266,2,5
