"sent_id","par_id","source","book_id","par_pos","sent_pos"
118,46,"Быстротечный кинороман",5,1,1
119,46,"Отечественные кинематографисты не оставляют попыток снимать романтическое кино.",5,1,2
120,46,"Иногда у них это получается",5,1,3
121,47,"Осенью можно будет увидеть в прокате фильм Оксаны Бычковой «Плюс один».",5,2,1
122,47,"Премьера состоялась 21 августа (96 мин. В ролях Павел Деревянко, Джетро Скиннер, Олег Долин, Мадлен Джабраилова, Юрий Колокольников, Евгений Цыганов).",5,2,2
123,48,"Жанровое кино как элемент современного российского кинопроцесса практически отсутствует.",5,3,1
124,48,"Несмотря на отдельные образцы.",5,3,2
125,48,"Нет такого направления.",5,3,3
126,48,"Основной жанр сегодня – фильм вообще.",5,3,4
127,48,"Меж тем спрос именно на жанровое, оно же развлекательное, кино очень велик.",5,3,5
128,48,"Как на фильмы ужасов, так и на романтические комедии.",5,3,6
129,48,"Ромкомы, если сокращенно.",5,3,7
130,49,"Кто нежнее",5,4,1
131,50,"С одной стороны, в нашем кино нет традиции появления романтических комедий.",5,5,1
132,50,"И в советские времена не было.",5,5,2
133,50,"Но с другой –можно уловить некоторые черты ромкомов в некоторых фильмах 40–60-х годов – тех же «Девчатах» или «Сердцах четырех».",5,5,3
134,50,"Там были и наивные нежные героини, и мужественные герои, и нужное сочетание лучезарной улыбчивости с трогательной серьезностью, и ощущение «все будет хорошо».",5,5,4
135,51,"Притворяются ромкомами и некоторые картины Эльдара Рязанова.",5,6,1
136,51,"«Ирония судьбы», «Служебный роман» -- чем не образцы жанра?",5,6,2
137,51,"Но они на поверку оказываются серьезнее и страшнее.",5,6,3
138,51,"Несмотря на хеппи-энд.",5,6,4
139,51,"Который, кстати – непременное условие.",5,6,5
140,51,"И такое же непременное отсутствие почти во всех ромкомах нового образца.",5,6,6
141,51,"Сегодня в любом финале горечи больше, чем счастья и спокойствия.",5,6,7
142,51,"А любимее всего –финал открытый.",5,6,8
143,51,"Мол, мы все сказали, а дальше сами додумывайте.",5,6,9
144,52,"Расскажи мне о любви",5,7,1
145,53,"Пресловутые отдельные образцы новых ромкомов заслуживают внимания именно своей отдельностью.",5,8,1
146,53,"Даже оторванностью.",5,8,2
147,54,"Основная их проблема – узость потенциальной аудитории.",5,9,1
148,54,"Западные образцы, которых, кстати, во много раз больше, но это отдельная тема, – адресованы самым разным зрителям.",5,9,2
149,54,"И по возрасту, и по вкусовым пристрастиям.",5,9,3
150,55,"Наши же режиссеры-сценаристы сочиняют свое кино исключительно для молоденьких девочек.",5,10,1
151,55,"Даже их представляя похожими.",5,10,2
152,55,"Перебарщивают с милыми глупостями.",5,10,3
153,55,"Пересахаривают.",5,10,4
154,56,"И сюжеты, и герои-героини такие сказочные, что им не веришь.",5,11,1
155,56,"Все идеально.",5,11,2
156,56,"И злодеи не злые, и разлучники благородные.",5,11,3
157,56,"По улицам бродят феи.",5,11,4
158,56,"Юноши – сплошь красавцы.",5,11,5
159,56,"А героини свято верят в чудесную силу новой прически и спокойно бродят в одиночестве по ночному городу.",5,11,6
160,56,"Блеск и счастье.",5,11,7
161,56,"Сливочный крем и блестки.",5,11,8
162,56,"Реальность не присутствует даже в качестве приправы.",5,11,9
163,57,"В результате, глядя на все это, совершенно не испытываешь эмоций.",5,12,1
164,57,"И кино, нацеленное на извлечение чувств из зрителя, наоборот, все чувства замораживает.",5,12,2
165,57,"Понятно, что ромком должен приукрашивать жизнь.",5,12,3
166,57,"Но совсем прощаться с достоверностью не годится.",5,12,4
167,58,"Очарованные",5,13,1
168,59,"Как правило, местом действия «новые романтики» выбирают Петербург или Москву.",5,14,1
169,59,"Видимо, по их мнению, с людьми из других городов не может произойти ничего чувствительно-сентиментального.",5,14,2
170,59,"Лирика оказывается неотделима от мегаполисного глянца.",5,14,3
171,59,"Широких улиц, мостов с огнями, больших магазинов.",5,14,4
172,59,"Кафе.",5,14,5
173,59,"Нарядов.",5,14,6
174,59,"Мобильных телефонов.",5,14,7
175,59,"Денег, в конце концов.",5,14,8
176,60,"С Петербургом ситуация удачнее: мрачный, красивый, очень атмосферный город одним присутствием в кадре настраивает на нужную волну.",5,15,1
177,60,"Очаровывает.",5,15,2
178,60,"Даже вне зависимости от того, что на его фоне вытворяют герои.",5,15,3
179,61,"Москва же романтического ореола лишена.",5,16,1
180,61,"Дикий ритм жизни, все большее архитектурное обезличивание.",5,16,2
181,61,"Скорости.",5,16,3
182,61,"Жестокости.",5,16,4
183,61,"Какие уж тут любовные истории.",5,16,5
184,61,"Если они и возникают, то хиленькие и слабенькие, как больные дети.",5,16,6
185,62,"Петербург воспет двумя наиболее успешными ромкомами последних лет – «Питером FM» Оксаны Бычковой и «В ожидании чуда» Евгения Бедарева.",5,17,1
186,62,"Перед этим была еще «Прогулка» Алексея Учителя, но поскольку там финал переворачивал всю историю вверх дном, фильм не подходит под этот жанр.",5,17,2
187,62,"Он серьезнее.",5,17,3
188,63,"Фильм Бычковой, по-девичьи легкий, облачный, в меру веселый, вполне удался.",5,18,1
189,63,"От грамотно выстроенного визуального ряда (питерская романтика с окнами, выходящими на крышу, мостами и дворами-закоулками) до запоминающегося саундтрека.",5,18,2
190,63,"К тому же Бычкова собрала в картину отличных актеров разных поколений, которые радуют глаз качественной игрой.",5,18,3
191,63,"Да и атмосфера правильная.",5,18,4
192,64,"С «Чудом» не все так радужно.",5,19,1
193,64,"И излишеств там хватило, и настроенческих перехлестов, и откровенных сценарных глупостей.",5,19,2
194,64,"Зато повезло с исполнительницей главной роли: выпускница Щукинского училища Екатерина Копанова, рыжеволосая, сияющая девушка сделала добрую половину фильма.",5,19,3
195,65,"Попытку снять нечто романтично-веселое предприняла еще одна девушка-режиссер, Анна Меликян.",5,20,1
196,65,"Ее «Русалка» претендует на некое исключительное место в ряду прошлогодних картин.",5,20,2
197,65,"Однако после просмотра о фильме хочется поскорее забыть.",5,20,3
198,65,"История о диковатой девушке, сознательно молчавшей все детство и посещавшей школу для даунов, а по приезде в столицу работающей ходячей рекламой и красящей волосы в зеленый цвет, чтобы привлечь понравившегося парня, выглядит претенциозно и беспомощно.",5,20,4
199,65,"Сочинения про «милых чудачек» стоит оставить французам.",5,20,5
200,65,"У них это выходит органичнее.",5,20,6
201,66,"Третий лишний",5,21,1
202,67,"Ожидания в свете первой удачной картины – закономерность.",5,22,1
203,67,"После «Питера FM» от Оксаны Бычковой хотели истории в этом же ключе.",5,22,2
204,67,"И на первый взгляд в новом фильме «Плюс один», на днях вышедшем в прокат, себе она не изменила.",5,22,3
205,67,"Только вот интонацию уж больно облегчила.",5,22,4
206,67,"Получилось кино, тающее, как дымка, еще до окончания финальных титров.",5,22,5
207,68,"Героиня фильма, переводчица Маша, проводит дни напролет в плотном коконе серых свитеров и бумаг.",5,23,1
208,68,"Тихий мирок, где никому больше нет места.",5,23,2
209,68,"И предложение сопровождать в московской поездке английского кукольника и клоуна, приехавшего отобрать артистов для своего шоу, застает ее врасплох.",5,23,3
210,68,"Ведь такие серьезные люди от работы не отказываются.",5,23,4
211,68,"Но и за рабочие рамки не желают выходить.",5,23,5
212,69,"А приходится.",5,24,1
213,69,"Потому что заезжий Том Гринвуд, существо редкостного обаяния и такой же редкой раскрепощенности, неожиданно ею, Машей, увлекается.",5,24,2
214,69,"Несмотря на ее беспросветное занудство.",5,24,3
215,69,"А может, и не увлекается, а просто резвится.",5,24,4
216,69,"Соблазняет.",5,24,5
217,69,"Шалит.",5,24,6
218,70,"Гринвуд – странное существо.",5,25,1
219,70,"Фрик.",5,25,2
220,70,"Глаза нараспашку и он весь –нараспашку.",5,25,3
221,70,"Он любит всех вокруг: артистов, шофера, своего друга –ручную куклу Дигги.",5,25,4
222,70,"И девушек.",5,25,5
223,70,"Девушки – это красиво.",5,25,6
224,70,"Девушки – это возможность хорошо провести время.",5,25,7
225,70,"Неудивительно, что к случившемуся с Машей интиму он относится так же: это приятно.",5,25,8
226,70,"И все.",5,25,9
227,70,"Хотя здесь режиссер начинает «плыть»: хочет, чтобы герой получился одновременно развлекающимся и не на шутку влюбленным.",5,25,10
228,70,"В итоге получилось что-то невнятное.",5,25,11
229,71,"Гринвуда играет его соотечественник Джетро Скиннер (получивший на нынешнем «Кинотавре» приз за лучшую мужскую роль).",5,26,1
230,71,"Органичный, как кошка.",5,26,2
231,71,"Ради него стоит смотреть эту не самую интересную картину.",5,26,3
232,72,"Все остальные, увы, блекнут на фоне чудесного англичанина.",5,27,1
233,72,"Даже главная героиня.",5,27,2
234,72,"Актриса «Мастерской Петра Фоменко» Мадлен Джабраилова на сцене – огонь и фейерверк.",5,27,3
235,72,"Лукавая женственность и простодушное очарование.",5,27,4
236,72,"А здесь, кажется, у нее отняли, погасили весь ее блеск.",5,27,5
237,72,"Слишком преуспели в изображении скучной одинокой девушки.",5,27,6
238,73,"Еще одно разочарование – финал.",5,28,1
239,73,"Где Гринвуд улетает и не обещает вернуться, а героиня возвращается в свой дом.",5,28,2
240,73,"И нет ощущения, что она счастлива, что сейчас она наденет платье с цветами, распахнет настежь окна, выбросит с балкона бумажные залежи.",5,28,3
241,73,"Все останется по-прежнему.",5,28,4
242,73,"А шанса на счастье может уже и не быть.",5,28,5
243,74,"Потому что устоявшаяся жизнь так легко не меняется.",5,29,1
244,74,"Но для понимания этого у творческой группы «Плюс один» не хватило опыта.",5,29,2
245,74,"И фильм получился не о счастье, как гласит рекламный слоган, а о быстротечном романчике.",5,29,3
246,74,"Маленькой случайности.",5,29,4
247,74,"Оставшейся в памяти, но ничего не изменившей.",5,29,5
248,74,"Этого мало для целого фильма.",5,29,6
