"sent_id","par_id","source","book_id","par_pos","sent_pos"
16622,5403,"Человек и кошка",340,1,1
16623,5403,"Опрощение англосаксов",340,1,2
16624,5404,"Господа, спешу довести до вас непроверенную информацию из авторитетного источника: мы все умрём.",340,2,1
16625,5404,"Этот, если угодно, девиз удачно предваряет мысли и соображения, сначала затерзавшие меня во время просмотра картины Питера Джексона The Lovely Bones, а после хаотично поразбросанные мной на пространстве колонки, см. ниже.",340,2,2
16626,5405,"По-русски фильм обозвали «Милые кости»: как всегда, неудовлетворительно.",340,3,1
16627,5406,"(Иногда мне кажется, что НАТО придвигает свои базы и свои радиолокационные станции к границам России единственно потому, что англосаксов всерьёз пугает та тупая решимость, с которой здешние горе-интеллектуалы деформируют аутентичные западные смыслы.",340,4,1
16628,5406,"Я бы, кстати, тоже пугался и тоже бы придвигал, извиняйте.)",340,4,2
16629,5407,"В первом попавшемся словаре находим следующее:",340,5,1
16630,5408,"bones — шутл. человек, тело, останки.",340,6,1
16631,5409,"Таким образом, оригинальное имя фильма отсылает как к мёртвой девочке, так и к её живым пока ещё родственникам.",340,7,1
16632,5410,"Более того, название указывает ещё и на плоть девочки до того момента, когда её убили, и на плоть её мучителя, и вообще на каждого из персонажей картины.",340,8,1
16633,5410,"И на тебя, читатель, и на меня.",340,8,2
16634,5411,"The Lovely Bones: мы все умрём.",340,9,1
16635,5412,"(Но где мы потом окажемся?)",340,10,1
16636,5413,"(«Милое тело» — не вполне то, что нужно, но подошло бы, кажется, гораздо лучше.)",340,11,1
16637,5414,"Отчётное кино разбирается с самым интригующим, на мой вкус, вопросом всех времён и народов: куда чего девается, что остаётся от человека после его физической смерти?",340,12,1
16638,5415,"The Lovely Bones: насколько же английский язык насыщеннее и тоньше русского!",340,13,1
16639,5415,"В этом сочетании одновременно мерцают и жалость к бренному телу, и сарказм по отношению к чему-то такому, что телом якобы управляет-обладает, что пыжится, надувает щёки и до поры до времени хорохорится, а потом тоже куда-то исчезает.",340,13,2
16640,5416,"The Lovely Bones: здесь уже есть трезвость, осознание того, что живой пока что человек без малого мёртв, что разница едва различима.",340,14,1
16641,5417,"Смыслообразующая цепочка в стиле шутл.: человек — тело — останки.",340,15,1
16642,5418,"Неслучайно картина заканчивается следующей закадровой репликой героини:",340,16,1
16643,5418,"«Я была в этом мире всего лишь мгновение».",340,16,2
16644,5419,"«Но где же ты теперь, заинька?!» — захлёбывается от искреннего интереса постановщик.",340,17,1
16645,5420,"Впрочем, в смысле художественного результата этот фильм Джексона не великий, как говорится, не «Кинг-Конг».",340,18,1
16646,5420,"Что-то тут не срослось, и что-то до конца не доделалось.",340,18,2
16647,5420,"Но всё равно, всё равно: отдаю за эти безукоризненно правильные два часа всю нелепую постсоветскую культурку (равно, впрочем, как и почти всю советскую и даже, простите, не казните, расхваленную-перехваленную культурку дореволюционную).",340,18,3
16648,5421,"Впрочем, бывают счастливые исключения и у нас.",340,19,1
16649,5421,"Уже на тридцатой минуте картины горлом пошли строки одного современного поэта:",340,19,2
16650,5422,"кто там в потёмках меня стережёт",340,20,1
16651,5422,"мёртвая кошка меня бережёт",340,20,2
16652,5423,"в мире подземном там а не тут",340,21,1
16653,5423,"как мою мёртвую кошку зовут.",340,21,2
16654,5424,"В России любят долдонить о некоей неуловимой «духовности»: отрыжка старинного быта, дворянская привычка салонного происхождения.",340,22,1
16655,5424,"В результате имеем картину мира, исчерпывающе выраженную начальной фразой одного из произведений Платонова:",340,22,2
16656,5424,"«Фома Пухов резал колбасу на гробе своей жены».",340,22,3
16657,5425,"Запомните, затвердите: у Платонова не пролетарская новация, но именно дворянская традиция.",340,23,1
16658,5425,"В одной из передач «Тем временем» уважаемый добропорядочный профессор, кажется Зубов (естественно, антисоветчик; только тараканов-антисоветчиков и пускают сегодня к микрофонам), заявил:",340,23,2
16659,5425,"«Я сам из семьи технической интеллигенции, и я наверняка поэтому знаю, что все свои технические чудеса Советский Союз своровал на Западе!»",340,23,3
16660,5426,"После чего гордо просиял.",340,24,1
16661,5427,"Профессор, снимите очки-велосипед.",340,25,1
16662,5427,"Можно подумать, концепцию суверенной мятущейся личности столь любимые вами дворяне XIX столетия выстрадали самостоятельно.",340,25,2
16663,5427,"Разве какой-нибудь романтизм в основных своих параметрах не уворован?",340,25,3
16664,5427,"Пускай даже очень и очень талантливыми людьми, имена которых вызывают у вас сладкую дрожь и пиетет, а у меня не вызывают ничего.",340,25,4
16665,5428,"Это прозвучит очень смешно из уст такого оголтелого пролетария, как Манцов, но я-то воспитан на английских романтиках, которых в восьмилетнем возрасте самостоятельно откопал в букинистическом отделе ближайшего к дому книжного магазина.",340,26,1
16666,5429,"Первые строки, которые я выучил наизусть по доброй воле, — «Сказание о Старом Мореходе» некоего Кольриджа.",340,27,1
16667,5429,"А самый глубокий слой моего сознания, до которого удаётся безболезненно добраться, — эта вот волшебная формула в переводе В. Левика:",340,27,2
16668,5430,"Барк приближался.",340,28,1
16669,5430,"Смерть и Смерть",340,28,2
16670,5430,"Играли в кости, сев на жердь.",340,28,3
16671,5431,"Это было нечто невероятное!",340,29,1
16672,5431,"Приставал ко всем знакомым взрослым с требованием разъяснить, почему Смерть тут не одна, чем Смерть просто отличается от Жизни-и-в-Смерти?!",340,29,2
16673,5432,"Взрослые смотрели на меня как на сумасшедшего.",340,30,1
16674,5432,"Самый продвинутый из них ответил замысловатой формулой:",340,30,2
16675,5432,"«Не стоило умножать число сущностей.",340,30,3
16676,5432,"Вообще-то смерть одна, и в ней нет ничего особенно интересного.",340,30,4
16677,5432,"Парень, да это же старинная английская сказка, не имеющая отношения к действительности.",340,30,5
16678,5432,"Тело сгниёт, душа отправится в коммунистический рай, гы-гы-гы».",340,30,6
16679,5433,"Тоже, кстати, был антисоветчиком!",340,31,1
16680,5433,"Доморощенный начитанный диссидент.",340,31,2
16681,5434,"(С чувством глубокого удовлетворения отмечаю, что недавно изданный перевод Николая Гумилёва несравненно хуже и не содержит невиданных красот, подобных вышеприведённой.",340,32,1
16682,5434,"Смертельно не люблю белогвардейщину, вот и не удержался!)",340,32,2
16683,5435,"Итак, внимание.",340,33,1
16684,5435,"Здешний образованный слой вечно ворует и упрощает, ворует и упрощает.",340,33,2
16685,5436,"Западоидам «понадобилось» две Смерти, наши почесали репу, ничего не поняли и одну из Смертей отбраковали.",340,34,1
16686,5436,"Впрочем, и с оставшейся не знали, что делать: сегодня идею неотвратимой Смерти призваны воплощать разве что солдаты и офицеры Великой Отечественной, вот ведь почему с юбилеем Победы так носятся жрецы-политтехнологи.",340,34,2
16687,5437,"Из повседневного же измерения Смерть в России благополучно изъята: соответствующей образной системы создать так и не удалось.",340,35,1
16688,5438,"Хорошо знает о Смерти, её измерениях и личинах православная церковь, однако раскрывать свои сокровенные тайны плебеям-мирянам не спешит.",340,36,1
16689,5438,"Миряне, вероятно, в отместку не спешат в православную церковь.",340,36,2
16690,5439,"Между тем западная, в первую очередь англосаксонская, массовая культура подвижнически работает, умножает число сущностей до бесконечности, усложняет свою как психологическую, так и социальную реальность, по существу творит чудеса.",340,37,1
16691,5440,"На коробочке с «Милыми костями» наши умники написали следующее:",340,38,1
16692,5440,"«Наблюдая за жизнью домочадцев с небес, героиня мечтает о простых подростковых радостях и жаждет поимки душегуба».",340,38,2
16693,5440,"Всё — ложь.",340,38,3
16694,5440,"Извращение, упрощение и профанация.",340,38,4
16695,5441,"И эта страна не устаёт рассуждать о нанотехнологиях!",340,39,1
16696,5442,"Но аутентичная западная нанотехнология — ювелирная работа со смысловыми цепочками и оттенками.",340,40,1
16697,5442,"Подковать же блоху — не проблема, да и не победа, на любом тульском перекрёстке.",340,40,2
16698,5443,"Младший брат убитой героини говорит:",340,41,1
16699,5443,"«Бабушка, я знаю, где Сьюзи, она находится посередине!»",340,41,2
16700,5443,"После чего указывает на свой поясняющий рисунок.",340,41,3
16701,5444,"Ему вторит сама Сьюзи:",340,42,1
16702,5444,"«Я была в голубом горизонте, посередине между небом и землёй».",340,42,2
16703,5445,"Нормально, да?",340,43,1
16704,5445,"Авторы картины ломают голову над тем, в какой смысловой нише находится 14-летняя невинно убиенная девочка.",340,43,2
16705,5445,"120 минут ведут сами с собой и со зрителями напряжённый диалог, умножая число сущностей, рисуя графики и поясняющие картиночки, опуская метафизику на уровень тупой повседневности и, напротив, поднимая масскультовую образность до уровня высокой поэзии.",340,43,3
16706,5446,"У них что-то не получается, а что-то другое получается необыкновенно хорошо.",340,44,1
16707,5446,"Они стараются схватить за хвост собственную интуицию и вытащить это юркое животное на экран.",340,44,2
16708,5447,"В этот ответственный момент за дело принимаются доблестные россиянцы — любители затверделого смысла: если девочка отбросила копыта, значит, по их мнению, девочка «на небесах».",340,45,1
16709,5447,"А где же ей ещё быть?",340,45,2
16710,5448,"Дело, вы же понимаете, не в надписи на коробочке.",340,46,1
16711,5448,"Ровно так здесь смотрят, так потребляют, так извращают смыслы миллионы и миллионы.",340,46,2
16712,5448,"Какую бы тонкую, какую бы ювелирную работу ни предложили им англосаксы, тутошние самоуверенные бабуины всё равно её и упростят, и осмеют, и оплюют.",340,46,3
16713,5449,"Или вот ещё.",340,47,1
16714,5449,"На той же коробочке (читай: в башке бабуина-потребителя) зачем-то акцентируется факт изнасилования героини соседом-маньяком.",340,47,2
16715,5449,"Однако в самом фильме этот мотив последовательно игнорируется!",340,47,3
16716,5450,"Была ли девочка изнасилована, нет ли — авторы целомудренно умалчивают.",340,48,1
16717,5450,"В картине идёт рассказ от её лица, очень тонко выстроенный рассказ с миллионом умолчаний и гротескно-конфетных преувеличений вроде картины потусторонней середины и потустороннего же рая.",340,48,2
16718,5451,"Даже если изнасилование было, сознание девочки этот кошмар элиминирует.",340,49,1
16719,5451,"Ни разу не звучит словцо «изнасилование» даже из уст полицейского и родителей, ибо их речь также пропущена через девочкины фильтры.",340,49,2
16720,5451,"Короче, снова ювелирная работа с исходными жанровыми схемами — грубыми и общедоступными.",340,49,3
16721,5452,"Однако россиянцы жаждут и жаждут клубнички.",340,50,1
16722,5452,"Подозреваю, многим — и даже не обязательно извращенцам-маньякам — «по приколу» воображать изнасилование малолетней.",340,50,2
16723,5452,"Надпись на коробочке, безусловно, заказана здешним коллективным бессознательным.",340,50,3
16724,5453,"(Всё-всё-всё покрылось таким слоем глупости и грязи, что иногда, Господи, помилуй, смерть представляется единственным выходом из ситуации.)",340,51,1
16725,5454,"Как и положено здоровому масскульту, фильм состоит из банальных рифм и бинарных оппозиций.",340,52,1
16726,5454,"На досуге маньяк изготовляет уютные игрушечные домики.",340,52,2
16727,5454,"Похоже, ему не хватает Семьи, Дома и соответствующего Тепла.",340,52,3
16728,5455,"Однако отец героини, у которого есть и жена, и трое детей, и не картонный уют, тоже инфантилен: всё свободное время он силится засовывать модели романтических парусников в бутылки, и, как правило, ему это удаётся.",340,53,1
16729,5455,"Папашино подсознание заказывает приключения?",340,53,2
16730,5455,"И, надо заметить, ему удалось эти приключения накликать.",340,53,3
16731,5456,"«А мама знала до свадьбы о твоей одержимости?» — не без укоризны спрашивает Сьюзи у отца.",340,54,1
16732,5457,"Таким нехитрым сопоставлением ставится под лёгкое сомнение традиционная жанровая схема, где маньяк — из одного теста, а жертва и её родственники — из совсем другого.",340,55,1
16733,5457,"Авторы намекают и на то, что граница подвижно-проницаема, и на то, что кино совсем про другое.",340,55,2
16734,5457,"Кино про то обстоятельство, которое объединяет и жертв, и злодеев: мы все умрём.",340,55,3
16735,5458,"Вот ещё о подвижности границ между виноватыми и пострадавшими.",340,56,1
16736,5458,"Сама Сьюзи игриво сообщает отцу:",340,56,2
16737,5458,"«А Кларисса в тебя влюбилась!»",340,56,3
16738,5458,"Судя по всему, речь идёт о подруге-однокласснице.",340,56,4
16739,5458,"Ничего себе.",340,56,5
16740,5459,"В это же самое время молодящаяся бабушка поддразнивает, подначивает саму Сьюзи:",340,57,1
16741,5459,"«Знаешь, мой первый поцелуй был со взрослым мужчиной!»",340,57,2
16742,5459,"— «И как, как это было?»",340,57,3
16743,5459,"— «Великолепно, замечательно, волшебно!",340,57,4
16744,5459,"Позже я поняла, что такой поцелуй бывает лишь раз в жизни».",340,57,5
16745,5460,"У мамы Сьюзи свои тараканы.",340,58,1
16746,5460,"Её кумиры — Вирджиния Вулф и Альбер Камю с его «Посторонним».",340,58,2
16747,5460,"Мама день и ночь вяжет безвкусную одежду, которую дочке приходится носить с зубовным скрежетом.",340,58,3
16748,5460,"«Какое жуткое унижение!» — бросает Сьюзи, одевая очередную мамину поделку вместо шапки.",340,58,4
16749,5461,"Видимо, родители Сьюзи не просто одержимы, но ещё и очень строги; на это в одной из сцен намекают проницательный следователь и оправдывающаяся мать, однако уже упомянутые дочкины фильтры делают эту — чреватую жестокостью — строгость неочевидной.",340,59,1
16750,5462,"О, мёртвые легко прощают!",340,60,1
16751,5462,"Не то что живые.",340,60,2
16752,5463,"Если мы примем во внимание родительскую жестокость и бабушкины соблазнительные речи, нам будет легко понять, почему 14-летняя Сьюзи столь легко клюнула на ласковые речи немолодого малознакомого соседа и попалась таким образом на крючок.",340,61,1
16753,5464,"Кроме того, теперь нам легче понять тот не осознанный самой девочкой сарказм, которым авторы картины окрасили вот эту её реплику:",340,62,1
16754,5464,"«Члены нашей семьи не были теми несчастными людьми, с которыми плохие вещи происходят безо всякой на то причины».",340,62,2
16755,5465,"(Ср. со словами мамы, обращёнными к следователю:",340,63,1
16756,5465,"«Детектив, проблем нет!",340,63,2
16757,5465,"Мы — счастливые, она — счастливая!»)",340,63,3
16758,5466,"Ещё раз повторю: повествовательная стратегия картины нетривиальна, мёртвая девочка то не договаривает, то искажает факты и пропорции.",340,64,1
16759,5467,"Возьмём эпизод, где маньяк демонстрирует девочке Сьюзи своё подземелье.",340,65,1
16760,5467,"Джексон настойчиво разбивает эту сцену картинами домашнего ужина в доме Сьюзи.",340,65,2
16761,5467,"Там её сестра сладострастно предвкушает очередное наказание, которого не избегнет опаздывающая девочка.",340,65,3
16762,5467,"Там вспоминают о Сьюзи словно бы нехотя.",340,65,4
16763,5467,"Неслучайно маньяк бросает ей многозначительную фразу:",340,65,5
16764,5467,"«Только одно условие: никаких взрослых!»",340,65,6
16765,5467,"Ясно, он знает этим взрослым цену.",340,65,7
16766,5468,"Видимо, Камю возникает в самом начале не зря: тема «постороннего», тема экзистенциального одиночества.",340,66,1
16767,5468,"Сьюзи находится посередине, ибо желает внутренне соединиться со своими близкими.",340,66,2
16768,5468,"Желает тем более страстно, что это никак не удавалось сделать при жизни на земле.",340,66,3
