"sent_id","par_id","source","book_id","par_pos","sent_pos"
16769,5469,"«Мне надо домой!» — объясняет она новой подружке с того света, однако дома, на земле, её потихонечку забывают.",340,67,1
16770,5469,"И уж конечно, не по причине клинического жестокосердия.",340,67,2
16771,5469,"Просто у живых намного меньше внутренних сил, чем у мёртвых.",340,67,3
16772,5470,"Сьюзи страшно переживает, что мама страшится заходить в её комнату.",340,68,1
16773,5470,"Сьюзи произносит выспренние монологи про отца, который, верится, никогда не разорвёт сердечную связь с ней:",340,68,2
16774,5470,"«Я знала, он бы никогда меня не бросил, никогда не забыл бы обо мне.",340,68,3
16775,5470,"Я была его дочкой, а он моим папой.",340,68,4
16776,5470,"Мой папа знает, что я здесь.",340,68,5
16777,5470,"Я не замёрзла, не пропала, я жила в моём собственном идеальном мире…»",340,68,6
16778,5471,"Джексон, мне кажется, не вполне точно разобрался с тем, какой мотив для него базовый, и поэтому его постановочные усилия временами распыляются, а другими временами он без нужды возвращается туда, где уже достаточно потоптался.",340,69,1
16779,5471,"Мне больше всего понравилась тема поиска, я бы сосредоточил усилия и сценариста, и постановщика, и зрителя именно на ней.",340,69,2
16780,5472,"Сестра Сьюзи укоряет полицейского:",340,70,1
16781,5472,"«Вы давно перестали её искать!»",340,70,2
16782,5472,"Это очень хорошо, и это главное.",340,70,3
16783,5472,"Базовая метафора: куда чего девается, где она?!",340,70,4
16784,5473,"Когда-то Ницше написал, что категория «душа» придумана пытливыми живыми в процессе наблюдения за конвульсиями умирающего тела.",340,71,1
16785,5473,"Дескать, только и всего.",340,71,2
16786,5474,"Обычно делают упор на том, что Ницше объявил смерть Бога.",340,72,1
16787,5474,"Я в этой метафизике мало что понимаю, зато мне очень понятно недоверие философа к затверделому смыслу, близки его воля к поверхностному наблюдению и его доверие к сиюминутной интуиции (неслучайно Ницше весьма почитал Оффенбаха).",340,72,2
16788,5475,"В сущности, Джексон и компания осуществляют ровно ту же смыслопорождающую процедуру: силятся объяснить смерть живыми словами.",340,73,1
16789,5475,"В начале картины Сьюзи вместе с папой сбрасывает в глубокую зловонную яму холодильник (холодильник — это мясо, не правда ли?).",340,73,2
16790,5475,"В финале злодей сбрасывает туда же сейф с телом самой Сьюзи.",340,73,3
16791,5476,"Очередная неуютная рифма — и хоть какая-то правда жизни: вы полагаете, на престижном кладбище милому телу будет интереснее?!",340,74,1
16792,5477,"Теперь, когда злодей избавился от тела девочки, её душа (лишь мыслительная категория или взаправду нечто большее?) получает свободу и будто бы отправляется в какое-то новое измерение.",340,75,1
16793,5477,"В сущности, ничего не прояснилось.",340,75,2
16794,5477,"Священник и теолог нас, конечно, отругали бы, однако мы всего-навсего развлекаемся.",340,75,3
16795,5478,"Всего-навсего киношка.",340,76,1
16796,5479,"Давным-давно в одной западной книге я прочитал фразу, над которой тогда посмеялся, но которую почему-то запомнил.",340,77,1
16797,5479,"Запомнил, видимо, для того, чтобы убедиться в её универсальности много лет спустя.",340,77,2
16798,5480,"«Начиная с момента, когда у неё умер отец, полтора года её трахали, кто хотел и как хотел».",340,78,1
16799,5481,"Все люди делятся на две категории: те, кому эта фраза уже понятна, и те, кому её странный смысл пока что неясен.",340,79,1
16800,5481,"Возможно, впрочем, кое-кто не почувствует этого необязательного смысла никогда.",340,79,2
16801,5482,"В финале картины голосок Сьюзи сообщает:",340,80,1
16802,5482,"«Со временем все мои милые кости (то есть, конечно, любимые люди; привет тебе, великий и могучий русский язык в комплекте с переводчиком!) вступили в новые человеческие отношения и образовали новые связи».",340,80,2
16803,5482,"Всё стало на свои места.",340,80,3
16804,5482,"Мёртвые оставили в покое живых.",340,80,4
16805,5483,"Вот, однако, вопрос: кто взаимодействовал с живыми милыми телами в те условные полтора года, когда мешок с костями томился в злодейском сейфе?",340,81,1
16806,5483,"Существовала ли пресловутая середина, действительно ли девочка была там некоторое время, или же её рассказ инсценирован некими злодейскими силами?",340,81,2
16807,5484,"(Затверделые слова «память», «память сердца», «сердечная боль» и «любовь» употреблять запрещается.)",340,82,1
16808,5485,"И, наконец, почему глупые вопросы, на которые заведомо не будет ответа, представляются мне вопросами наиболее существенными?",340,83,1
16809,5486,"Два дня точно зомби ходил по вечернему городу, залитому водой, медитировал над The Lovely Bones и бормотал в лицо прохожим переделанное стихотворение одного современного поэта, кстати же, под названием «Март»:",340,84,1
16810,5487,"в мире подземном там а не тут",340,85,1
16811,5487,"как эту мёртвую Сьюзи зовут",340,85,2
16812,5488,"но не вмещает сознанье моё",340,86,1
16813,5488,"новое страшное имя её.",340,86,2
16814,5489,"Девочка, конечно, не кошка.",340,87,1
16815,5489,"Смерть, однако, одинаково беспощадна (вариант: милостива) к обеим.",340,87,2
