"sent_id","par_id","source","book_id","par_pos","sent_pos"
24989,7948,"Немецкий писатель, лауреат Нобелевской премии по литературе, Гюнтер Грасс предупреждает западный мир об опасности «переинформации».",699,1,1
24990,7948,"Человечество ещё никогда не имело в своём распоряжении такие технические средства информации как сегодня, но оно проинформировано хуже, чем раньше, сказал Гюнтер Грасс на открытой дискуссии в городе Овьедо, на севере Испании.",699,1,2
24991,7949,"«Пресса свободна только частично, так как она подвержена давлению с различных сторон и должна следовать экономическим приоритетам, которые ограничивают её независимость», сказал Гюнтер Грасс.",699,2,1
24992,7950,"«Мы все знаем, что США содержат криминальную организацию — ЦРУ, но только немногие говорят об этом».",699,3,1
24993,7950,"В дискуссии, которая устраивалась испанским фондом Принца Астурии, принимал участие также итальянский писатель Клаудио Магрис (Claudio Magris) и театральный деятель Иван Нагель (Ivan Nagel).",699,3,2
