"sent_id","par_id","source","book_id","par_pos","sent_pos"
9959,3151,"В 19 часов по Московскому времени в Болгарии был открыт торжественно год Российской Федерации в Болгарии.",156,1,1
9960,3151,"Открытие сделали оба президента двух стран, оно является частью двухдневного визита российского президента в Болгарии.",156,1,2
9961,3151,"Вместе с президентом приехали Дмитрий Медведев, Юрий Лужков и ряд директоров основных энергитических компаний в РФ.",156,1,3
9962,3151,"В Болгарии празднуется 130-летияе со дня освбождения Болгарии от турецкого ига русской армией.",156,1,4
9963,3151,"Путин также подпишет крупные договоры по строению АЭЦ Белене, нефтепровода Бургас -Алексондрополис и будут обсуждаться подписание ""Южного потока"" и проблем в Косово.",156,1,5
