"sent_id","par_id","source","book_id","par_pos","sent_pos"
36058,11431,"Еврокомиссия приняла решение отменить с 21 декабря 2007 пограничный контроль, действующий между старыми членами ЕС и девятью странами, присоединившимися к ЕС в 2004 году.",1241,1,1
36059,11432,"Словакия, Словения, Венгрия, Польша, Чехия, Эстония, Латвия, Литва и Мальта станут частью зоны действия Шенгенского соглашения, включающей сейчас 13 европейских стран, а также Норвегию и Исландию, не входящие в ЕС.",1241,2,1
36060,11433,"Теперь появится возможность свободно пересечь всю Европу от Португалии до Эстонии.",1241,3,1
36061,11433,"В аэропортах такой режим будет введен тремя месяцами позже, это связано с необходимостью усовершенствования системы контроля за прибывающими в эти страны гражданами из государств Восточной Европы.",1241,3,2
36062,11433,"Кроме этого, необходимо время, чтобы наладить обмен между службами безопасности всех членов ЕС.",1241,3,3
36063,11434,"Австрия настаивает на сохранении КПП на границах с Чехией и Словенией, мотивируя это несоответствием границ этих стран общеевропейским стандартам.",1241,4,1
36064,11435,"Кипр, Соединённое Королевство и Ирландия сейчас не планируют присоединиться к Шенгенскому соглашению.",1241,5,1
