"sent_id","par_id","source","book_id","par_pos","sent_pos"
30952,9884,"Публичные страницы",1004,1,1
30953,9884,"«Вконтакте» подружится с компаниями и брендами.",1004,1,2
30954,9885,"Социальная сеть «Вконтакте» представила новый тип страниц пользователей — «Публичные страницы», которые будут доступны для компаний, брендов и СМИ, сообщает Lenta.ru со ссылкой на РИА «Новости».",1004,2,1
30955,9885,"По замыслу разработчиков новые страницы будут более востребованы среди компаний для продвижения в соцсети.",1004,2,2
30956,9885,"Отмечается, что до настоящего момента пользователи могли завести лишь обычные страницы или страницы групп.",1004,2,3
30957,9886,"Новый тип учётной записи позволит создавать страницы с большим количеством функций.",1004,3,1
30958,9886,"В частности, пользователи смогут создавать страницы для различных товаров, музыкальных групп или авторов, а также компаний.",1004,3,2
30959,9887,"В настоящий момент завести публичную страницу могут только партнёры социальной сети, что уже и сделал Сбербанк.",1004,4,1
30960,9888,"Подробнее о последних разработках «Вконтакте» читайте в статье Частного корреспондента «Паника на корабле Дурова?»",1004,5,1
