"sent_id","par_id","source","book_id","par_pos","sent_pos"
107470,37517,"За растрату денег дольщиков введут уголовную ответственность .",3808,1,1
105163,36777,"Общество взаимного страхования застройщиков станет одним из главных барьеров на пути появления обманутых дольщиков в России, и не последним.",3808,2,1
105164,36778,"Депутат Госдумы от ""Единой России"" Александр Хинштейн предлагает ввести уголовную ответственность для застройщиков за нецелевое использование средств дольщиков, пишет РБК.",3808,3,1
105165,36778,"Как заявил Хинштейн, законопроект уже готов, сейчас он находится на согласовании и, скорее всего, до конца года его внесут на обсуждение в Госдуму.",3808,3,2
105166,36779,"Напомним, что с 1 января 2014 года вступил в силу закон о взаимном страховании ответственности застройщиков, согласно которому девелопер не может привлекать средства граждан, не застраховав свою ответственность перед ними одним из трех способов: посредством банковской гарантии, коммерческого страхования или вступления в ОВС.",3808,4,1
105167,36779,"Говоря о создании ОВСЗ, Хинштейна отметил, что оно станет одним из главных барьеров на пути появления обманутых дольщиков в России, и не последним.",3808,4,2
105168,36779,"Также планируется введение закона о рекламе объектов недвижимости, который не позволит привлекать покупателей на объекты, для которых не готовы все разрешительные документы.",3808,4,3
105169,36779,"По его словам, работа по решению проблем с обманутыми дольщиками идет давно, в том числе на законодательном уровне.",3808,4,4
105170,36779,"Депутат напомнил, что недавно Минрегион утвердил критерии, которые определяют, кто является обманутым дольщиком и какие объекты недвижимости подпадают под страхование.",3808,4,5
