"sent_id","par_id","source","book_id","par_pos","sent_pos"
9477,2983,"Три человека застрелены в ходе столкновений между сторонниками оппозиции и полицией в центре албанской столицы Тираны.",141,1,1
9478,2984,"В пятницу несколько тысяч сторонников оппозиции проводили протесты перед главным зданием албанского правительства, призывая его уйти в отставку в связи с обвинениями в коррупции и фальсификации выборов.",141,2,1
9479,2985,"По свидетельству очевидцев, демонстранты начали забрасывать полицейских камнями и подожгли по меньшей мере один полицейский автомобиль.",141,3,1
9480,2985,"Сотрудники правопорядка ответили слезоточивым газом и применили водометы.",141,3,2
9481,2986,"Оппозиция отказывается принять результаты парламентских выборов 2009 года и обвиняет правящую партию премьер-министра страны Сали Бериша в подтасовке их результатов.",141,4,1
9482,2987,"На прошлой неделе вице-премьер Илир Мета ушел в отставку в связи с обвинениями во взяточничестве.",141,5,1
