"sent_id","par_id","source","book_id","par_pos","sent_pos"
28937,9386,"Таблоид не виноват",941,1,1
28938,9386,"C газеты News of the World сняли подозрения в прослушке знаменитостей.",941,1,2
28939,9387,"Британская комиссия по жалобам на прессу не нашла свидетельств того, что журналисты таблоида News of the World занимаются незаконным сбором информации.",941,2,1
28940,9387,"Репортёров принадлежащей Руперту Мёрдоку газеты обвиняли в том, что они регулярно незаконно прослушивают телефоны знаменитостей, политиков и членов королевской семьи.",941,2,2
28941,9387,"В июле The Guardian опубликовала статью, в которой утверждала, что редакция News of the World выплатила пострадавшим от незаконной прослушки компенсации на общую сумму, превышающую миллиард фунтов, чтобы избежать разбирательств в суде.",941,2,3
28942,9388,"В 2006 году News of the World уже была замешана в скандале с прослушиванием телефонов, которое организовал репортёр Клайв Гудман.",941,3,1
28943,9388,"Журналист, писавший новости о жизни королевской семьи, признался тогда, что прослушивал телефон принца Чарльза, но заявил, что действовал по собственной инициативе, не ставя в известность редакцию.",941,3,2
28944,9388,"В 2007 году Гудман был приговорён к четырём месяцам тюрьмы, пишет Lenta.ru.",941,3,3
