"sent_id","par_id","source","book_id","par_pos","sent_pos"
76259,26156,"Право на жизнь",3185,1,1
76260,26157,"Римский Папа Бенедикт XVI резко критикует использование генной технология для создания, так называемых, дизайнерских детей.",3185,2,1
76261,26157,"В своей речи перед экспертами теологами, Бенедикт XVI назвал неприемлемыми исследования в попытках создания «превосходных детей».",3185,2,2
76262,26157,"В развивающихся странах растет интерес к биотехнологическим исследованиям в этом направлении.",3185,2,3
76263,26157,"Одновременно он критиковал практику искусственного оплодотворения, а также тесты, которые помогают распознать наследственные болезни в эмбрионах.",3185,2,4
76264,26158,"Право на жизни находится под угрозой во всем мире, говорит Папа.",3185,3,1
76265,26158,"Как о примерах такой угрозы он говорил о стремлении к легализации абортов в Латинской Америке и помощи в смерти в богатых странах.",3185,3,2
