"sent_pos","source"
0,"Где эта улица, где этот дом?"
1,"Власти Москвы озвучили себестоимость одного квадратного метра жилья в столице."
2,"Оказывается, себестоимость строительства жилых домов на территории столицы в настоящий момент составляет 40 тыс."
3,"рублей за квадратный метр."
4,"По крайне мере, эту цифру озвучил глава департамента Мосгорзаказа Леонид Моносов."
5,"Он также сообщил, что в текущем году его ведомство потратило на жилое строительство 61 млрд рублей из 157 выделенных бюджетом, сообщает РБК."
6,"Согласно статистики, которую озвучил столичный чиновник, с начала текущего года в Москве построено 600 тыс. квадратных метров социального жилья."
7,"До конца года эта цифра вырастет ещё на 400 тысяч."
8,"Кстати, такой же объём - 1 млн квадратных метров – будет возведён и в будущем году."
