"sent_id","par_id","source","book_id","par_pos","sent_pos"
34131,10908,"Крийя-йога на «Красном Октябре»",1155,1,1
34132,10908,"Открытая лекция индийского мастера Свами Шанкарананды Гири.",1155,1,2
34133,10909,"В Москву приезжает монах, астролог и провидец, учитель крийя-йоги Свами Шанкарананда Гири.",1155,2,1
34134,10909,"Он продолжает линию передачи, восходящую к великому гималайскому йогу Бабаджи и его преемникам Лахири Махасаю, Шри Юктешвару и Парамахансе Йогананде, автору известной книги «Автобиография йога».",1155,2,2
34135,10909,"В ходе публичной лекции, которая пройдет в центре йоги «Нараяна» на «Красном Октябре», Свами расскажет о своём видении духовного поиска и роли йоги в современном мире.",1155,2,3
34136,10909,"Затем последует семинар, на котором желающие смогут получить посвящение в крийя-йогу и узнать об этой практике, которая включает работу с дыханием и энергией.",1155,2,4
34137,10909,"Подробности здесь.",1155,2,5
34138,10910,"В «Частном корреспонденте» было опубликовано интервью со Свами Шанкаранандой Гири, которое можно прочитать здесь.",1155,3,1
34139,10911,"Об ашраме крийя-йоги в Ришикеше читайте в статье Частного корреспондента «Ашрам»",1155,4,1
