"sent_id","par_id","source","book_id","par_pos","sent_pos"
22617,7298,"Руководство российской Госдумы решило с помощью фотографа несколько раз в день снимать думский зал заседаний с целью сбора статистики посещаемости его депутатами.",561,1,1
22618,7298,"Это было сделано в ответ на интенсивную общественную критику после одного из репортажей телеканала «Рен-ТВ» и одного из сообщений в блоге известного общественного активиста Алексея Навального.",561,1,2
22619,7299,"В репортаже телеканала 19 мая 2010 года было показано заседание Госдумы, на котором депутаты утвердили закон о запрете употребления алкоголя за рулем.",561,2,1
22620,7299,"Согласно протоколу, закон поддержали 449 человек, однако после выяснения обстоятельств стало известно, что фактически присутствовали только 88 депутатов.",561,2,2
22621,7299,"Телеканал показал, как некоторые депутаты обходят места отсутствующих коллег и голосуют с помощью чужих карточек.",561,2,3
22622,7300,"После поста в блоге Навального несколько дней спустя тема начала широко обсуждаться на всех уровнях, включая президента и правительство, была сформирована общественная группа по созданию юридического давления на депутатов, участники которой координируют работу в ЖЖ-сообществе deputat_zero.",561,3,1
