"sent_id","par_id","source","book_id","par_pos","sent_pos"
18686,6116,"Цены сделаем на газ как у вас.",437,1,1
18687,6116,"Российские власти намерены увязать внутреннюю стоимость голубого топлива с экспортной.",437,1,2
18688,6117,"Чтобы повысить рентабельность газового производства, российские власти собираются лишить ФСТ возможности произвольно определять внутреннюю стоимость газа.",437,2,1
18689,6117,"С 2011 года внутрироссийская оптовая цена на голубое топливо будет рассчитываться, исходя из его экспортной стоимости.",437,2,2
18690,6117,"Как пишет РБК, это означает, что государство постепенно будет отказываться от госрегулирования цен на газ.",437,2,3
18691,6118,"В том случае, если Федеральная служба по тарифам уже не будет устанавливать ценовой потолок на внутреннем энергетическом рынке, российская стоимость голубого топлива поползёт вверх — вслед за экспортной.",437,3,1
18692,6118,"Эксперты прогнозируют, что в 2011—2013 годах внутренняя цена газа будет увеличиваться на 15% в год, что сделает отрасль более прибыльной.",437,3,2
18693,6118,"До сих пор же «Газпром» рапортовал, что убытки от внутренних продаж по заниженным ценам едва покрывались доходами от экспорта.",437,3,3
18694,6118,"Есть мнение, что если привязка внутренней стоимости голубого топлива к экспортной будет постоянной, то уже к 2014 году отрасль выйдет на равнодоходность внешнего и внутреннего газовых рынков.",437,3,4
