"sent_id","par_id","source","book_id","par_pos","sent_pos"
42990,13948,"Рождество без оружия",1535,1,1
42991,13948,"В Колумбии пройдёт воспитательный эксперимент.",1535,1,2
42992,13949,"Остаётся только восхищаться мужеством колумбийских военачальников.",1535,2,1
42993,13949,"Несмотря на беспокойное соседство с Венесуэлой, президент которой призвал свой народ готовиться к войне с Колумбией, главком ВС этой страны Фредди Падилья де Леон объявил о том, что со следующей недели на территории государства проводится эксперимент под названием «Рождество без оружия».",1535,2,2
42994,13949,"Он запретил колумбийцам носить оружие в течение месяца — с 7 декабря 2009 года по 7 января 2010 года.",1535,2,3
42995,13949,"Речь, разумеется, идёт об ограничениях для гражданских лиц.",1535,2,4
42996,13950,"«Рождество без оружия» — это вовсе не показательные выступления для Венесуэлы, а воспитательная акция для самой Колумбии.",1535,3,1
42997,13950,"Власти надеются, что запрет на ношение оружия будет способствовать сокращению числа убийств и преступлений в период празднования самых долгожданных и любимых праздников года.",1535,3,2
42998,13950,"Административный запрет будет сопровождаться профилактическими мероприятиями — коменданты гарнизонов проведут беседы с губернаторами и мэрами и совместно разработают программу по обеспечению безопасности предстоящих Рождества и Нового года.",1535,3,3
