"sent_id","par_id","source","book_id","par_pos","sent_pos"
28676,9319,"Генпрокуратура проверит распределение имён в зоне .РФ",925,1,1
28677,9319,"Скандал с распределением доменов может закончиться уголовными делами.",925,1,2
28678,9320,"В скандале с распределением доменов в зоне .РФ могут появиться первые уголовные дела.",925,2,1
28679,9320,"Вопросом о том, каким образом регистратор RU-Center в первые часы открытой регистрации зарезервировал более 60 тыс. доменов, а затем перепродал примерно 25 тыс. наиболее популярных адресов на закрытых аукционах, заинтересовалась Генпрокуратура.",925,2,2
28680,9320,"Чтобы преодолеть установленные квоты (4,8 тыс. обращений на одного регистратора в час), RU-Center привлекал других участников рынка, говорится в заключении комиссии.",925,2,3
28681,9320,"По факту признаков сговора ФАС уже возбудила дело, оно будет рассмотрено 24 февраля.",925,2,4
28682,9320,"Но основные претензии к RU-Center заключаются в том, что около 25 тыс. самых популярных доменов (например, магазин.рф, цветы.рф и др.) были реализованы путём закрытых аукционов, что противоречит правилам регистрации.",925,2,5
28683,9321,"Как пишет «Коммерсантъ», 11 февраля в Генпрокуратуре уже прошло межведомственное заседание по поводу запуска кириллического домена .РФ.",925,3,1
28684,9321,"На встречу были приглашены представители администрации президента РФ, МВД, ФСБ, Минкомсвязи, Росфинмониторинга, ФАС и Координационного центра национального домена сети Интернет (КЦ).",925,3,2
