"sent_pos","source"
0,"1 апреля Международная федерация шахмат (ФИДЕ) опубликовала новый рейтинг спиcок лучших шахматистов."
1,"Впервые рейтинг-лист возглавил чемпион мира ФИДЕ Веселин Топалов (Болгария)."
2,"Гарри Каспаров, который возглавлял список лучших шахматистов, исключён из рейтинга ФИДЕ."
3,"В прошлом году Каспаров закончил играть в официальных соревнованиях."
4,"По правил ФИДЕ шахматист, не принимающий участие в соревнованиях в течение года, исключается из рейтинг-списка."
5,"В первой двадцатке пять шахматистов из России."
6,"Наивысший рейтинг среди российских шахматистов у Петра Свидлера — 2743 (4-е место в мире)."
7,"Рейтинг список ФИДЕ первых 20 шахматистов на 1 апреля 2006 года Рейтинг список ФИДЕ первых 20 шахматистов России на 1 апреля 2006 года"
