"sent_id","par_id","source","book_id","par_pos","sent_pos"
104222,36497,"Президент ответил Собчак на вопрос о травле оппозиционеров",3773,1,1
104223,36498,"Власть не занимается организацией травли оппозиционеров, несогласных с ней.",3773,2,1
104224,36498,"Об этом заявил Владимир Путин на большой пресс-конференции, отвечая на вопрос корреспондента телеканала «Дождь» Ксении Собчак",3773,2,2
104225,36499,"По его мнению, никто из официальных органов и представителей власти этим не занимается.",3773,3,1
104226,36499,"«Никаких попыток, никаких указаний, никакой организации никогда не было и не будет, какой бы то ни было травли в отношении кого бы то ни было»,",3773,3,2
104227,36499,"– сказал он, заверив, что не существует «никакой организации, какой бы то ни было травли в отношении людей, которые не согласны с нашими действиями на Украине, в Крыму или по каким-то политическим вопросам».",3773,3,3
104228,36499,"Он отметил, что оппозиции надо научиться адекватно реагировать на то, что не все согласны с их позицией, сообщает РБК.",3773,3,4
