"sent_pos","source"
0,"Facebook на главной странице «Яндекса»."
1,"«Яндекс» предлагает новый виджет, который он разработал вместе с социальной сетью Facebook."
2,"Как известно, на главную страницу «Яндекса» можно устанавливать различные виджеты."
3,"В новом виджете можно будет увидеть основные новости из ленты событий: сообщения, фотографии и видеоролики, опубликованные друзьями пользователя."
4,"Комментарии и те, кому нравятся записи, скрыты ради компактности, но становятся видны в один клик."
5,"Из виджета можно написать сообщение или разместить фотографию, «полюбить» или прокомментировать чужие записи."
6,"Нововведение будет особенно удобно для тех, кто часто заходит на «Яндекс» и часто проверяет обновления на Facebook."
7,"Теперь эти два действия можно будет совместить."
8,"Установить виджет Facebook на главную страницу «Яндекса» можно уже сейчас."
