"sent_pos","source"
0,"Тасманийский дьявол может исчезнуть Редкий сумчатый хищник — тасманийский дьявол, обитающий только на острове Тасмания, может полностью исчезнуть."
1,"Виной тому является смертельная и заразная раковая опухоль, возникающая у дьяволов на морде (Devil facial tumour disease — DFTD)."
2,"Единственный способ спасти их — создать на каком-нибудь изолированном острове популяцию незараженных этим заболеванием животных."
3,"Известно, что раковые клетки обычно не передаются от матери к детенышам, поэтому, в принципе, можно отобрать свободных от болезни молодых дьяволов."
4,"Однако, по словам профессора Хамиша МакКалума, существует немало людей, которые выступают против этой идеи."
5,"Среди них есть как представители правительства штата Тасмания, так и некоторые защитники окружающей среды."
6,"Последние боятся, что помещение дьяволов в неестественную для них среду обитания, может негативно на них сказаться."
7,"Но по словам МакКалума времени остается немного — возможно, не более трех-четырех лет."
8,"После этого животных, незараженных этой болезнью, может совсем не остаться."
