"sent_id","par_id","source","book_id","par_pos","sent_pos"
13317,4306,"Ну что ?",222,1,1
13318,4306,"Где и когда всё пошло не так ?",222,1,2
13319,4306,"4 сентября 1975 года вышла в эфир телепередача « Что?Где?Когда? »",222,1,3
13320,4307,"Гордость советского креатива , редкий пример оригинальной игры на нашем телевидении , дожившей до наших дней , и субкультурный феномен .",222,2,1
13321,4307,"ЧГК — игра , в которой эффектные вопросы и ожесточённые споры гораздо важнее чётких ответов .",222,2,2
13322,4307,"Во что она превратилась за эти 36 лет ?",222,2,3
13323,4308,"Изначально передача напоминала « Счастливый случай » , в которой участвовали две семейные команды .",222,3,1
13324,4308,"Через год стала « телевизионным молодёжным клубом » , в неё уже играли студенты , каждый за себя , а в комнате стоял дым столбом .",222,3,2
13325,4308,"В 1977-м ведущие ушли за кадр ( тогда их было четыре , потом остался один Владимир Ворошилов , который более 10 лет работал , не выходя под очи благодарных зрителей ) .",222,3,3
13326,4308,"Появились привычные правила и символ — филин .",222,3,4
13327,4308,"Вы знаете порядок : шесть игроков за столом , вопросы — от телезрителей , игра до шести очков , обсуждение длится минуту .",222,3,5
13328,4308,"Начнёшь упоминать все изменения — устанешь : надо говорить и про сектор « Зеро » , и про чёрный ящик , про красные пиджаки , магистров и « как дела у вас , господин Козлов ? » .",222,3,6
13329,4308,"Словом , обширная мифология под музыку Штрауса , Чайковского и Yello ( песня Homage To The Mountain ) .",222,3,7
13330,4309,"Как и любая другая игра подобного толка , ЧГК слабо связана с образовательной функцией .",222,4,1
13331,4309,"В неё побеждают не всезнайки , а эрудиты с неординарным мышлением .",222,4,2
13332,4309,"Знаток Роман Морозовский в статье « ЧГКБР ( ЧтоГдеКогдаБрейнРинг ) » так объяснял принципы построения хорошего эфира .",222,4,3
13333,4309,"Вопросов одиннадцать , два сверхсложных , два элементарных , остальные — средние .",222,4,4
13334,4309,"Также у ведущего есть психологические портреты игроков .",222,4,5
13335,4309,"Идеальный вариант — счёт 6 : 5 в пользу знатоков .",222,4,6
13336,4309,"В итоге , несмотря на давно определённое правило , что « чистое знание вопросом ЧГК не является » , телеигроки ходят в России в мудрецах .",222,4,7
13337,4309,"К слову , однажды Александр Друзь пошёл на программу « Кто хочет стать миллионером ? » .",222,4,8
13338,4309,"И срезался на простом вопросе о граффити .",222,4,9
13339,4310,"Эта игра — не для умников , а для крепкой команды смекалистых .",222,5,1
13340,4310,"Шестеро игроков посажены за стол в первую очередь для напряжённой обстановки .",222,5,2
13341,4310,"Сок не в ответах , а в этом миксе беспомощности , убеждённости и эмоциональности .",222,5,3
13342,4310,"Плюс необходимый трёп ведущего с участниками , спонсорами , чайные и музыкальные паузы .",222,5,4
13343,4310,"Вообще , лучший игрок сезона и тысячелетия отнюдь не всегда является набитой знаниями вычислительной машиной .",222,5,5
13344,4310,"В хорошей команде есть свой дирижёр , который принимает решения , свой мистер всезнайка , свой мастер интуиции , свой логик и хладнокровный стратег .",222,5,6
13345,4310,"А уж на кого в итоге падёт выбор …",222,5,7
13346,4311,"Если плюнуть на условности , то всё это сильно напоминает « Танцы со звёздами » , когда большая часть программы проводится в умилительных обсуждениях па неловких селебрити .",222,6,1
13347,4311,"По сути , и вопросы можно разделить не по сложности и эффектности , а по функциональности .",222,6,2
13348,4311,"Обычный , к примеру , служит звеном , связующим игроков и зрителей у телеэкрана , — мол , глядите , и вы кое-что знаете !",222,6,3
13349,4311,"Мультимедийный коннектит аудиторию и тех , кто придумывает вопросы , демонстрируя , что « это может каждый — попасть в телевизор » .",222,6,4
13350,4311,"Вопрос с чёрным ящиком служит для разрядки обстановки .",222,6,5
13351,4311,"Тринадцатый сектор — для пропаганды интернет-зависимости .",222,6,6
13352,4311,"Блиц — как демонстрация правильности поговорки « Один в поле не воин » .",222,6,7
13353,4311,"И всё это — в прямом эфире ( начиная с 1986 года ) .",222,6,8
13354,4312,"То , что происходит сейчас в Охотничьем домике Нескучного сада , интересно анализировать , сравнивая картинки из разных периодов существования игры .",222,7,1
13355,4313,"Скажем , 80-е годы .",222,8,1
13356,4313,"Тогда ещё в особняке на улице Герцена множество аккуратно одетых людей ( многие при очках и усах ) , но нет никакого намёка на официоз .",222,8,2
13357,4313,"Рассаживается команда , внизу идут фамилии и статусы : инженер , студент , учительница , психолог .",222,8,3
13358,4313,"Во всём этом присутствует элемент компромисса между физиками и лириками , именуемый азартом .",222,8,4
13359,4313,"За очки зрители и участники в телевизоре получают адекватные призы — книги .",222,8,5
13360,4313,"В итоге ЧГК — прорыв для редактируемого ТВ , где позитивные молодые люди демонстрируют умение строить коммунизм в отдельной взятой студии .",222,8,6
13361,4314,"В 90-е годы знатоки стали зарабатывать деньги .",222,9,1
13362,4314,"« Интеллектуальное казино — единственное место , где можно заработать деньги своим собственным умом » .",222,9,2
13363,4314,"Там , где появляются деньги , появляется и элитарность .",222,9,3
13364,4314,"Из этих времён все знаменитые имена , ставшие уже символами , мемами , — Друзь , Двинятин , Бурда , Аскеров .",222,9,4
13365,4314,"Отсюда красные пиджаки и напряжённая атмосфера — вроде бы должно быть и забавно , однако больше напоминает сеанс спиритизма .",222,9,5
13366,4314,"Есть кольцо игроков , далее — цепочка любопытствующих , наблюдающих за магическими ритуалами .",222,9,6
13367,4314,"Голос извне .",222,9,7
13368,4314,"И ощутимый результат в виде настоящих купюр .",222,9,8
13369,4314,"Оказывается , нейрофизик в нашей стране может зарабатывать много !",222,9,9
13370,4315,"К слову , о профессиях .",222,10,1
13371,4315,"ЧГК в итоге стала не только миром , где можно вести активную жизнь в ранге ветерана .",222,10,2
13372,4315,"Игра также явно помогает идти вверх по карьерной лестнице .",222,10,3
13373,4315,"Одни , вроде Друзя и Козлова , засели на телевидении .",222,10,4
13374,4315,"Другие , вроде Максима Поташёва , к работе в консалтинге получают приятный бонус в виде президентства в Федерации спортивного бриджа России .",222,10,5
13375,4315,"Иные , как Виктор Сиднев , становятся мэрами подмосковного наукограда Троицка .",222,10,6
13376,4315,"Бурда поёт бардовские песни и ведёт кулинарное шоу .",222,10,7
13377,4315,"Александр Бялко засветился на радиостанции « Культура » и телешоу « Последний герой » .",222,10,8
13378,4316,"Есть мнение , что с появлением денег всё и испортилось .",222,11,1
13379,4316,"Впрочем , ещё в конце 80-х в качестве призов в игре появлялись всякие спонсорские подношения .",222,11,2
13380,4316,"А потом ещё было придумано правило , что команда не выбывает после поражения из эфира навсегда .",222,11,3
13381,4316,"Так начал формироваться круг ветеранов .",222,11,4
13382,4317,"Вообще иерархии и знаки отличия невероятны важны в « Что?Где?Когда? » .",222,12,1
13383,4317,"1984-м появилась « Хрустальная сова » , приз лучшему игроку ( ныне — сезонной серии из четырёх игр ) .",222,12,2
13384,4317,"Также в музее — « Бриллиантовая сова » , « Хрустальное гнездо » , красные пиджаки как символ « бессмертного члена клуба » ( правда , их через некоторое время отменили ) .",222,12,3
13385,4317,"Погоны лучшего капитана .",222,12,4
13386,4317,"Плюс звание магистра , которое вручают каждый юбилей ( характерно , что в 2008 году юбилея не было , но магистры проголосовали за то , что он есть ) .",222,12,5
13387,4317,"И обязательные смокинги .",222,12,6
13388,4317,"Ах да , ещё имеются хранители традиций — Михаил Барщевский и Григорий Гусельников .",222,12,7
13389,4318,"В 2000-м ЧГК попыталась вернуть себе былую остроту , вводя в игру новые команды из локальных организаций .",222,13,1
13390,4318,"Ещё в 1989-м появилась Международная ассоциация клубов « Что?Где?Когда? » .",222,13,2
13391,4318,"Спортивная версия ЧГК — реальная субкультура .",222,13,3
13392,4318,"В неё играют по несколько команд , отвечая на одни и те же вопросы .",222,13,4
13393,4318,"Здесь есть свои центры с множеством серьёзных сборных — вроде Минска .",222,13,5
13394,4319,"Однако снова было доказано , что дело не в знаниях , а в опыте играть под прицелом камер командой .",222,14,1
13395,4319,"А значит , свежая кровь отнюдь не приносила свежую порцию адреналина .",222,14,2
13396,4319,"А через год знатоки лишились и денежной кормушки .",222,14,3
13397,4319,"И право зарабатывать полностью перешло к зрителям .",222,14,4
13398,4319,"Это , в принципе , странное решение .",222,14,5
13399,4319,"Если всё испортилось из-за бабла , то такой вирус простым вычитанием не вылечишь .",222,14,6
13400,4319,"И привлекать зрителей длинным рублём — занятие банальное .",222,14,7
13401,4319,"С этого момента , думается , программа потеряла мистическую ауру и превратилась в своего рода клон нынешнего КВН .",222,14,8
13402,4319,"Любопытно , что Масляков в своё время вёл один из выпусков « Что?Где?Когда? » .",222,14,9
13403,4319,"« Клуб весёлых и находчивых » сейчас — огромная корпорация с кучей лиг и серьёзным капиталом , хотя по-настоящему интересных команд , мыслящих нешаблонно , там осталось наперечёт .",222,14,10
13404,4319,"Секрет — в многолетних традициях , тусовке и жёсткой редактуре .",222,14,11
13405,4320,"Так и в ЧГК — кажется ( если не приглядываться ) , что знатоки выигрывают там совершенно случайным образом , не проявляя особенной гениальности .",222,15,1
13406,4320,"Для того чтобы зритель не заскучал , иногда вводятся новые правила .",222,15,2
13407,4320,"Но в результате игра превращается в просто ещё одну версию « Спокойной ночи , малыши » , очередную программу , в которой полтора часа длятся вечность .",222,15,3
13408,4321,"ЧГК нынче , конечно , тот ещё мастодонт .",222,16,1
13409,4321,"Аналогичные передачи появились в телевизорах Азербайджана , Белоруссии , Болгарии , Израиля , Украины .",222,16,2
13410,4321,"Летом 2010-го в США началась подготовка аналогичной программы — рабочее название « Шесть » сменилось на « Шесть умов » ( Six Minds ) .",222,16,3
13411,4321,"То есть русское изобретение получило прописку на канале ABC , и это верный признак того , что увлекательное шоу превратилось в уважаемый артефакт эпохи , который , оказывается , можно легко внедрить в систему бесконечных американских псевдоинтеллектуальных шоу .",222,16,4
13412,4321,"Докатились .",222,16,5
