"sent_id","par_id","source","book_id","par_pos","sent_pos"
7268,2287,"Эстония стала первым постсоветским государством, вошедшим в зону евро.",98,1,1
7269,2288,"1 января 2011 года эстонцы перестали пользоваться кронами и перешли на общеевропейскую валюту.",98,2,1
7270,2289,"Сразу после наступления Нового года премьер-министр Эстонии Андрус Ансип стал первым жителем республики, который снял евро со своего банковского счета, воспользовавшись банкоматом в Таллине.",98,3,1
7271,2290,"Эстония ввела евро тогда, когда эта денежная единица переживает не лучшие времена: как известно, двум государствам еврозоны — Греции и Ирландии — потребовалась крупномасштабная международная финансовая помощь, в сложном положении остаются также Португалия, Испания и Италия.",98,4,1
7272,2291,"Два других государства Балтии — Латвия и Литва — планируют перейти на евро в 2014 году.",98,5,1
