"sent_pos","source"
0,"В Facebook появились две новые функции Пользователям стало доступно видеообщение."
1,"Основатель Facebook Марк Цукерберг на пресс-конференции в среду в штаб-квартире компании рассказал о том, что в социальной сети появилась новая возможность общаться в режиме видеочата, сообщает РБК."
2,"Появление новинки стало возможно благодаря сотрудничеству Facebook с популярным сервисом интернет-телефонии Skype."
3,"Видеообщение стало возможно непосредственно с личных страниц пользователей."
4,"Популярная соцсеть порадовала своих поклонников ещё одной новинкой."
5,"Теперь для них стал доступен групповой текстовый чат, который позволит пользователям сети общаться одновременно с несколькими друзьями."
6,"При этом если друг, приглашённый присоединиться к групповой беседе в Facebook, находится вдали от компьютера, позднее он сможет прочитать историю чата."
7,"Создавая для своих пользователей всё новые и новые функции, Facebook старается удерживать высокие позиции по популярности, ведь недавно у неё появился новый серьёзный конкурент — социальная сеть Google+."
8,"Новое детище компании Google, начавшее функционировать на прошлой неделе, сразу предоставило своим пользователям возможность видеочата."
