"sent_id","par_id","source","book_id","par_pos","sent_pos"
26338,8367,"Пассажирский самолет Ту-134 авиакомпании «Русэйр», на борту которого, по предварительным данным, находилось 52 человека, разбился в Республике Карелия 20 июня 2011 года в 23:40 по московскому времени при заходе на посадку.",782,1,1
26339,8368,"Местные СМИ и представители органов власти сообщили, что на борту находились 52 человека, 44 из них погибли; восемь человек выжили.",782,2,1
26340,8368,"Они доставлены в больницу.",782,2,2
26341,8368,"Состояние семи из них оценивается как крайне тяжелое.",782,2,3
26342,8368,"Самолет Ту-134 разбился вечером в понедельник около шоссе на удалении 700 метров от взлетно-посадочной полосы аэропорта Петрозаводска.",782,2,4
26343,8369,"Согласно выпуску новостей на радиостанции «Европа Плюс» самолёт совершал заход на посадку в условиях сильного тумана и пилоты отклонились от курса.",782,3,1
26344,8369,"Диспетчер дал команду набрать высоту и заходить на второй круг, однако самолёт задел (по всей видимости шасси) линию электропередач, что частично обесточило аэропорт (в частности погасли огни ВВП).",782,3,2
26345,8369,"Самолёт пропахал близлежащее шоссе подмяв под себя один из автомобилей, после чего съехал в придорожный кювет и вспыхнул.",782,3,3
26346,8370,"Как сообщает РИА «Новости», на борту самолета находились 43 пассажира и 9 членов экипажа.",782,4,1
26347,8371,"По факту крушения самолета Ту-134, выполнявшего рейс Москва-Петрозаводск, возбуждено уголовное дело по статье 263 УК РФ (нарушение правил безопасности движения и эксплуатации железнодорожного, воздушного или водного транспорта), сообщают российские СМИ.",782,5,1
26348,8372,"Восемь человек выжили, в том числе 10-летний ребенок и единственный член экипажа – стюардесса.",782,6,1
26349,8372,"Все они прооперированы и находятся в реанимации.",782,6,2
26350,8372,"Тех пострадавших, которых можно транспортировать, уже отправили спецрейсом в Москву.",782,6,3
26351,8372,"У значительного количества людей узнавших страшную новость о катастрофе Ту-134 была реакция, которую можно примерно выразить следующей фразой:",782,6,4
26352,8372,"«Не удивительно.",782,6,5
26353,8372,"Бедственное положение российской авиации хорошо известно.",782,6,6
26354,8372,"Поломки самолетов из-за износа или неадекватного обслуживания, использование контрафактных запасных частей, эксплуатация самолетовЧ с устаревшим пилотажно-навигационным оборудованием, стремление владельцев авиакомпаний извлечь максимальную прибыль, в том числе и за счет экономии на безопасности пассажиров, отсутствие на аэродромах современных средств радиотехнического обеспечения, непонятно какая подготовка экипажей…",782,6,7
26355,8372,"Подобная трагедия была только вопросом времени».",782,6,8
26356,8373,"Однако насколько такого рода мнение отражает реальное состояние гражданской авиации России?",782,7,1
26357,8374,"«DC-3» гражданской авиации России",782,8,1
26358,8375,"Обратимся прежде всего к главному участнику катастрофы – самолету Ту-134.",782,9,1
26359,8375,"Машину этого типа трудно назвать новой.",782,9,2
26360,8375,"Первый полет – в 1963 году, серийно выпускалась с 1965 по 1984 год, а всего было изготовлено 852 самолета.",782,9,3
26361,8375,"Самолет эксплуатировался во многих странах, правда, в основном тех, которые имели ту или иную степень политической и экономической близости с Советским Союзом.",782,9,4
26362,8375,"Разбившийся под Петрозаводском борт был выпущен в 1980 году.",782,9,5
26363,8376,"«31 год – возраст для самолета не маленький»,",782,10,1
26364,8376,"– скажут знатоки авиации.",782,10,2
26365,8376,"Что ж, доля истины в этих словах, безусловно, есть.",782,10,3
26366,8376,"Но как тогда быть с всемирно известным американским самолетом DC-3 (лицензионный советский вариант известен под именем Ли-2) или его военно-транспортной версией C-47?",782,10,4
26367,8376,"DC-3 выпускался с середины 1930-х и до начала 1950-х годов.",782,10,5
26368,8376,"Федеральное авиационное управление США несколько раз собиралось запретить регулярную эксплуатацию самолетов этого типа в Америке, но всякий раз не находило достаточно причин для этого и в конце концов сдалось, придя к выводу, что самолеты DC-3 «можно сломать, но нельзя износить».",782,10,6
26369,8376,"Машины этого типа и сейчас работают в некоторых странах, причем порой выполняя роль регулярного перевозчика (правда, как правило, грузов, а не людей).",782,10,7
26370,8377,"Избыток надежности как способ борьбы с безалаберностью: Ту-134 является в некотором смысле «DC-3» гражданской авиации СССР/России.",782,11,1
26371,8377,"В этой машине как нельзя полно отразился подход советских конструкторов к проектированию самолета, надежность которого должна во многом компенсировать, увы, нередко проявляющуюся в том числе и в области авиации российскую безалаберность.",782,11,2
26372,8377,"Весьма характерно это было продемонстрировано в ходе визита советского лидера Никиты Хрущева в США в 1959 году.",782,11,3
26373,8378,"У самолета Ту-114, на котором он прибыл в Соединенные Штаты, оказались столь высокие стойки шасси, что на авиабазе Эндрюс не нашлось подходящей высоты трапа для спуска пассажиров на землю.",782,12,1
26374,8378,"Пришлось Хрущеву буквально слезать с самолета по лестнице – процесс, в ходе которого он, по словам местной прессы, «показал зад всей Америке».",782,12,2
26375,8379,"Хрущев, как вспоминал его сын Сергей Хрущев в своей книге «Никита Хрущев: кризисы и ракеты», чрезвычайно гордился этим фактом (не спуском по лестнице, а отсутствием подходящего трапа).",782,13,1
26376,8379,"С его точки зрения, это было одним из проявлений силы советской авиации, в частности, того факта, что самолеты СССР крупнее и мощнее американских.",782,13,2
26377,8380,"Никто не объяснил Хрущеву, вспоминал его сын, что подобная высота «ног» Ту-114 – дань, которую конструкторы заплатили беспорядку на земле.",782,14,1
26378,8380,"Они просто постарались подальше убрать двигатели от посторонних предметов, которые могли оказаться на местах стоянки, рулежных дорожках или взлетно-посадочных полосах.",782,14,2
26379,8381,"Тот же концептуальный подход был использован, как уже отмечалось, и в Ту-134, да и в других советских машинах для гражданской авиации.",782,15,1
26380,8381,"Все они делались с запасом прочности, невиданным для западных самолетов – с более мощными шасси, более прочными крыльями, аэродинамическими формами, которые могли выдержать куда большую степень обледенения, чем зарубежные аналоги, двигателями, менее «привередливыми» к качеству горючего.",782,15,2
26381,8381,"Разумеется, за это приходилось платить цену, выражавшуюся в меньшей топливной эффективности советских машин, но в те времена стоимость керосина была одним из наименьших слагаемых общей стоимости эксплуатации самолета.",782,15,3
26382,8382,"По этой причине подавляющее большинство катастроф самолета Ту-134 были связаны не с механическими поломками, а с так называемым «человеческим фактором» или ошибками экипажа.",782,16,1
26383,8382,"Видимо, тот же фактор сработал и под Петрозаводском.",782,16,2
26384,8383,"А виноват ли самолет?",782,17,1
26385,8384,"Вот какое мнение высказал заслуженный пилот СССР Олег Смирнов в интервью газете «Комсомольская правда»:",782,18,1
26386,8384,"«Пока из той скудной информации, которая имеется, трагическое летное происшествие, которое повлекло за собой гибель людей, произошло таким образом, когда механизмы самолета, двигатели работали нормально, когда погода была приемлемой, но, судя по месту падения, в 700 метрах от взлетно-посадочной полосы, между ближней и ВПП, самолет допустил преждевременный уход или, как это называется, “ныряние” под глиссаду.",782,18,2
26387,8385,"То есть он снизился до недозволительно малой высоты в недозволительном месте.",782,19,1
26388,8385,"А это уже приводит к заключению, что здесь надо искать, как экипаж действовал и почему он действовал так безграмотно, что позволил преждевременное снижение на посадочной глиссаде.",782,19,2
26389,8386,"Существует абсолютно четкое и понятное правило для авиаций всех стран мира: если на высоте принятия решения – в данном случае она была равна 60 метрам – не установлен надежный контакт взлетно-посадочной полосы, экипаж обязан без вариантов дать взлетный режим двигателям, убрать шасси и уйти на второй круг.",782,20,1
26390,8386,"Почему это не было сделано, установит комиссия».",782,20,2
26391,8387,"Мнение, что причиной катастрофы стала ошибка пилота, разделяет и вице-премьер России Сергей Иванов, передало информационное агентство Reuters.",782,21,1
26392,8387,"Он усмотрел сходство между этой катастрофой и той, которую потерпел самолет Ту-154 польского президента Леха Качиньского в апреле 2010 года.",782,21,2
26393,8387,"Напомним, что причиной гибели президентского борта стала ошибка экипажа, который, как и в случае с петрозаводским Ту-134, допустил преждевременное снижение самолета на посадочной глиссаде.",782,21,3
26394,8388,"Как считает генеральный директор ассоциации «Аэропорт» Виктор Горбачев, Ту-134 – это нормальная, надежная машина, эксплуатацию которой не стоит спешить прекращать.",782,22,1
26395,8388,"С подобной точкой зрения трудно не согласиться.",782,22,2
26396,8388,"И доказательством этому является популярность Ту-134 как самолета бизнес-класса.",782,22,3
26397,8389,"Такого рода машинами, как известно, пользуются весьма состоятельные люди, не экономящие на собственной безопасности.",782,23,1
26398,8389,"И если они, имея возможность воспользоваться бизнес-джетами зарубежного производства, все же предпочитают Ту-134, это говорит в пользу надежности данного самолета.",782,23,2
26399,8389,"При надлежащем и своевременном техническом обслуживании эта машина вполне соответствует современным критериям безопасности, предъявляемым к гражданским пассажирским самолетам.",782,23,3
26400,8390,"Смотрите на авиакомпанию",782,24,1
26401,8391,"Такого понятия, как «общее состояние российской гражданской авиации», не существует.",782,25,1
26402,8391,"Имеется «Аэрофлот» – главный российский авиаперевозчик.",782,25,2
26403,8391,"Он эксплуатирует новейшие самолеты типа «Боинг» и «Эйрбас» и в целом у него самый молодой самолетный парк в Европе.",782,25,3
26404,8391,"Эти машины находятся в лизинге и проходят регулярное техническое обслуживание за рубежом в сертифицированных центрах.",782,25,4
26405,8391,"Экипажи получают подготовку, соответствующую международным стандартам, а многие летчики проходят обучение непосредственно на фирме «Эйрбас» в Тулузе.",782,25,5
26406,8391,"По этим причинам «Аэрофлот» входит в число 50-ти самых безопасных авиакомпаний мира.",782,25,6
26407,8392,"Есть еще ряд российских компаний, в частности, «Трансаэро» или S7, которые стремятся (и имеют возможности) соответствовать общемировым стандартам безопасности авиаперевозок.",782,26,1
26408,8392,"Что же касается более мелких, региональных авиаперевозчиков, то их флот зачастую состоит из двух-трех, а то и одного самолета советского производства.",782,26,2
26409,8392,"Своевременное и качественное обслуживание этих машин, подготовка экипажей является во многом делом совести владельца этой компании, который нередко глушит это чувство в погоне за прибылью.",782,26,3
26410,8392,"Такие компании в основном и добавляют черные краски в общую картину авиационной безопасности России.",782,26,4
26411,8393,"Вот что написал один из коллег погибших летчиков на профессиональном интернет-форуме www.forumavia.ru российских пилотов:",782,27,1
26412,8393,"«Если бы мы летали, как немцы или финны, только по правилам, то у нас не было бы этих дурацких катастроф однозначно.",782,27,2
26413,8393,"Вон у FINAIR ни одной катастрофы за всю историю.",782,27,3
26414,8393,"Не было бы Донецка, Самары, Петрозаводска, да и еще кучи других невинно убиенных.",782,27,4
26415,8393,"Все деньга людей жизни лишает.",782,27,5
26416,8393,"Рейс бедный, занюханной кампании, которая концы с концами еле сводит, а тут уходы (на запасной аэродром – Ю.К.), топливо.",782,27,6
26417,8393,"А правительство тут ни при чем, правильно тут выше говорили – половина портов в Европе без ИЛС, ДМЕ (навигационные посадочные системы – Ю.К.) и ничего, не бьются.",782,27,7
26418,8393,"Надо закрывать те компании, которые негласно среди пилотов культивируют культ экономии с риском (пускай даже оправданным).",782,27,8
26419,8393,"Распознать их легко: по бюджету, прибылям, короче, те, которые еле-еле на плаву».",782,27,9
26420,8394,"Итак, желающим летать самолетами российской гражданской авиации можно порекомендовать иметь дело с крупными перевозчиками типа «Аэрофлот» или «Трансаэро», в которых стремление к экономии не ставится выше задачи обеспечить максимальную безопасность пассажиров, и которые по прочим параметрам стремятся отвечать высшим мировым стандартам качества обслуживания своих клиентов.",782,28,1
