"sent_id","par_id","source","book_id","par_pos","sent_pos"
23879,7648,"22 октября WikiLeaks опубликовало около 400 000 засекреченных файлов об американской кампании в Ираке в период с 2002 по 2009 годы.",662,1,1
23880,7649,"Это крупнейшая утечка секретной военной информации в истории США.",662,2,1
23881,7649,"В документе говорится о 109 000 смертей в этот период, включая 66 000 мирных жителей.",662,2,2
23882,7650,"Основатель WikiLeaks Джулиан Ассандж заявил, что новые документы раскрывают правду о войне в Ираке.",662,3,1
23883,7650,"Выступая на пресс-конференции в Лондоне, он подчеркнул, что опубликованные необработанные отчеты с мест боевых действий не содержат имен или информации, которая может повредить каким-либо лицам или организациям.",662,3,2
23884,7651,"Ранее американские военные осудили готовящуюся публикацию, заявив, что она может поставить под угрозу жизни американских военнослужащих и их иракских союзников.",662,4,1
23885,7652,"Премьер-министр Ирака Нури аль-Малики заявил, что несанкционированная публикация секретных документов о войне в Ираке представляет собой попытку саботировать его кампанию по переизбранию на высший пост в стране.",662,5,1
23886,7652,"Аль-Малики борется за сохранение власти с тех пор, как мартовские выборы в парламент Ирака не выявили однозначного победителя.",662,5,2
