"sent_pos","source"
0,"Computer Bild — на русском языке Компьютерный журнал «Computer Bild» в конце марта, с периодичностью один раз в 14 дней, будет выходить в России на русском языке."
1,"Это будет первое издание из семейства под маркой «Bild» известного немецкого концерна «Шпрингер» (Springer-Konzern) на рынке печатной продукции в России."
2,"Примерно 50 % содержания журнала будет создаваться в московской редакции."
3,"Для продвижении журнала будет организована соответствующая рекламная компания."
4,"За последние два года дочернее предприятие концерна «Аксель Шпрингер АО» (Axel Springer AG) выпускает восьмое издание в России."
5,"Этим изданием становится «Computer Bild Russia», который одновременно будет четвёртым журналом концерна после: «Forbes», «Русский Newsweek» и «Wallpaper»."
6,"В четвёртом квартале 2005 года в Германии журнал «Computer Bild» выходил тиражом в 713 174 экземпляров."
