"sent_pos","source"
0,"«Доктор Хаус» калечит?"
1,"Американские учёные уверены, что увлечение телесериалами о работе врачей типа «Доктор Хаус» и «Анатомия страсти» негативно отражается на здоровье."
2,"До сих пор считалось, что сериалы о редких и необычных заболеваниях способствуют тому, что зрители начинают более бережно относиться к своему здоровью."
3,"Однако последние исследования показали, что постоянный просмотр этих фильмов вызывает негативный побочный эффект, сообщают «Медновости»."
4,"Оказывается, увлечение «Доктором Хаусом» и «Анатомией страсти» повышает страх подхватить тяжёлую инфекцию."
5,"Эти ипохондрические мысли ухудшают качество жизни, не давая человеку получать удовлетворение от неё."
6,"Данная закономерность была выявлена у молодых здоровых людей в возрасте от 18 до 31 года."
7,"Есть мнение, что негативное влияние медицинских сериалов на качество жизни населения в целом может оказаться значительно глубже, чем выявленное в результате опроса."
