"sent_id","par_id","source","book_id","par_pos","sent_pos"
15628,5112,"Что почитать?",292,1,1
15629,5112,"Теперь ответ на этот вопрос можно получить, заглянув в сводный рейтинг книжных продаж по крупнейшим торговым сетям России.",292,1,2
15630,5113,"Ещё недавно узнать о предпочтениях российских читателей можно было в лучшем случае лишь на сайтах конкретных книжных магазинов.",292,2,1
15631,5113,"Минувшей осенью портал Pro-Books.ru создал сводный рейтинг по нескольким торговым точкам, который позволил в режиме реального времени следить за изменением книжных предпочтений россиян.",292,2,2
15632,5113,"Теперь всем читателям и профессионалам в области книгоиздания доступен усовершенствованный вариант рейтинга, позволяющий отследить спрос на конкретные издания по восьми крупнейшим российским торговым сетям — за неделю, месяц, квартал или год.",292,2,3
15633,5113,"Для удобства пользователей имеется сводный рейтинг по художественным, нехудожественным и иностранным книгам.",292,2,4
15634,5113,"Читатели могут также ознакомиться со списком продаж каждого конкретного магазина, а заодно сравнить цену, по которой продаётся книга в различных местах.",292,2,5
15635,5113,"Так что теперь на вопрос, что же почитать и что сейчас читают люди, имеется конкретный и максимально детализированный ответ.",292,2,6
