"sent_pos","source"
0,"Пользователи «Яндекс. Почты» были переведены на версию 7.0."
1,"Таким образом, бета-тестирование сервиса, длившееся с июля 2010 года, завершилось."
2,"На старую версию вернулось всего лишь 0,14 % всех пользователей."
3,"Новая версия стала компактнее, и страницы грузятся быстрее, чем в предыдущей версии, благодаря переходу на технологию AJAX."
4,"Эта технология позволяет совершать многие операции практически без загрузки и уже используется в Google Mail, Yahoo!"
5,"Mail и Microsoft Hotmail."
6,"«Яндекс» также обновил интерфейс почтового сервиса."
7,"«Яндекс» начал постепенно переводить пользователей на новую, в то время бета-версию «Яндекс. Почты» в ноябре 2010 года."
