"sent_pos","source"
0,"Закрутили гайки для «отвёрток» Депутаты хотят убрать слабоалкогольные коктейли из ларьков и киосков."
1,"Буквально пошаговая доступность слабоалкогольных коктейлей приводит ко всё большему увеличению их потребления."
2,"Что особенно тревожит, пьют газированную химическую смесь в основном подростки – напиток довольно дёшев, красиво упакован, не требует закуски и вызывает быстрое опьянение."
3,"Очень часто такой 6-12-градусной шипучкой балуются и несовершеннолетние подростки."
4,"Озабоченный тревожной ситуацией депутат от «Справедливой России» Антон Беляков предложил своим коллегам законодательно запретить розничную реализацию всех слабоалкогольных коктейлей в палатках, киосках и ларьках, сообщает ИТАР-ТАСС."
5,"«Рынок слабоалкогольных коктейлей в России развивается стремительными темпами с ежегодным приростом в 20% и, по информации независимых экспертов, составляет около 470 млн литров в год, увеличиваясь, в основном, за счёт молодых покупателей», - отметил народный избранник в своей пояснительной записке к законопроекту."
6,"Если законодательная инициатива Белякова будет одобрена Госдумой, то «отвёртки» и «джин-тоники» можно будет приобрести только в магазинах и супермаркетах."
7,"Напомним также, что в августе некоторые депутаты уже предлагали убрать из киосков и ларьков пиво."
