"sent_id","par_id","source","book_id","par_pos","sent_pos"
26712,8500,"Допинга не было",797,1,1
26713,8500,"Допинг российских биатлонистов не входил в список запрещенных препаратов.",797,1,2
26714,8501,"Вещество, выявленное в допинг-пробах трех российских биатлонистов, не входило в список запрещенных препаратов, составленный Всемирным антидопинговым агентством (WADA).",797,2,1
26715,8501,"Об этом пишет газета «Советский спорт» со ссылкой на «осведомленные источники».",797,2,2
26716,8501,"Это вещество не являлось эритропоэтином китайского или российского производства, как сообщалось ранее, и вообще не являлось гормональным препаратом.",797,2,3
26717,8502,"По данным издания, ряду чиновников Олимпийского комитета России (ОКР) и Союза биатлонистов России (СБР) уже известно, какой именно препарат применяли Екатерина Юрьева, Альбина Ахатова и Дмитрий Ярошенко.",797,3,1
26718,8502,"Как отмечает «Советский спорт», спектрограмма этого вещества не совпадает со спектрограммой эритропоэтина.",797,3,2
