"sent_id","par_id","source","book_id","par_pos","sent_pos"
40325,12985,"По образу и подобию человека",1448,1,1
40326,12985,"Госдума собирается запретить клонирование на неопределённый срок.",1448,1,2
40327,12986,"Российские законодатели решили продлить запрет на клонирование человека на неопределённый срок.",1448,2,1
40328,12986,"Депутаты рассмотрят соответствующий законопроект 22 января, но решение по нему, по сути, уже принято.",1448,2,2
40329,12986,"Замглавы комитета Госдумы по охране здоровья академик РАМН Сергей Колесников заявил, что обсуждение документа велось с 2006 года, и большинство специалистов высказалось против отмены моратория на клонирование из-за обилия религиозных, этических и юридических проблем вокруг этой технологии.",1448,2,3
40330,12987,"До 2007 года клонирование человека в России было запрещено (соответствующий закон накладывал вето на подобные эксперименты на пятилетний срок, но 23 июня 2007 года эта пятилетка закончилась).",1448,3,1
40331,12987,"Теперь запрет хотят продлить до того момента, пока в силу не вступит федеральный закон, регулирующий порядок использования технологий клонирования.",1448,3,2
