"sent_id","par_id","source","book_id","par_pos","sent_pos"
23447,7532,"Ушли в себя.",619,1,1
23448,7532,"Китай сокращает экспорт товаров.",619,1,2
23449,7533,"Несмотря на регулярные сообщения национальных СМИ о том, что мировой финансовый кризис нанёс экономике Китая наименьший вред, а в последнее время хозяйство Поднебесной и вовсе очень близко к подъёму, объём внешней торговли КНР в июле нынешнего года продолжил своё падение, сообщает РБК.",619,2,1
23450,7533,"Так, показатели экспорта в середине лета снизились почти на четверть по сравнению с аналогичным периодом прошлого года, а уровень импорта уменьшился на 15%.",619,2,2
23451,7533,"Эксперты объясняют данные цифры резким падением спроса на товары на мировом рынке.",619,2,3
23452,7533,"В этой связи стоит отметить, что объём розничной торговли на внутреннем рынке Китая наоборот увеличился в годовом исчислении на 15,2%.",619,2,4
23453,7533,"Это означает, что общий объём продаж в КНР существенно не изменился.",619,2,5
