"sent_id","par_id","source","book_id","par_pos","sent_pos"
38489,12335,"Цена победы",1352,1,1
38490,12335,"Правительство России утвердило размеры денежных вознаграждений за спортивные достижения.",1352,1,2
38491,12336,"Российский кабинет министров окончательно определился с размерами денежных вознаграждений участникам сборных спортивных команд по олимпийским видам спорта.",1352,2,1
38492,12336,"Соответствующее постановление сегодня подписал премьер-министр РФ Владимир Путин.",1352,2,2
38493,12336,"Согласно документу, за победу на чемпионатах мира наши спортсмены будут зарабатывать по 7 тыс. долларов, за серебряную медаль — 3,5 тысячи, за третье место — 2100.",1352,2,3
38494,12336,"Ровно в два раза дешевле будут стоить медали, завоёванные на первенствах Европы - золотая медаль принесёт каждому участнику команды 3,5 тыс. долларов, серебряная сделает спортсмена богаче на 1750 зелёных, бронзовая — на 1050.",1352,2,4
38495,12336,"Отметим также, что аналогичное материальное вознаграждение в случае завоевания призового места полагается тренерам и специалистам спортивных команд, передаёт РГРК «Голос России».",1352,2,5
