"sent_id","par_id","source","book_id","par_pos","sent_pos"
45472,14721,"Сыновья умершего правителя эмирата в ОАЭ начали борьбу за власть",1614,1,1
45473,14721,"Старший сын покойного эмира шейх Халид называет себя главой эмирата, однако Высший совет ОАЭ поддерживает младшего сына, шейха Сауда.",1614,1,2
45474,14722,"Смерть правителя эмирата Рас-эль-Хайма спровоцировала борьбу за власть между двумя его сыновьями.",1614,2,1
45475,14722,"С одной стороны, Высший совет ОАЭ, в который входят главы семи эмиратов, составляющие федерацию, поддержал в качестве наследника четвёртого сына умершего правителя шейха Сауда, получившего образование в США.",1614,2,2
45476,14722,"С другой — старший сын покойного эмира шейх Халид разместил в Сети видеообращение, в котором называет себя главой эмирата.",1614,2,3
45477,14723,"Как сообщает РБК, в настоящее время дворец шейха Халида окружён федеральными войсками.",1614,3,1
45478,14723,"Но пока неясно, собираются ли войска задержать сторонников шейха или просто обеспечат плавный переход власти к младшему сыну покойного правителя Рас-эль-Хайма.",1614,3,2
