"sent_id","par_id","source","book_id","par_pos","sent_pos"
107658,37568,"Футбольный бонус",3823,1,1
105445,36863,"Гус Хиддинк назвал размер суммы, которую получит каждый игрок сборной России за попадание на ЧМ-2010.",3823,2,1
105446,36864,"100 тысяч евро на каждого ― таков размер бонуса, который наставник российской футбольной сборной обещает за получение путёвки в ЮАР.",3823,3,1
105447,36864,"Стала ли эта информация достойным стимулом для наших спортсменов, будет понятно уже в субботу, когда состоится самый важный отборочный матч для отечественной сборной.",3823,3,2
105448,36864,"Матч Россия ― Германия пройдёт 10 октября в Москве на стадионе «Лужники».",3823,3,3
105449,36864,"В случае победы над немцами нашим ребятам наверняка уже не придётся участвовать в стыковочных матчах, чтобы получить путёвку на ЧМ-2010.",3823,3,4
105450,36864,"Российской сборной останется обыграть не самую сильную команду Азербайджана.",3823,3,5
105451,36864,"Если же футбольный бог отвернётся от наших ребят, то им придётся провести дополнительные поединки с командами, которые также как и Россия занимают второе место в своей подгруппе.",3823,3,6
105452,36864,"В этом случае останется утешаться лишь тем, что российские футболисты выйдут на поле с заведомо слабым соперником, поскольку занимают высокую позицию в рейтинге ФИФА.",3823,3,7
