"sent_pos","source"
0,"Skype в Facebook Совместный проект двух популярных платформ обещает стать популярным."
1,"Пользователи Facebook в скором времени смогут общаться по Skype через Facebook Connect."
2,"Им будут доступны не только звонки, но и отправка SMS и видеочат."
3,"Об этом сообщает «Руформатор»."
4,"Сервис Facebook Connect разрешает пользователям социальной сети заходить на сторонние сайты с помощью своей учётной записи."
5,"Интеграция двух популярных платформ будет на основе версии Skype 5.0, находящейся сейчас на бета-тестировании."
6,"Официальный релиз ожидается в течение месяца."
7,"Предполагается, что интеграция Skype с его 560 млн абонентов (и 124 млн активных пользователей) и Facebook с его полумиллиардом активных членов не только серьёзно расширит возможности обоих сервисов, но и приведёт к совместному резкому росту и без того самой большой социальной сети и самого крупного сервиса интернет-телефонии."
