"sent_pos","source"
0,"После длительных переговоров странам ЕС удалось согласовать решение о продлении срока действия льгот по налогу на добавленную стоимость до 2010 года."
1,"Первоначально это решение заблокировали Польша, Чехия и Кипр, потребовавшие учесть их собственную политику в налоговой сфере."
2,"Последней из этих трех стран подписать договор согласилась Польша."
3,"По стандартам ЕС, ставка налога на добавленную стоимость не может быть меньше 15 процентов."
4,"Однако ряд стран Евросоюза, включая Великобританию, Голландию, Люксембург, Испанию и Италию, обходят это правило, предоставляя некоторым компаниям в сфере услуг значительные налоговые скидки."
5,"Cрок действия предыдущего соглашения, которое давало право на предоставление скидок, истек 31 декабря 2005 года."
6,"Еврокомиссар по налогообложению Ласло Ковач назвал решение о продлении срока действия налоговых льгот компромиссом, который даст конкретные преимущества всем странам-членам ЕС."
7,"Если бы соглашение не было подписано, странам ЕС пришлось бы поднять налог на добавленную стоимость до 15-процентного минимума или столкнуться с санкциями со стороны Еврокомиссии."
