"sent_id","par_id","source","book_id","par_pos","sent_pos"
3226,1095,"Прирастать бывшим CCCР",41,1,1
3227,1095,"Горе-государство Владимира Лорченкова",41,1,2
3228,1096,"Десятилетие, справедливо названное нулевыми годами, хочется закончить на мажорной ноте; поэтому я напишу сейчас о главном для меня литературном открытии — 2010: о молодом русском писателе из Молдавии Владимире Лорченкове.",41,2,1
3229,1097,"Кто-то знал его раньше, кто-то наверняка откроет несколько позже, но для меня годом знакомства с творчеством этого — чтобы не перебарщивать до поры до времени с комплиментами — определённо лучшего русского прозаика ближнего зарубежья стал именно 2010-й.",41,3,1
3230,1098,"И, напротив, другое главное открытие года — петербургский писатель, пишущий под экзотическим псевдонимом Фигль-Мигль, и его вышедший в декабре дебютный роман «Щастье» (см., например, колонку «Запомните это чудовищное имя» на сайте «Фонтанка.ру») — лично для меня таковым не стало, но не стало только потому, что творчество этого прозаика известно мне в рукописи, и остаётся только надеяться на то, что вслед за первым романом будет опубликован и второй, уже написанный, «Ты так любишь эти фильмы», и оба они придутся по вкусу если уж не широкому (что как раз вряд ли), то продвинутому читателю.",41,4,1
3231,1099,"В декабре вышел и роман «Табор уходит» Лорченкова.",41,5,1
3232,1099,"Я, собственно, прочитал три его романа — «Прощание в Стамбуле» (которое год назад было номинировано на «Нацбест»), «Гавани Луны» (в рукописи) и вот «Табор», который, наряду и наравне со «Щастьем», должен, на мой взгляд, стать главным фаворитом очередного цикла ведущих литературных премий.",41,5,2
3233,1099,"А уж «Русской премии» он заслуживает чуть ли не на три года вперёд.",41,5,3
3234,1100,"В прозе Лорченкова мы впервые на русской почве сталкиваемся с весьма любопытным явлением, которое до сих пор было знакомо читателю главным образом по англоязычной литературе Британского Содружества Наций, а также по испано- и португалоязычной словесности Латинской Америки (знакомо, естественно, в переводах).",41,6,1
3235,1101,"Это не столько постколониальная литература (термин и вообще неточный, а применительно к бывшим республикам СССР и неверный), сколько сначала окраинная, а потом не без насилия отделённая.",41,7,1
3236,1102,"Отделённая — но устремившаяся в метрополию.",41,8,1
3237,1103,"То есть литература, сознательно противопоставившая политической центробежности последних десятилетий (а в Латинской Америке — и последних веков) собственную центростремительность.",41,9,1
3238,1104,"Да и печатается молодой писатель, естественно, в Москве — а где же ему ещё печататься?",41,10,1
3239,1105,"О том, что латиноамериканская литература сильнее испанской и португальской, знает каждый (хотя и та и другая сильны сами по себе).",41,11,1
3240,1105,"Едва ли не все лучшие английские писатели современности — выходцы из бывших колоний: Салман Рушди, Джозеф Кутзее и т.д.",41,11,2
3241,1105,"Да и литература США имеет в анамнезе постколониальное происхождение и до сих пор развивается с полемической оглядкой на несколько чопорную британскую традицию.",41,11,3
3242,1106,"У нас же ничего такого до сих пор не было.",41,12,1
3243,1107,"Напротив, в зону глухого читательского безразличия попали с распадом СССР и закавказское барокко, и прибалтийский экзистенциализм, и какой-нибудь Айтматов, и даже Василь Быков.",41,13,1
3244,1108,"Из литературы, поставляемой странами бывшего СССР, мы читаем разве что Сергея Жадана (в переводе на русский) да Андрея Куркова, хотя его куда больше читают на Западе.",41,14,1
3245,1108,"Ну и любители фантастики очень жалуют супругов Дяченко, а любители подросткового фэнтези — нашумевшую год назад Мариам Петросян («Дом, в котором…»).",41,14,2
3246,1109,"И вот наконец появился Владимир Лорченков.",41,15,1
3247,1110,"Пишет он много, пишет стильно и разностильно.",41,16,1
3248,1111,"Это первый русский писатель (может быть, после раннего Василия Аксёнова), пошедший на выучку к американцам и, в его случае, к латиноамериканцам.",41,17,1
3249,1112,"В анамнезе Фолкнер с его Йокнапатофой и Маркес с Макондо — и тем и другим стала для Лорченкова суверенная Республика Молдова.",41,18,1
3250,1113,"В анамнезе Норман Мейлер с бойцовским куражом интеллектуала, всегда готового помериться чем угодно и с кем угодно.",41,19,1
3251,1114,"В анамнезе всё тот же Рушди с его национальной и религиозной сатирой (пиши наш герой не о христианской стране, а о мусульманской, его бы за «Табор уходит» приговорили к смертной казни).",41,20,1
3252,1115,"В анамнезе ушедший в заканчивающемся году из жизни Сарамаго (и фолкнеровская «Притча»).",41,21,1
3253,1116,"В анамнезе, наконец, Лимонов с его гонзо-репортажами из собственной постели и Пелевин, на место которого Лорченков откровенно метит.",41,22,1
3254,1117,"Метит откровенно до простодушия, нахваливая самого себя сверх всякой меры, вслед как раз за Лимоновым, да и за Мейлером, ключевой текст которого программно называется «Самореклама».",41,23,1
3255,1117,"Так что западные влияния явно преобладают.",41,23,2
3256,1118,"«Прощание в Стамбуле» и пока не изданные «Гавани Луны» — очень североамериканские романы, очень любовно-криминальные, очень мейлеровские; «Табор уходит», напротив, очень латиноамериканский.",41,24,1
3257,1119,"Действие разворачивается в условной Молдавии 2004 года, показанной не только как failed state (это, в конце концов, сравнительно респектабельный политологический термин), но и как total ruined state.",41,25,1
3258,1120,"Никто и ничто не работает, все воруют, грабят, насилуют и убивают друг друга, в государстве, наряду с православием, введена вторая официальная религия — вера в Евросоюз, и священники отправляют оба культа сразу по совместительству.",41,26,1
3259,1121,"Интеллигенция и часть номенклатуры сидит в тюрьме (точнее, в лагере смерти) — первая за измену идее Евросоюза и/или любовь к России, вторая — просто потому, что тёплые местечки нынешних узников успели приглянуться кому-то другому и были, естественно, перекуплены.",41,27,1
3260,1122,"Евросоюз же, со вступлением в который Молдавия, считается, расцветёт, уже давно и в мыслях не держит (если вообще когда-то держал) пополнить этим горе-государством свои и без того не больно-то сплочённые ряды.",41,28,1
3261,1123,"Молдаване нужны Европе как рабы на плантациях в Италии и Португалии, молдаванки — как проститутки в борделях Турции, но и только-то.",41,29,1
3262,1124,"Счастливая молдавская семья, по Лорченкову, выглядит так: муж на заработках в России (ну или в Португалии), жена на заработках в Турции, дети — в детдоме.",41,30,1
3263,1125,"Но и детдома в условном 2004 году уже позакрывались; в стране отстреляли и съели собак — и наибольшую опасность для населения теперь представляют злобные стаи беспризорников.",41,31,1
3264,1126,"Меж тем в лагере смерти возникает некое вероучение, жесточайше преследуемое, но постепенно охватывающее всю страну.",41,32,1
3265,1127,"Вероучитель Серафим, которого потом распинают на кресте палачи и топят в нечистотах преданные сподвижники, утверждает, будто молдаване — это новый избранный народ, а значит, им тоже, подобно древним евреям и современным израильтянам, за все страдания уготована земля обетованная (вот только не очень понятно где).",41,33,1
3266,1128,"Причём генералиссимусом «исходников», как они себя называют, становится комендант лагеря Майор Плешка (Майор — это имя, а не должность).",41,34,1
3267,1129,"Точнее, заместитель коменданта, но своего молодого начальника — племянника самого и.о. президента Гимпу — Плешка сверг и утопил в нечистотах вместе с Серафимом и с главным лагерным стукачом (бывшим президентом Академии наук).",41,35,1
3268,1130,"Отчасти это напоминает советского времени анекдот про колхозное собрание (купить фанеры, выстроить самолёт и улететь отсюда к чёртовой матери), но только отчасти.",41,36,1
3269,1131,"С другой стороны, в романе, несомненно, наличествует элемент капустника, то есть прицельного сатирического огня по совершенно неизвестным в России фигурам с молдавского политического, медийного и культурного небосклона.",41,37,1
3270,1132,"Замечу, кстати, в определённый укор молодому писателю, что ему всё же местами не хватает той звериной серьёзности, с которой расписывает свои ужасы, да и свою сатиру, например, тот же Маркес.",41,38,1
3271,1132,"В тексте «Табора» (вернее, за текстом) не раз проскальзывает восхищение писателя собственным творчеством, талантом и остроумием: «Ай да Лорченков, ай да сукин сын!»",41,38,2
3272,1133,"Да и само по себе лорченковское остроумие ещё не вышло на пелевинский уровень, хотя и нынешние результаты, разумеется, обнадёживают.",41,39,1
3273,1133,"То есть писатель уже достаточно остроумен, но ещё ни в коей мере не афористичен; над этим ему, осознав данную цель, необходимо работать и работать.",41,39,2
3274,1134,"Уже упомянутая «счастливая молдавская семья» — едва ли не единственное отрадное исключение.",41,40,1
3275,1135,"В прологе (и в эпилоге) романа дюжина «апостолов» Серафима захватывает здание, в котором проходит выездное заседание ООН в Риме, и принимается методично отстреливать глав государств, начиная с президента Ющенко, по ошибке принятого за президента Качиньского, однако живучего украинца не убьёшь, оказывается, даже из гранатомёта.",41,41,1
3276,1136,"А три миллиона молдаван (всего их четыре миллиона, но четвёртый ещё не вернулся с зарубежных заработков) идут по водам Чёрного моря яко посуху.",41,42,1
3277,1136,"Правда, неизвестно куда…",41,42,2
3278,1137,"Прирастать Сибирью — мечта давняя.",41,43,1
3279,1137,"А вот то, что литературная Россия (не путать с одноимённым еженедельником) будет прирастать бывшим СССР, убедительнее всего доказывает зарубежный опыт, упомянутый в начале колонки.",41,43,2
3280,1137,"Но доказывает он это умозрительно, а вот творчество молодого талантливого и плодовитого писателя из Молдавии — доказательство уже вполне конкретное.",41,43,3
3281,1137,"Табор, конечно, уходит, но уходит он с песнями и плясками.",41,43,4
3282,1138,"И куда же это он, интересно, уйдёт?",41,44,1
3283,1139,"В Москву, в Москву, в Москву…",41,45,1
