"sent_id","par_id","source","book_id","par_pos","sent_pos"
33095,10539,"Акваматерия",1089,1,1
33096,10539,"Создан материал, практически целиком состоящий из воды.",1089,1,2
33097,10540,"Учёные Токийского университета представили своё новое изобретение: это материал, на 95% состоящий из воды и совершенно безопасный как для человека, так и для окружающей среды.",1089,2,1
33098,10540,"В «акваматерию» входит минеральная глина и полиакрилат натрия.",1089,2,2
33099,10540,"При небольшом добавлении этих веществ вода приобретает гелеобразную форму и превращается в новый материал — прозрачный, упругий, легко тянущийся и так же легко восстанавливающий форму.",1089,2,3
33100,10540,"При этом вещество по показателям прочности не уступает силикону и способно выдерживать высокие температуры (до 100 градусов Цельсия).",1089,2,4
33101,10540,"Предполагается, что новый материал будут использовать в медицине и косметологии, в частности в пластической хирургии.",1089,2,5
