"sent_pos","source"
0,"Акваматерия Создан материал, практически целиком состоящий из воды."
1,"Учёные Токийского университета представили своё новое изобретение: это материал, на 95% состоящий из воды и совершенно безопасный как для человека, так и для окружающей среды."
2,"В «акваматерию» входит минеральная глина и полиакрилат натрия."
3,"При небольшом добавлении этих веществ вода приобретает гелеобразную форму и превращается в новый материал — прозрачный, упругий, легко тянущийся и так же легко восстанавливающий форму."
4,"При этом вещество по показателям прочности не уступает силикону и способно выдерживать высокие температуры (до 100 градусов Цельсия)."
5,"Предполагается, что новый материал будут использовать в медицине и косметологии, в частности в пластической хирургии."
