"sent_pos","source"
0,"Антиалкогольный аутотренинг Власти обещают, что через 10 лет россияне будут пить в три раза меньше."
1,"Государство считает, что его усилия, предпринимаемые в рамках антиалкогольной кампании, должны не просто приносить конкретные плода, а стремиться к конкретным показателям."
2,"В этой связи руководство страны поставило перед собой задачу к 2020 году уменьшить употребление россиянами спиртных напитков с нынешних 18 до 5—8 литров в год."
3,"Эта цель прописана в утверждённой «Концепции государственной политики по снижению масштабов злоупотребления алкогольной продукцией и профилактике алкоголизма среди населения РФ», пишет Lenta.ru."
4,"Достигать поставленной цели Россия будет в два этапа."
5,"Сначала — до 2013 года — жители страны снизят алкогольный порог до 15 литров, а в последующие семь лет до 8—5 литров в год."
6,"Несмотря на всю трудность поставленной задачи, выполнять её придётся, поскольку масштабы алкоголизации в России грозят полной деградацией нации."
7,"Напомним, по данным ВОЗ, употребление алкоголя более 8 литров в год на человека уже опасно для здоровья населения."
