"sent_pos","source"
0,"Буш подписал бюджет на 2008 год В среду президент США Джордж Буш подписал бюджет на 2008 год, в который вошли 70 миллиардов долларов на войну в Ираке и Афганистане."
1,"В своем заявлении глава Белого Дома сказал, что 555- миллиардный бюджет должен обеспечить траты правительства без повышения налогов и без, как он назвал, вызывающих возражения изменений политики, которые требовал Конгрессом."
2,"Демократы-законодатели не смогли добиться от президента графика вывода американских войск из Ирака."
3,"Джордж Буш предупредил, что наложит вето на любой законопроект, в котором будут установлены сроки прекращения военных действий."
4,"Президент выразил также огорчение тем фактом, что в бюджет вошли ассигнования на проекты, принятые под давлением отдельных лоббистских групп."
5,"Глава Белого Дома сказал, что он распорядился, чтобы директор по бюджету нашел возможность избежать «пустых трат»."
6,"Буш подписал закон перед отъездом на свое ранчо в Техасе, где он встретит Новый год."
7,"Утвержденный бюджет финансирует все правительственные учреждения, за исключением обороны, до сентября 2008 года."
8,"Ассигнования на военные нужды были подписаны президентом ранее."
