"sent_id","par_id","source","book_id","par_pos","sent_pos"
11358,3612,"А что у вас, ребята?",197,1,1
11359,3612,"Переиздание легендарного «Томека» будит в душе чувства, которые, возможно, не стоило бы тревожить понапрасну.",197,1,2
11360,3613,"При виде нового, оформленного под путевой дневник издания легендарного «Томека» сердца бывших мальчишек наверняка забьются чаще.",197,2,1
11361,3613,"По крайней мере тех, кто помнит фантастические приключения Томека Вильмовского и его старших друзей в Австралии, Африке, Сибири, Америках и много где ещё.",197,2,2
11362,3613,"Помнит ловко пойманных или подстреленных Томеком редких зверей, помнит снежного человека, пигмеев с отравленными стрелами, охотников за головами и агентов царской полиции.",197,2,3
11363,3613,"И, пожалуй, сердце у них забьётся не вовсе напрасно.",197,2,4
11364,3613,"Конечно, книжки о приключениях Томека с 1970-х годов переиздавались у нас множество раз, в том числе и в последнее время; их общий тираж — несколько миллионов.",197,2,5
11365,3613,"Так что никто вроде не мешает читать их хоть на бумаге, хоть в Сети.",197,2,6
11366,3613,"Однако дело в том, что на этот раз за издание серии романов Альфреда Шклярского принялось уважаемое издательство «Розовый жираф», а это обычно служит знаком правильной селекции книжек.",197,2,7
11367,3614,"Пока вышло два первых тома, и вот что о них следует знать.",197,3,1
11368,3614,"Оформление, как уже было сказано, отличное, к тому же обе книжки заново проиллюстрированы.",197,3,2
11369,3614,"Томек на новых картинках похож на юного Лео Ди Каприо, но это выглядит даже органичнее, чем старые, классические рисунки, на которых мальчика изображали в виде карлика-ковбоя.",197,3,3
11370,3614,"Что касается собственно текста, то, прежде чем давать его ребёнку, стоит хорошенько подумать.",197,3,4
11371,3614,"О том, чтобы читать эти книжки вслух, лучше сразу забыть: даже после титанической редактуры, которую книжки прошли в «Розовом жирафе», текст остаётся невыносимо тяжёлым, неудобопроизносимым и путаным.",197,3,5
11372,3615,"Таким образом, остаётся два пути: либо нарушить главное правило и, не читая, сослать «Томеков» в детскую, либо всё же, собравшись с духом, попытаться разобраться, почему нам всем это так нравилось в детстве, и, если повезёт, вновь пережить те давние волнующие впечатления.",197,4,1
11373,3615,"И впечатления эти, поверьте, окажутся не слабее, чем от сериала «Школа».",197,4,2
11374,3616,"Сюжет обеих книжек незатейлив: юный поляк Томек вместе с отцом и его помощниками отправляется на далёкий континент ловить диких животных для зоопарка.",197,5,1
11375,3616,"Звероловы продираются сквозь джунгли, находят искомого ослика или коалу и отправляются обратно.",197,5,2
11376,3616,"Ну и по ходу отбиваются от мухи цеце и песчаной бури, попадают в плен к бандитам или на пир карликов.",197,5,3
11377,3616,"Словом, это традиционный приключенческий жанр, а не новомодное изобретение, маскирующее под авантюрным сюжетом социальную или экзистенциальную тему.",197,5,4
11378,3617,"И всё бы ничего, если бы приключения Томека, даже с их претензией на познавательность, оставались в рамках этого жанра.",197,6,1
11379,3617,"Кстати сказать, именно из-за попытки Шклярского сделать книжки полезными юношеству их невозможно читать вслух.",197,6,2
11380,3617,"Как, например, повернётся язык произнести примерно такое: «Папа, кто это?» — взволнованно спросил мальчик.",197,6,3
11381,3617,"«Это слон, — успокоил Томека отец.",197,6,4
11382,3617,"— Слон — самое большое животное в Африке, у него есть два бивня, которые являются ценным поделочным материалом.",197,6,5
11383,3617,"Слон принадлежит к типу хордовых, отряду хоботных…»",197,6,6
11384,3617,"В таких разговорах наши герои провели время до обеда».",197,6,7
11385,3617,"Это можно читать только глазами и как можно быстрее, что спасает от корявого языка, но не от сути повествования.",197,6,8
11386,3618,"А суть в том, что долгое время приключения Томека позиционировались как книжки не только прививающие детям вкус к географии, но и воспитывающие в юных читателях смелость, отзывчивость, способность жертвовать собой ради дела.",197,7,1
11387,3618,"Однако если внимательно посмотреть текст, выходит ровно наоборот.",197,7,2
11388,3618,"Во-первых, давайте не будем называть туризм любовью к науке.",197,7,3
11389,3618,"Томеку всё время то жарко, то холодно, то жёстко, то колко, причём он не забывает при любой возможности сообщать об этом старшим.",197,7,4
11390,3618,"Чужие страны интересуют его скорее как факт, потому что ему не нравится ни климат, ни обычаи, ни кухня, отличные от польских.",197,7,5
11391,3618,"И какие-то простецкие щи для него заведомо лучше, чем, скажем, суп из кенгурятины.",197,7,6
11392,3618,"Про аборигенов он без тени стеснения говорит отцу: «Какие же они примитивные!",197,7,7
11393,3618,"Не могут даже толком построить себе шалаш!»",197,7,8
11394,3618,"Впрочем, его спутники немногим лучше — взрослые и опытные дядьки вступают в теологические дискуссии с шаманами, издеваются над арабским гадателем и на голубом глазу заявляют, что с ленивыми и прожорливыми неграми-носильщиками надо построже.",197,7,9
11395,3618,"Педагогический эффект превосходит все ожидания: можете сразу ставить крест на том хрупком представлении о толерантности, которое, возможно, сложилось у вашего ребёнка под влиянием книжек Перниллы Стальфельт.",197,7,10
11396,3619,"Надо думать, именно за этот тихий праздник непослушания книжки про Томека так нравились детям.",197,8,1
11397,3619,"Ведь ежу понятно: всё, что там происходит, — неправильно.",197,8,2
11398,3619,"И всё-таки здорово!",197,8,3
11399,3619,"Сам Шклярский нигде, кроме городской Америки и Польши, не бывал и, следовательно, совершенно не представлял, о чём писал.",197,8,4
11400,3619,"Поэтому стоит только его героям попасть в другую страну, как сразу вокруг них начинают бегать стада диких животных, рычать львы, сыпаться с деревьев неназванные «сочные плоды», двигаться с подарками процессии полуголых аборигенов…",197,8,5
11401,3620,"В общем, ничего страшного.",197,9,1
11402,3620,"Просто имейте в виду: приключения Томека немного не из нашего политкорректного, просвещённого и электрифицированного времени.",197,9,2
11403,3620,"Это неумирающая классика, тёмная и полная колониальных предрассудков, непривычная, но по-своему притягательная.",197,9,3
11404,3620,"И может быть, нам не так уж обязательно обо всём этом вспоминать и волноваться.",197,9,4
11405,3620,"Во всяком случае, мы же выросли — и ничего, не такие уж плохие люди получились.",197,9,5
