"sent_id","par_id","source","book_id","par_pos","sent_pos"
41398,13392,"Новый президент Бразилии определится во втором туре",1476,1,1
41399,13392,"Прошедшее накануне голосование не дало окончательных результатов.",1476,1,2
41400,13393,"Основной претендент на пост главы государства — представительница правящей Партии трудящихся Дилма Руссефф - не смогла набрать необходимое количество голосов, чтобы стать победителем на президентских выборах, сообщает РИА «Новости».",1476,2,1
41401,13394,"По предварительным данным Высшего суда по вопросам выборов Бразилии, Руссеф набрала наибольшее количество голосов — 45,96% после обработки 92,24% голосов.",1476,3,1
41402,13394,"Однако по местным законам для победы необходимы 50% плюс один голос.",1476,3,2
41403,13395,"Во втором туре, который назначен на 31 октября, Дилме Руссефф предстоит встретиться с представителем Социал-демократической партии Жозе Серра, ставшим вторым по итогам первого тура выборов.",1476,4,1
41404,13395,"Обработанные на данный момент бюллетени свидетельствуют о том, что Серра набрал 33% голосов.",1476,4,2
41405,13395,"Третье место бразильские избиратели отдали ещё одной представительнице прекрасного пола - кандидату от Партии зелёных Марине Силве (предварительно 19,82%).",1476,4,3
