"sent_id","par_id","source","book_id","par_pos","sent_pos"
33838,10825,"C 1 октября 2010 года российский Центробанк запрещает работу банковских отделений, у которых только одна функция — обмен валют.",1067,1,1
33839,10825,"Как пишет сайт www.1obl.ru, причиной для этого назвали непрозрачность бухгалтерии пунктов обменных валют, а также трудность контроля, который должен был осуществлять регулятор.",1067,1,2
33840,10825,"Часто наблюдались ситуации, когда в обменниках незаконно оборачивали средства и играли на валютном курсе фактически как мошенники.",1067,1,3
33841,10826,"Банкиры заявляют, что этого большая часть населения пострадать не должна.",1067,2,1
33842,10826,"Сайт www.1obl.ru предупреждает, что в ситуации, когда на некой вывеске размещена надпись «Обменный пункт», гражданин имеет право пожаловаться на это в любое отделение w:Центробанка — теперь такие учереждения не имеют право работать в России.",1067,2,2
