"sent_pos","source"
0,"МГУ так и не вошёл в первую сотню лучших вузов мира Самый престижный университет России за год сумел подняться только на 28 мест в мировом рейтинге."
1,"Согласно списку лучших университетов мира, составленному британским журналом Times Higher Education, МГУ имени М.В. Ломоносова занимает лишь 155-ю позицию из 200 возможных."
2,"По сравнению с предыдущим годом, когда самый престижный российский вуз находился лишь на 183-й строчке, ситуация улучшилась, однако от этого всё равно не легче."
3,"Еще один вуз, который вошёл в упомянутый рейтинг, — Санкт-Петербургский госуниверситет."
4,"Он разместился на 18 позиций ниже столичного вуза."
5,"Отметим также, что лидером списка второй год является Гарвард (США), на втором месте разместился британский Кембридж, а замыкает тройку лидеров американский Йель."
6,"Оксфорд оказался лишь на пятой строчке рейтинга."
7,"Примечательно, что в первой сотне лучших вузов мира стало больше азиатских университетов — в этом году их уже 16."
8,"Об особенностях и недостатках российского образования читайте в статье «Капитуляция российского капитала знаний» ."
