"sent_pos","source"
0,"«Блуждающий» в небе над Вашингтоном самолет вынудил организовать эвакуацию служащих из Капитолия и примыкающих к нему правительственных зданий."
1,"Федеральное авиационное управление пояснило, что в субботу после полудня (время Восточного побережья США), в тот момент, когда снижающийся пассажирский лайнер компании Piedmont Airlines вошел в строго охраняемое воздушное пространство над американской столицей, в непосредственной близости от здания Конгресса, с ним пропала связь."
2,"Полиция оповестила правительственных служащих о необходимости срочно эвакуироваться."
3,"В это время ВВС США выслали истребители для перехвата подозрительного воздушного судна."
4,"Однако тревога была ложной."
5,"Авиационное управление сообщило, что связь с бортом восстановили, и самолет, следовавший обычным рейсом из города Хилтон Хэд в Южной Каролине, благополучно приземлился в пункте назначения – Вашингтонском аэропорту Рейган."
6,"По сведениям Associated Press, пилот объяснил инцидент тем, что случайно настроил бортовую радиостанцию на неверную частоту, из-за чего с ним некоторое время не могли связаться."
