"sent_id","par_id","source","book_id","par_pos","sent_pos"
21361,6905,"Увидеть мысль",479,1,1
21362,6906,"Японским ученым удалось распознать изображение, увиденное человеком, сканируя его мозг.",479,2,1
21363,6907,"Как пишет Yomiuri, группе сотрудников отделения нейроинформатики Международного исследовательского института передовых средств коммуникации (Киото, Япония) удалось восстановить изображение, увиденное человеком, опираясь только на сканирование электрических сигналов мозга.",479,3,1
21364,6908,"В ходе эксперимента исследователи продемонстрировали испытуемым серию из 440 различных картинок, представлявших собой произвольное сочетание темных и светлых пятен, на 100-пиксельном экране.",479,4,1
21365,6908,"В процессе демонстрации измерялась активность в зрительной коре головного мозга с помощью функционального магниторезонансного сканера.",479,4,2
21366,6908,"После этого испытуемым были показаны буквы, составляющие слово neuron, и элементарные геометрические фигуры.",479,4,3
21367,6908,"На основе сравнения предыдущей серии изображений и показаний сканера исследователям удалось правильно реконструировать новые изображения по сигналам мозговой активности.",479,4,4
21368,6909,"За последние несколько лет нейрофизиология сделала большой шаг вперед в понимании работы человеческого мозга.",479,5,1
21369,6909,"Работа японских ученых — большой шаг на пути реализации идеи прямого человеко-машинного интерфейса.",479,5,2
