"sent_id","par_id","source","book_id","par_pos","sent_pos"
23257,7449,"Марк Уэббер одержал победу на Гран-при Испании.",590,1,1
23258,7449,"Фернандо Алонсо финишировал вторым.",590,1,2
23265,7449,"Напарник Марка по команде Ред Булл, Себастьян Феттель, пришёл к финишу третьим.",590,1,3
23259,7450,"Стартовав с поула, Уэббер удержал позицию в первом повороте и начал отрываться.",590,2,1
23260,7450,"После волны остановок Льюис Хэмилтон смог опередить Феттеля и вышел на второе место, а Михаэль Шумахер обогнал Дженсона Баттона и вышел на пятое место.",590,2,2
23261,7450,"Долгое время Баттон шёл на дистанции атаки от семикратного чемпиона мира, но ни одна попытка атаки не увенчалась успехом.",590,2,3
23262,7450,"На 55-ом круге Феттель вылетел в одном из поворотов в гравий, после чего совершил незапланированный пит-стоп, и вернулся в гонку на четвёртом месте.",590,2,4
23263,7450,"За круг до финиша шедший вторым Хэмилтон вылетел с трассы в третьем повороте из-за прокола левого переднего колеса.",590,2,5
23264,7450,"Стартовавший с 19-ой позиции Виталий Петров провёл уверенную гонку и финишировал 11-ым.",590,2,6
