"sent_pos","source"
0,"Кремль всех опередил Подана первая заявка на регистрацию сайта в доменной зоне .РФ."
1,"RU-CENTER начал приём заявок на регистрацию доменных имён в кириллической зоне .РФ, и первое заявление поступило от администрации Кремля на имя «кремль.рф»."
2,"Всего в регистрационный центр поступило около десятка заявок, в том числе на имена «екатеринбург.рф» и «екбург.рф» — их подала администрация Екатеринбурга."
3,"Стоимость рассмотрения каждой заявки от владельца того или иного товарного знака составляет 1200 рублей."
4,"Как пишет Lenta.ru, до апреля 2010 года регистрация сайтов в зоне .РФ будет закрытой."
5,"С 20 апреля по 15 июня имена будут продаваться с аукциона, и только после этого сайт в кириллической зоне можно будет зарегистрировать свободно."
6,"По словам главы Минкомсвязи Игоря Щеголёва, приоритетная регистрация имён для госорганов и владельцев известных торговых марок введена для того, чтобы исключить киберсквоттерство."
