"sent_pos","source"
234,"И, наконец, средства, необходимые для начала намеченных мероприятий, должны быть предусмотрены уже в бюджете следующего года."
235,"Этот механизм должен быть запущен с 1 января 2007-го."
236,"И прошу вас вместе с Правительством разработать порядок реализации предложенной мною программы."
237,"В завершение этой темы отмечу: проблему низкой рождаемости невозможно решить без изменения отношения всего общества к семье и ее ценностям."
238,"Академик Лихачев когда-то писал, что любовь к родному краю, к своей стране начинается с любви к своей семье."
239,"И мы должны восстановить наши старинные ценности бережного отношения к семье, к родному очагу."
240,"Занимаясь проблемой повышения рождаемости, поддержки молодой семьи, мы не вправе забывать и о старших поколениях."
241,"Это люди, всю жизнь свою отдавшие стране, работавшие на страну, а если нужно было, встававшие на ее защиту."
242,"Мы должны сделать все, чтобы обеспечить им достойную жизнь."
243,"Вы знаете, в течение последних лет неоднократно, причем раньше запланированных сроков, производилось повышение пенсий."
244,"И в следующем году пенсии будут повышены в общей сложности еще почти на 20 процентов."
245,"Значительные ресурсы направляются государством на обеспечение социальных льгот и гарантий для пенсионеров и ветеранов."
246,"Необходимо продолжить программу обеспечения этих категорий граждан социальным жильем, включая использование дополнительных ресурсов в рамках проекта «Доступное жилье»."
247,"Прошу и впредь рассматривать эту работу как один из ключевых приоритетов."
248,"Уважаемые депутаты и члены Совета Федерации!"
249,"Для уверенного, спокойного решения всех вышеперечисленных вопросов, вопросов мирной жизни, мы должны найти убедительные ответы на угрозы в сфере национальной безопасности."
250,"Отмечу, что на фоне активно идущего переустройства мира появилось множество новых проблем, с которыми реально сталкивается наша страна."
251,"Эти угрозы менее предсказуемы, чем прежние, и уровень их опасности в полной мере до конца не осознан."
252,"В целом очевидна тенденция к расширению в мире конфликтного пространства и, что крайне опасно, его распространению на зону наших жизненно важных интересов."
253,"Так, весьма значительной остается террористическая угроза, причем существенной подпиткой для террористов, источником их вооружений и полем для практического применения сил остаются локальные конфликты, зачастую на этнической почве, к которой нередко добавляется межконфессиональное противостояние, которое искусственно нагнетается и навязывается миру экстремистами самых разных мастей."
254,"Знаю, что кое-кто очень бы хотел, чтобы Россия погрязла в этих проблемах и, как следствие, не могла бы решить ни одну из своих проблем полноценного развития."
255,"Серьезные опасности связаны и с распространением оружия массового поражения."
256,"В случае если такое оружие попадет в руки террористов, а они к этому стремятся, последствия будут просто катастрофическими."
257,"Подчеркну: мы однозначно выступаем за укрепление режима нераспространения без каких либо изъятий, на основе международного права."
258,"Известно, что силовые методы редко приносят искомый результат, а их последствия подчас становятся страшнее изначальной угрозы."
259,"Хотел бы сегодня поднять еще один важный вопрос."
260,"Значимым направлением международной политики на протяжении десятилетий является разоружение."
261,"И наша страна внесла огромный вклад в поддержание стратегической стабильности в мире."
262,"Между тем на фоне такой острейшей угрозы, как международный терроризм, ключевые вопросы разоруженческой тематики фактически выпали из глобальной повестки, в то время как говорить о конце гонки вооружений преждевременно."
263,"Более того, ее маховик сегодня раскручивается, и она сама реально выходит на новый технологический уровень, угрожая появлением целого арсенала так называемых дестабилизирующих видов оружия."
264,"До сих пор не обеспечены гарантии невывода оружия, в том числе и ядерного, в космос."
265,"Существует потенциальная угроза создания и распространения ядерных зарядов малой мощности."
266,"Кроме того, в средствах массовой информации, в экспертных кругах уже обсуждаются планы использования межконтинентальных баллистических ракет с неядерными боеголовками."
267,"Пуск такой ракеты может спровоцировать неадекватную реакцию со стороны ядерных держав, включая полномасштабный ответный удар с использованием стратегических ядерных сил."
268,"При этом далеко не все в мире смогли уйти от стереотипов блокового мышления и предрассудков, доставшихся нам от эпохи глобальной конфронтации."
269,"Не смогли, несмотря на то что в мире произошли кардинальные перемены."
270,"И это тоже серьезно мешает находить адекватные и солидарные ответы на общие проблемы."
271,"С учетом всего сказанного военные и внешнеполитические доктрины России также должны дать ответ на самые актуальные вопросы, а именно: как уже в нынешних условиях и совместно с партнерами эффективно бороться не только с террором, но и с распространением ядерного, химического, бактериологического оружия, как гасить современные локальные конфликты, как преодолевать другие новые вызовы?"
272,"И, наконец, нужно четко осознавать, что ключевую ответственность за противодействие всем этим угрозам, за обеспечение глобальной стабильности будут нести ведущие мировые державы – державы, обладающие ядерным оружием, мощными рычагами военно-политического влияния."
273,"Вот почему вопрос модернизации Российской Армии является сейчас крайне важным, и он реально волнует российское общество."
274,"В посланиях разных лет так или иначе мы говорили о проблемах национальной безопасности."
275,"Но сегодня хотел бы более детально проанализировать современное состояние и перспективы развития нашего флота и Российской армии."
276,"В эти дни мы чествуем ветеранов, поздравляем их с Днем Победы."
277,"Пожалуй, главный урок истории Великой Отечественной войны – это необходимость поддержания боеготовности Вооруженных Сил."
278,"При этом подчеркну, что наши расходы на оборону в процентах к ВВП сегодня являются сопоставимыми либо чуть меньшими, чем у других ядерных держав, к примеру, у Франции или Великобритании."
279,"А в абсолютных цифрах, в конечном итоге мы же с вами понимаем, важны именно абсолютные цифры, они в два раза меньше, чем у этих стран, и уже не идут ни в какое сравнение с расходами Соединенных Штатов Америки."
280,"Их военный бюджет в абсолютных величинах почти в 25 раз больше, чем у России."
281,"Вот это и называется в оборонной сфере «их дом – их крепость»."
282,"И молодцы."
283,"Молодцы!"
284,"Но это значит, что и мы с вами должны строить свой дом, свой собственный дом крепким, надежным."
285,"Потому что мы же видим, что в мире происходит."
286,"Но мы же это видим."
287,"Как говорится, «товарищ волк знает кого кушать»."
288,"Кушает и никого не слушает."
289,"И слушать, судя по всему, не собирается."
290,"Куда только девается весь пафос необходимости борьбы за права человека и демократию, когда речь заходит о необходимости реализовать собственные интересы?"
291,"Здесь, оказывается, все возможно, нет никаких ограничений."
292,"Но, понимая всю остроту этой проблемы, мы не должны повторять ошибок Советского Союза, ошибок эпохи «холодной войны» – ни в политике, ни в оборонной стратегии."
293,"Не должны решать вопросы военного строительства в ущерб задачам развития экономики и социальной сферы."
294,"Это тупиковый путь, ведущий к истощению ресурсов страны."
295,"Это тупиковый путь."
296,"Естественно, возникает вопрос: можем ли мы в условиях такого финансового диспаритета с другими ведущими державами надежно обеспечить свою безопасность?"
297,"Конечно, можем, конечно."
298,"И я сейчас скажу как."
299,"Предлагаю поговорить об этом поподробнее."
300,"Еще несколько лет назад сама структура Вооруженных Сил была неадекватна существующим реалиям."
301,"Образовался и провал в оснащении армии и флота современными средствами вооруженной борьбы."
302,"В период с 1996 по 2000 год не было заложено ни одного корабля, а на вооружение было принято всего 40 образцов военной техники."
303,"Войска проводили учения на картах, только на картах, флот был прикован к берегу, авиация – к аэродрому."
304,"И в 1999 году, когда возникла необходимость противостоять масштабной агрессии международного терроризма на Северном Кавказе, проблемы армии обнажились до боли."
305,"Я очень хорошо помню разговор с начальником Генерального штаба тогда."
306,"Он, наверное, здесь в зале присутствует."
307,"Для эффективного ответа террористам нужно было собрать группировку численностью не менее 65 тыс."
308,"человек, а во всех Сухопутных войсках в боеготовых подразделениях – 55 тысяч, и те разбросаны по всей стране."
309,"Армия – 1400 тыс."
310,"человек, а воевать некому."
311,"Вот и посылали необстрелянных пацанов под пули."
312,"Никогда этого не забуду."
313,"И наша с вами задача в том, чтобы это никогда больше не повторилось."
314,"Сегодня ситуация в армии качественно меняется."
315,"Создана современная структура Вооруженных Сил, идет переоснащение армейских подразделений новыми и модернизированными образцами военной техники."
316,"Образцами, которые составят основу системы вооружения вплоть до 2020 года."
317,"И с этого года уже начались массовые, серийные закупки техники для нужд Министерства обороны России."
318,"Реанимировано военное кораблестроение, строятся боевые корабли практически всех типов."
319,"В ближайшее время в состав ВМФ России войдут две новые атомные субмарины со стратегическим оружием на борту."
320,"Они оснащены новыми ракетными комплексами «Булава», которые вместе с комплексом «Тополь-М» станут основой стратегических сил сдерживания."
321,"Подчеркну: это первые подводные атомные стратегические лодки, строительство которых заканчивается в новой России."
322,"Ни одной лодки подобного типа с 1990 года мы не строили."
323,"Кстати, шахтным «Тополем-М» уже оснащено 5 полков Ракетных войск стратегического назначения."
324,"И в этом году в одну из ракетных дивизий начнет поступать и его подвижной вариант."
325,"Еще один важный показатель последних лет – в войсках ведется интенсивная боевая и оперативная подготовка."
326,"Проведены десятки полевых учений, дальних морских походов."
327,"Сегодня только один из них закончился."
328,"Как следствие таких перемен, заметно укрепился боевой дух, психологическое состояние солдат и офицеров."
329,"И мы знаем примеры без преувеличения массового героизма среди военнослужащих и сотрудников правоохранительных органов."
330,"Показательны и изменения в структуре военного бюджета."
331,"Из года в год увеличиваются ассигнования на оборону."
332,"При этом все больше средств вкладывается именно в качество Вооруженных Сил."
333,"И в ближайшие годы мы должны добиться того, чтобы расходы на развитие составили не менее половины военного бюджета."
334,"При этом каждый бюджетный рубль должен быть использован рачительно и по прямому назначению."
335,"Давно говорил о необходимости сформировать единую систему заказов и поставок вооружений, военной техники и средств тылового обеспечения."
336,"Правительству до конца года необходимо решить эту задачу, довести эту работу до конца, а затем создать и уполномоченное федеральное гражданское агентство."
337,"Очень рассчитываю, что эта мера даст и свой положительный эффект для преодоления коррупции в армейской среде."
338,"Полагаю необходимым назвать сейчас основные требования к уровню задач, которые должны быть готовы решать наши Вооруженные Силы."
339,"В течение ближайших пяти лет предстоит существенно повысить оснащенность стратегических ядерных сил современными самолетами дальней авиации, подводными лодками и пусковыми установками Ракетных войск стратегического назначения."
340,"Уже сегодня успешно ведутся работы по созданию уникальных комплексов высокоточного оружия и боевых маневренных блоков, не имеющих для потенциального противника предсказуемой траектории полета."
341,"Наряду со средствами преодоления систем противоракетной обороны, которые у нас есть уже сейчас, новые виды вооружений позволяют нам сохранить то, что безусловно является одной из самых существенных гарантий прочного мира."
342,"А именно сохранить стратегический баланс сил."
343,"Мы должны учитывать планы и направления развития вооруженных сил в других странах, должны знать о перспективных разработках, но не гнаться за количественными показателями, не «палить» деньги зря."
344,"Наши ответы должны быть основаны на интеллектуальном превосходстве, они будут ассиметричными, менее затратными, но будут безусловно повышать надежность и эффективность нашей ядерной триады."
345,"Обращаю внимание: современной России нужна армия, имеющая все возможности адекватно реагировать на современные же угрозы."
346,"У нас с вами должны быть Вооруженные Силы, способные одновременно вести борьбу в глобальном, региональном, а если потребуется – и в нескольких локальных конфликтах."
347,"Должны при любых сценариях гарантировать безопасность и территориальную целостность России."
348,"Еще одно важное требование – это соответствие процесса комплектования целям создания профессиональной и мобильной армии."
349,"Особо подчеркну, что в течение последних пяти лет уже были проведены необходимые сокращения численности Вооруженных Сил."
350,"И в дальнейшем доведение их до оптимального уровня в 1 млн человек не предусматривает специальных мероприятий по сокращению, а должно быть достигнуто путем естественного выбытия части офицерского состава, отслужившего положенные законом сроки службы."
351,"Причем сокращение произойдет только за счет уменьшения бюрократического аппарата."
352,"Боевые подразделения вообще сокращаться не будут."
353,"Одновременно произойдут изменения в системе военного управления."
354,"Будет усовершенствована и мобилизационная база Вооруженных Сил."
355,"А в целом к 2008 году наша армия более чем на две трети должна стать профессиональной."
356,"Все это позволяет нам сократить срок службы по призыву до 12 месяцев."
357,"Считаю также необходимым после перевода частей постоянной готовности на контракт разработать и с 2009 года начать осуществление программы комплектования на этих же принципах должностей сержантов, старшин, а также экипажей надводных кораблей."
358,"Вы знаете, в частях Вооруженных Сил, расквартированных в Чеченской Республике, службу несут контрактники."
359,"А с 1 января 2007 года и внутренние войска МВД также переходят в Чечне на контракт."
