"sent_pos","source"
0,"10 мая 2006 года, Москва, Кремль, Мраморный зал Послание Федеральному Собранию Российской Федерации В.ПУТИН: Уважаемое Федеральное Собрание!"
1,"Уважаемые граждане России!"
2,"В посланиях последних лет были сформулированы основные приоритеты социально-экономической политики на ближайшее десятилетие."
3,"И сегодня наши основные усилия направлены именно на те сферы, которые прямо определяют качество жизни граждан."
4,"Реализуются национальные проекты в области образования, здравоохранения, сельского хозяйства, в жилищном строительстве."
5,"Проблемы здесь накапливались, вы знаете, даже не годы, а десятилетия."
6,"Они крайне чувствительны для людей."
7,"Требовалось накопить немало ресурсов и сил, чтобы на них наконец сосредоточиться, за них взяться."
8,"Во исполнение предложений, содержащихся в Послании последнего (2005) года, был принят ряд законов, совершенствующих и нашу политическую систему."
9,"В частности, законы об Общественной палате, о парламентском расследовании, об участии победившей на региональных выборах партии в наделении полномочиями глав субъектов Федерации."
10,"Принято также решение о совершенствовании отношений между федеральным центром, субъектами Федерации и местным самоуправлением."
11,"Другими словами, в последние годы мы целенаправленно работали над тем, чтобы сгладить те диспропорции в государственном строительстве и в социальной сфере, которые возникли."
12,"В то же время, планируя дальнейшее развитие нашей государственной и политической системы, мы, конечно, должны учитывать современное состояние нашего общества."
13,"И в этой связи отмечу одну из существенных черт нашей внутриполитической жизни, а именно: низкий уровень доверия граждан к отдельным институтам государственной власти и к крупному бизнесу."
14,"И понятно почему."
15,"С переменами начала 90-х были связаны большие надежды миллионов людей, однако ни власть, ни бизнес не оправдали этих надежд."
16,"Более того, некоторые представители этих сообществ, пренебрегая нормами закона и нравственности, перешли к беспрецедентному в истории нашей страны личному обогащению за счет большинства граждан."
17,"«Работая над великой общенациональной программой, которая призвана дать первостепенные блага широким массам, мы действительно наступали кое-кому на «больные мозоли» и будем наступать на них впредь."
18,"Но это «мозоли» тех, кто старается достичь высокого положения или богатства, а может быть, того и другого вместе, коротким путем – за счет общего блага»."
19,"Хорошие слова, жалко только, что не я их придумал – Франклин Делано Рузвельт, Президент Соединенных Штатов Америки, 1934 год."
20,"Это было сказано на выходе из Великой депрессии."
21,"Многие страны сталкивались с такими же проблемами, что и мы сегодня, и многие нашли из них достойный выход."
22,"В основе этого было четкое понимание, что авторитет государства должен основываться не на вседозволенности и попустительстве, а на способности принимать справедливые законы и твердо добиваться их исполнения."
23,"Разумеется, мы и впредь будем стремиться к тому, чтобы поднять престиж государственной службы."
24,"Будем поддерживать российский бизнес."
25,"Но и бизнесмен с миллиардным состоянием, и чиновник любого ранга должны знать, что государство не будет беспечно взирать на их деятельность, если они извлекают незаконную выгоду из особых отношений друг с другом."
26,"Говорю сейчас об этом потому, что, несмотря на предпринимаемые усилия, нам до сих пор не удалось устранить одно из самых серьезных препятствий на пути нашего развития – коррупцию."
27,"Считаю, что социальная ответственность должна быть основой деятельности и чиновников, и представителей бизнеса, и они обязаны помнить, что источником благополучия и процветания России является народ."
28,"Государство же обязано сделать так, чтобы это было не на словах, а на деле."
29,"Убежден, что ни одну из актуальных задач, стоящих перед нашей страной, мы не сможем решить без обеспечения прав и свобод граждан, без эффективной организации самого государства, без развития демократии и гражданского общества."
30,"Напомню: как об абсолютном приоритете мы неоднократно говорили о необходимости добиваться высоких темпов экономического роста."
31,"В Послании 2003 года были впервые сформулированы задачи удвоения валового внутреннего продукта на десять лет."
32,"Нетрудно посчитать: чтобы добиться этого результата, наша экономика должна ежегодно прирастать на 7 с небольшим процентов."
33,"Казалось бы, мы в целом справляемся с этой задачей, и за последние три года среднегодовой экономический рост как раз составил около 7 процентов."
34,"Однако хотел бы подчеркнуть, что если мы не устраним некоторые проблемы, если мы не улучшим основные макроэкономические показатели и не обеспечим должного уровня экономической свободы, если не создадим равные условия конкуренции и не укрепим право собственности, то поставленные в сфере экономики задачи вряд ли удастся решить в заявленные сроки."
35,"Мы уже приступили к осуществлению конкретных шагов по изменению структуры нашей экономики, об этом ранее много говорили, приданию ей инновационного качества."
36,"Считаю, что предпринимаемые Правительством шаги в этом направлении правильны, но при этом отмечу следующее."
37,"Во-первых, государственные инвестиции необходимы, конечно, но они не единственное средство достижения цели."
38,"Во-вторых, важен не столько их объем, сколько умение правильно выбрать приоритеты, и при этом крайне важно сохранить ответственную экономическую политику, избранную нами 5 лет назад."
39,"Сегодня, после длительного периода жизни в условиях бюджетного дефицита и резких колебаний курса рубля, ситуация кардинально меняется, и следует сохранить достигнутую финансовую стабильность как одно из базовых условий повышения доверия людей к государству, условие готовности предпринимателей вкладывать деньги в развитие бизнеса."
40,"В современной ситуации, сегодня, мы имеем возможность более трезво, спокойно оценить угрозы, с которыми Россия сталкивается как часть мировой системы, угрозы, которые представляют опасность внутреннему развитию и международным интересам нашей страны."
41,"Можем подробнее поговорить и о нашем месте в мировой экономике."
42,"В условиях жесткой международной конкуренции экономическое развитие страны должно определяться главным образом ее научными и технологическими преимуществами."
43,"Но, к сожалению, большая часть технологического оборудования, используемого сейчас российской промышленностью, отстает от передового уровня даже не на годы, а на десятилетия."
44,"А эффективность использования энергии, даже со ссылкой на климатические условия, у нас в разы ниже, чем у прямых конкурентов России на мировых рынках."
45,"Да, мы знаем, такой наша промышленность, наша экономика строилась еще в советские времена."
46,"Но знать – этого абсолютно недостаточно."
47,"Необходимо принять конкретные меры для того, чтобы ситуацию изменить."
48,"И, не нарушая достигнутой финансовой устойчивости, нам надо сделать серьезный шаг к стимулированию роста инвестиций в производственную инфраструктуру и в развитие инноваций."
49,"Россия должна в полной мере реализовать себя в таких высокотехнологичных сферах, как современная энергетика, коммуникации, космос, авиастроение, должна стать крупным экспортером интеллектуальных услуг."
50,"Разумеется, мы рассчитываем на рост предпринимательской инициативы во всех секторах экономики и будем создавать для этого необходимые условия."
51,"Но мощный рывок в вышеназванных, традиционно сильных для страны областях – это наш шанс использовать их как локомотив развития."
52,"Это реальная возможность изменить структуру всей экономики и занять достойное место в мировом разделении труда."
53,"Так, мы уверенно чувствуем себя в добывающих отраслях."
54,"Наши предприятия здесь вполне конкурентоспособны."
55,"Например, «Газпром», вы знаете, вышел на третье место в мире по капитализации среди крупнейших корпораций мира, при этом сохраняя достаточно низкие тарифы для российских потребителей."
56,"И этот результат возник не сам по себе, а как следствие целенаправленных действий со стороны государства."
57,"Однако на этом, разумеется, нельзя успокаиваться и останавливаться."
58,"Необходимо создать условия для ускоренного технологического обновления энергетической отрасли."
59,"Надо развивать современные перерабатывающие производства и транспортные мощности, осваивать новые перспективные рынки."
60,"И при этом необходимо полностью обеспечивать как потребности внутреннего развития, так и исполнять обязательства перед нашими традиционными партнерами."
61,"Сегодня необходимы и шаги по развитию атомной энергетики – энергетики, основанной на безопасных реакторах нового поколения."
62,"Нужно укрепить позиции России на мировых рынках атомного машиностроения, максимально используя здесь наши знания, навыки, новейшие технологии и, разумеется, международную кооперацию."
63,"Решению этой задачи должна служить и реструктуризация самой отрасли."
64,"И, разумеется, надо прицельно работать на перспективных направлениях энергетики – водородном и термоядерном."
65,"Кроме того, следует кардинально повысить эффективность потребления энергии."
66,"Это требование не прихоть для страны, богатой ресурсами, это вопрос нашей конкурентоспособности в условиях интеграции в мировую экономику, вопрос качества жизни людей и экологической безопасности."
67,"Убежден, только так можно обеспечить России ведущие, стабильные позиции на энергетических рынках на долгосрочную перспективу."
68,"И Россия сможет сыграть свою позитивную роль в формировании единой европейской энергетической стратегии."
69,"Опираясь на благоприятное географическое положение страны, мы обязаны эффективно реализовать свой потенциал и в столь перспективной сфере, как современные коммуникации."
70,"Ключевое решение здесь – это комплексное, взаимоувязанное развитие всех видов транспорта и связи."
71,"Отмечу, что новые возможности для реализации таких проектов дают и концессионные механизмы."
72,"И надо задействовать их уже в самое ближайшее время."
73,"Неоправданно долго решаются вопросы реорганизации таких важных отраслей, как авиа- и судостроение."
74,"Правительство должно оперативно наконец завершить работу по созданию соответствующих холдингов."
75,"Для нас крайне важно не ошибиться и в выборе приоритетов развития космической отрасли."
76,"Нельзя забывать, что освоение космоса – это оборонный щит России, возможность раннего выявления глобальных природных катаклизмов, площадка для получения новых материалов, технологий."
77,"Для решения этих и других задач потребуются существенные капиталовложения в модернизацию мощности по производству космической техники и развитию наземной инфраструктуры."
78,"Россия может стать и одним из лидеров в нанотехнологиях."
79,"Это одно из самых перспективных направлений и путей развития энергосбережения, элементной базы, медицины, робототехники."
80,"Считаю необходимым в ближайшее время разработать и принять действенную программу в этой области."
81,"Рассчитываю также, что реализация совместных планов Правительства и Академии наук по модернизации научной отрасли не будет формальной, а принесет реальные результаты, даст отечественной экономике перспективные научные разработки."
82,"Нам в целом нужна сегодня такая инновационная среда, которая поставит производство новых знаний на поток."
83,"Для этого нужно создать и необходимую инфраструктуру: технико-внедренческие зоны, технопарки, венчурные фонды, инвестиционный фонд – все это уже делается, создается."
84,"Нужно сформировать благоприятные налоговые условия для финансирования инновационной деятельности."
85,"Считаю также, что государство должно оказывать содействие и в приобретении современных технологий за рубежом."
86,"В этом плане тоже определенные шаги уже сделаны."
87,"В первую очередь, конечно, для модернизации приоритетных секторов промышленности."
88,"Прошу в этой связи проанализировать возможность направления ресурсов в капиталы соответствующих финансовых институтов, занимающихся лизингом, кредитованием, страхованием такого рода контрактов."
89,"Необходимым условием развития новых технологий остается надежная защита интеллектуальной собственности, и мы должны обеспечить охрану авторских прав внутри страны – это наша обязанность и перед нашими иностранными партнерами."
90,"Мы также должны усилить защиту интересов российских правообладателей за рубежом."
91,"Уважаемые коллеги!"
92,"Современной России нужен беспрепятственный выход со всей своей продукцией на международные рынки."
93,"Для нас это вопрос более рационального участия в международном разделении труда, вопрос получения полноценных выгод от интеграции в мировую экономику."
94,"Именно с этой целью мы продолжаем вести переговоры о присоединении к Всемирной торговой организации и ведем их только на условиях, которые полностью учитывают экономические интересы России."
95,"Очевидно, что наша экономика уже сейчас является более открытой, чем экономики многих членов этой уважаемой организации."
96,"И переговоры о вступлении России в ВТО не должны становиться инструментом торга по вопросам, не имеющим ничего общего с деятельностью этой организации."
97,"В Послании 2003 года я ставил задачу обеспечения конвертируемости рубля."
98,"Были намечены определенные планы, и, должен сказать, они выполняются."
99,"Сегодня предлагаю ускорить отмену оставшихся ограничений и завершить эту работу до 1 июля текущего года."
100,"Однако реальная конвертируемость рубля во многом зависит от его привлекательности как средства, используемого для расчетов и сбережений."
101,"И здесь нам еще очень многое предстоит сделать."
102,"В частности, рубль должен стать более универсальным средством для международных расчетов и должен постепенно расширять зону своего влияния."
103,"В этих же целях необходимо организовать на территории России биржевую торговлю нефтью, газом, другими товарами, торговлю с расчетом рублями."
104,"Наши товары торгуются на мировых рынках."
105,"Почему не у нас?"
106,"Правительству следует ускорить решение этих вопросов."
107,"Повторю: возросшие экономические возможности позволили нам направить дополнительные инвестиции в социальную сферу, а по сути – в рост благосостояния людей, в завтрашний день России."
