"sent_pos","source"
360,"Другими словами, в антитеррористических мероприятиях мы полностью отказываемся от использования военнослужащих по призыву."
361,"В составе сил общего назначения к 2011 году будет сформировано около 600 частей и соединений постоянной готовности."
362,"При этом планируется значительное увеличение их количества в истребительной, армейской авиации, в войсках ПВО, в подразделениях связи, радиоэлектронной разведки и электронной борьбы."
363,"В случае необходимости на любом потенциально опасном направлении могут быть оперативно созданы мобильные и самодостаточные группировки, костяк которых составят профессионально подготовленные части и соединения постоянной готовности."
364,"Служба в Российской армии должна стать современной и по-настоящему престижной."
365,"Человек, защищающий Родину, должен иметь высокий общественный и материальный статус, прочные социальные гарантии."
366,"К 2010 году должен быть окончательно снят вопрос с постоянным, а к 2012 году – со служебным жильем для военнослужащих."
367,"На ближайшие годы запланирован также ряд повышений денежного довольствия."
368,"Одновременно развивается система страхования и медицинской помощи для военнослужащих."
369,"И, наконец, не менее важная задача – это укрепление дисциплины в войсках."
370,"Вы знаете, политические издержки переходного периода и отсутствие финансовых средств фактически привели армию к комплектованию по остаточному принципу, к ухудшению условий несения службы, к падению уровня боевой подготовки."
371,"Сегодня огромное число молодых людей призывного возраста имеют хронические болезни, пристрастие к алкоголю, курению, а порой и к наркотикам."
372,"Считаю, что в школах надо не только учить, но и воспитывать, надо заниматься физической и военно-патриотической подготовкой молодежи, возрождать допризывную подготовку, помогать развитию военно-технических видов спорта."
373,"И Правительству необходимо принять соответствующую программу по этому поводу."
374,"Органам государственной власти субъектов Федерации следует серьезно озаботиться не только планами по набору в армию, но и отвечать за качество этого призыва и обеспечивать такую подготовительную работу в самом тесном контакте с армией."
375,"Подчеркну: чтобы кардинально исправить положение, одних административных мер сейчас недостаточно, и надо осознать, что армия - это часть нас самих, нашего общества, а служба в ней крайне важна и необходима стране, всему российскому народу."
376,"Известный русский мыслитель Иван Ильин, размышляя о базовых принципах, на которых должно прочно стоять Российское государство, отмечал, что солдат есть звание высокое и почетное."
377,"И что он представляет всероссийское народное единство, русскую государственную волю, силу и честь."
378,"Мы должны быть всегда готовы отразить потенциальную внешнюю агрессию и акты международного терроризма."
379,"Должны быть способны отвечать на чьи бы то ни было попытки внешнеполитического давления на Россию, в том числе с целью добиться укрепления своих собственных позиций за наш счет."
380,"И нужно прямо сказать: чем сильнее будут наши Вооруженные Силы, тем меньше будет соблазн такое давление на нас оказывать, под каким бы предлогом оно ни проводилось."
381,"Уважаемые коллеги!"
382,"Современная российская внешняя политика опирается на принципы прагматизма, предсказуемости и верховенства международного права."
383,"И хотел бы сегодня сказать несколько слов о состоянии и перспективах взаимодействия с нашими основными партнерами, прежде всего об отношениях с ближайшими соседями – со странами СНГ."
384,"Споры вокруг самой целесообразности и дальнейшей судьбы Содружества не утихают до сих пор, и мы заинтересованно работаем над вопросами реформирования СНГ."
385,"Очевидно, что Содружество помогло без особых потерь пройти период становления партнерских отношений между вновь образованными молодыми государствами, сыграло свою позитивную роль в сдерживании региональных конфликтов на постсоветском пространстве."
386,"Подчеркну: острота многих из них была снята именно благодаря участию России."
387,"Мы и впредь будем также ответственно выполнять свою миротворческую миссию."
388,"Из опыта СНГ выросло и несколько продуктивных инициатив экономического сотрудничества."
389,"Сегодня параллельно на основе совпадающих интересов сторон развивается Союзное государство с Белоруссией, ЕврАзЭС, Единое экономическое пространство."
390,"И сообща мы решаем проблемы, которые никто за нас не решит."
391,"При этом реально видим, что многостороннее партнерство позволяет это делать с меньшими затратами, с большей эффективностью."
392,"Содружество стало хорошей основой и для формирования Организации Договора о коллективной безопасности."
393,"В эту структуру вошли страны, по-настоящему заинтересованные в тесном военно-политическом взаимодействии."
394,"Наконец, не умаляя значения остальных направлений реформирования, в качестве перспективного проекта выделю укрепление общего гуманитарного пространства."
395,"Оно имеет не только богатую историческую и человеческую основу, но теперь уже и новые социально-экономические предпосылки."
396,"На пространстве СНГ идет непростой, но активный поиск оптимальных моделей взаимодействия."
397,"И Россия готова прямо и ясно заявить о желательном для нас конечном результате такого поиска: это создание оптимальной экономической системы, которая обеспечивала бы эффективное развитие каждого из ее участников."
398,"Повторю: отношения с нашими ближайшими соседями были и остаются важнейшим направлением внешней политики Российской Федерации."
399,"Коротко остановлюсь на взаимодействии с другими нашими партнерами."
400,"Крупнейший из них – Европейский союз."
401,"Наш постоянный диалог с ЕС создает благоприятные условия для взаимовыгодных экономических связей и расширения научных, гуманитарных и иных обменов."
402,"Совместная реализация нами концепции общих пространств является важным элементом всего общеевропейского развития."
403,"Особое значение для нас и для всей международной системы имеют отношения России с Соединенными Штатами Америки, с Китайской Народной Республикой, с Индией, а также с быстро набирающими силу странами Азиатско-Тихоокеанского региона, Латинской Америки и Африки."
404,"И мы готовы предпринимать все новые шаги для расширения рамок и сфер взаимодействия с этими государствами, а также укреплять сотрудничество в обеспечении глобальной и региональной стабильности, наращивать объемы взаимной торговли, инвестиций, развивать гуманитарные связи."
405,"Подчеркну: в условиях глобализации, когда определяется новая международная архитектура, кардинально возрастает и роль Организации Объединенных Наций."
406,"Это самый представительный и универсальный мировой форум, и он продолжает оставаться несущей конструкцией современного мирового порядка."
407,"Очевидно, что основы этой всемирной организации закладывались совсем в другую эпоху, и ей, безусловно, нужна реформа."
408,"Для России, активно участвующей в такой работе, принципиальное значение имеют два момента."
409,"Первое – реформа должна повысить эффективность деятельности ООН."
410,"И второе – реформа должна получить максимально широкую поддержку членов этой организации."
411,"Без согласия в ООН трудно обеспечить и согласие в мире."
412,"И система Организации должна стать тем регулятором, который позволит совместно вырабатывать новый свод правил поведения на мировой арене, правил, адекватных вызовам нашего времени и столь необходимых сегодня в условиях глобализации."
413,"Уважаемые члены Федерального Собрания!"
414,"Граждане России!"
415,"В заключение еще раз отмечу, что сегодняшнее и предыдущие послания дают основу внутренней и внешней политике на ближайшие десятилетия."
416,"Они направлены на долгосрочную перспективу и не носят сиюминутного характера."
417,"В прошлых посланиях назывались задачи по строительству политической системы, совершенствованию государственной власти и местного самоуправления, подробно обсуждались вопросы модернизации и социальной сферы, неоднократно ставились новые экономические задачи."
418,"Сегодня были изложены подходы к тому, каким должно быть наше место в мировом разделении труда, в новой архитектуре международных отношений."
419,"Мы подробно остановились и на том, как будем решать сложнейшую демографическую проблему, развивать наши Вооруженные Силы."
420,"Предложенные шаги предельно конкретны."
421,"А у России есть колоссальные возможности для развития, есть огромный потенциал, который надо эффективно реализовать для улучшения жизни людей."
422,"Без сомнения, мы видим масштаб предстоящей работы."
423,"Уверен, мы с этой работой справимся."
424,"Спасибо за внимание."
