"sent_id","par_id","source","book_id","par_pos","sent_pos"
15461,5055,"В течение ближайших пяти лет предстоит существенно повысить оснащенность стратегических ядерных сил современными самолетами дальней авиации, подводными лодками и пусковыми установками Ракетных войск стратегического назначения.",284,114,2
15462,5056,"Уже сегодня успешно ведутся работы по созданию уникальных комплексов высокоточного оружия и боевых маневренных блоков, не имеющих для потенциального противника предсказуемой траектории полета.",284,115,1
15463,5056,"Наряду со средствами преодоления систем противоракетной обороны, которые у нас есть уже сейчас, новые виды вооружений позволяют нам сохранить то, что безусловно является одной из самых существенных гарантий прочного мира.",284,115,2
15464,5056,"А именно сохранить стратегический баланс сил.",284,115,3
15465,5057,"Мы должны учитывать планы и направления развития вооруженных сил в других странах, должны знать о перспективных разработках, но не гнаться за количественными показателями, не «палить» деньги зря.",284,116,1
15466,5057,"Наши ответы должны быть основаны на интеллектуальном превосходстве, они будут ассиметричными, менее затратными, но будут безусловно повышать надежность и эффективность нашей ядерной триады.",284,116,2
15467,5058,"Обращаю внимание: современной России нужна армия, имеющая все возможности адекватно реагировать на современные же угрозы.",284,117,1
15468,5058,"У нас с вами должны быть Вооруженные Силы, способные одновременно вести борьбу в глобальном, региональном, а если потребуется – и в нескольких локальных конфликтах.",284,117,2
15469,5058,"Должны при любых сценариях гарантировать безопасность и территориальную целостность России.",284,117,3
15470,5059,"Еще одно важное требование – это соответствие процесса комплектования целям создания профессиональной и мобильной армии.",284,118,1
15471,5059,"Особо подчеркну, что в течение последних пяти лет уже были проведены необходимые сокращения численности Вооруженных Сил.",284,118,2
15472,5059,"И в дальнейшем доведение их до оптимального уровня в 1 млн человек не предусматривает специальных мероприятий по сокращению, а должно быть достигнуто путем естественного выбытия части офицерского состава, отслужившего положенные законом сроки службы.",284,118,3
15473,5059,"Причем сокращение произойдет только за счет уменьшения бюрократического аппарата.",284,118,4
15474,5059,"Боевые подразделения вообще сокращаться не будут.",284,118,5
15475,5060,"Одновременно произойдут изменения в системе военного управления.",284,119,1
15476,5060,"Будет усовершенствована и мобилизационная база Вооруженных Сил.",284,119,2
15477,5060,"А в целом к 2008 году наша армия более чем на две трети должна стать профессиональной.",284,119,3
15478,5060,"Все это позволяет нам сократить срок службы по призыву до 12 месяцев.",284,119,4
15479,5061,"Считаю также необходимым после перевода частей постоянной готовности на контракт разработать и с 2009 года начать осуществление программы комплектования на этих же принципах должностей сержантов, старшин, а также экипажей надводных кораблей.",284,120,1
15480,5062,"Вы знаете, в частях Вооруженных Сил, расквартированных в Чеченской Республике, службу несут контрактники.",284,121,1
15481,5062,"А с 1 января 2007 года и внутренние войска МВД также переходят в Чечне на контракт.",284,121,2
15482,5062,"Другими словами, в антитеррористических мероприятиях мы полностью отказываемся от использования военнослужащих по призыву.",284,121,3
15483,5063,"В составе сил общего назначения к 2011 году будет сформировано около 600 частей и соединений постоянной готовности.",284,122,1
15484,5063,"При этом планируется значительное увеличение их количества в истребительной, армейской авиации, в войсках ПВО, в подразделениях связи, радиоэлектронной разведки и электронной борьбы.",284,122,2
15485,5063,"В случае необходимости на любом потенциально опасном направлении могут быть оперативно созданы мобильные и самодостаточные группировки, костяк которых составят профессионально подготовленные части и соединения постоянной готовности.",284,122,3
15486,5064,"Служба в Российской армии должна стать современной и по-настоящему престижной.",284,123,1
15487,5064,"Человек, защищающий Родину, должен иметь высокий общественный и материальный статус, прочные социальные гарантии.",284,123,2
15488,5065,"К 2010 году должен быть окончательно снят вопрос с постоянным, а к 2012 году – со служебным жильем для военнослужащих.",284,124,1
15489,5066,"На ближайшие годы запланирован также ряд повышений денежного довольствия.",284,125,1
15490,5066,"Одновременно развивается система страхования и медицинской помощи для военнослужащих.",284,125,2
15491,5066,"И, наконец, не менее важная задача – это укрепление дисциплины в войсках.",284,125,3
15492,5066,"Вы знаете, политические издержки переходного периода и отсутствие финансовых средств фактически привели армию к комплектованию по остаточному принципу, к ухудшению условий несения службы, к падению уровня боевой подготовки.",284,125,4
15493,5067,"Сегодня огромное число молодых людей призывного возраста имеют хронические болезни, пристрастие к алкоголю, курению, а порой и к наркотикам.",284,126,1
15494,5067,"Считаю, что в школах надо не только учить, но и воспитывать, надо заниматься физической и военно-патриотической подготовкой молодежи, возрождать допризывную подготовку, помогать развитию военно-технических видов спорта.",284,126,2
15495,5067,"И Правительству необходимо принять соответствующую программу по этому поводу.",284,126,3
15496,5068,"Органам государственной власти субъектов Федерации следует серьезно озаботиться не только планами по набору в армию, но и отвечать за качество этого призыва и обеспечивать такую подготовительную работу в самом тесном контакте с армией.",284,127,1
15497,5069,"Подчеркну: чтобы кардинально исправить положение, одних административных мер сейчас недостаточно, и надо осознать, что армия - это часть нас самих, нашего общества, а служба в ней крайне важна и необходима стране, всему российскому народу.",284,128,1
15498,5070,"Известный русский мыслитель Иван Ильин, размышляя о базовых принципах, на которых должно прочно стоять Российское государство, отмечал, что солдат есть звание высокое и почетное.",284,129,1
15499,5070,"И что он представляет всероссийское народное единство, русскую государственную волю, силу и честь.",284,129,2
15500,5070,"Мы должны быть всегда готовы отразить потенциальную внешнюю агрессию и акты международного терроризма.",284,129,3
15501,5070,"Должны быть способны отвечать на чьи бы то ни было попытки внешнеполитического давления на Россию, в том числе с целью добиться укрепления своих собственных позиций за наш счет.",284,129,4
15502,5071,"И нужно прямо сказать: чем сильнее будут наши Вооруженные Силы, тем меньше будет соблазн такое давление на нас оказывать, под каким бы предлогом оно ни проводилось.",284,130,1
15503,5072,"Уважаемые коллеги!",284,131,1
15504,5073,"Современная российская внешняя политика опирается на принципы прагматизма, предсказуемости и верховенства международного права.",284,132,1
15505,5073,"И хотел бы сегодня сказать несколько слов о состоянии и перспективах взаимодействия с нашими основными партнерами, прежде всего об отношениях с ближайшими соседями – со странами СНГ.",284,132,2
15506,5074,"Споры вокруг самой целесообразности и дальнейшей судьбы Содружества не утихают до сих пор, и мы заинтересованно работаем над вопросами реформирования СНГ.",284,133,1
15507,5075,"Очевидно, что Содружество помогло без особых потерь пройти период становления партнерских отношений между вновь образованными молодыми государствами, сыграло свою позитивную роль в сдерживании региональных конфликтов на постсоветском пространстве.",284,134,1
15508,5076,"Подчеркну: острота многих из них была снята именно благодаря участию России.",284,135,1
15509,5076,"Мы и впредь будем также ответственно выполнять свою миротворческую миссию.",284,135,2
15510,5077,"Из опыта СНГ выросло и несколько продуктивных инициатив экономического сотрудничества.",284,136,1
15511,5077,"Сегодня параллельно на основе совпадающих интересов сторон развивается Союзное государство с Белоруссией, ЕврАзЭС, Единое экономическое пространство.",284,136,2
15512,5077,"И сообща мы решаем проблемы, которые никто за нас не решит.",284,136,3
15513,5077,"При этом реально видим, что многостороннее партнерство позволяет это делать с меньшими затратами, с большей эффективностью.",284,136,4
15514,5078,"Содружество стало хорошей основой и для формирования Организации Договора о коллективной безопасности.",284,137,1
15515,5078,"В эту структуру вошли страны, по-настоящему заинтересованные в тесном военно-политическом взаимодействии.",284,137,2
15516,5079,"Наконец, не умаляя значения остальных направлений реформирования, в качестве перспективного проекта выделю укрепление общего гуманитарного пространства.",284,138,1
15517,5079,"Оно имеет не только богатую историческую и человеческую основу, но теперь уже и новые социально-экономические предпосылки.",284,138,2
15518,5079,"На пространстве СНГ идет непростой, но активный поиск оптимальных моделей взаимодействия.",284,138,3
15519,5079,"И Россия готова прямо и ясно заявить о желательном для нас конечном результате такого поиска: это создание оптимальной экономической системы, которая обеспечивала бы эффективное развитие каждого из ее участников.",284,138,4
15520,5080,"Повторю: отношения с нашими ближайшими соседями были и остаются важнейшим направлением внешней политики Российской Федерации.",284,139,1
15521,5081,"Коротко остановлюсь на взаимодействии с другими нашими партнерами.",284,140,1
15522,5082,"Крупнейший из них – Европейский союз.",284,141,1
15523,5082,"Наш постоянный диалог с ЕС создает благоприятные условия для взаимовыгодных экономических связей и расширения научных, гуманитарных и иных обменов.",284,141,2
15524,5082,"Совместная реализация нами концепции общих пространств является важным элементом всего общеевропейского развития.",284,141,3
15525,5083,"Особое значение для нас и для всей международной системы имеют отношения России с Соединенными Штатами Америки, с Китайской Народной Республикой, с Индией, а также с быстро набирающими силу странами Азиатско-Тихоокеанского региона, Латинской Америки и Африки.",284,142,1
15526,5083,"И мы готовы предпринимать все новые шаги для расширения рамок и сфер взаимодействия с этими государствами, а также укреплять сотрудничество в обеспечении глобальной и региональной стабильности, наращивать объемы взаимной торговли, инвестиций, развивать гуманитарные связи.",284,142,2
15527,5084,"Подчеркну: в условиях глобализации, когда определяется новая международная архитектура, кардинально возрастает и роль Организации Объединенных Наций.",284,143,1
15528,5084,"Это самый представительный и универсальный мировой форум, и он продолжает оставаться несущей конструкцией современного мирового порядка.",284,143,2
15529,5084,"Очевидно, что основы этой всемирной организации закладывались совсем в другую эпоху, и ей, безусловно, нужна реформа.",284,143,3
15530,5085,"Для России, активно участвующей в такой работе, принципиальное значение имеют два момента.",284,144,1
15531,5086,"Первое – реформа должна повысить эффективность деятельности ООН.",284,145,1
15532,5086,"И второе – реформа должна получить максимально широкую поддержку членов этой организации.",284,145,2
15533,5086,"Без согласия в ООН трудно обеспечить и согласие в мире.",284,145,3
15534,5086,"И система Организации должна стать тем регулятором, который позволит совместно вырабатывать новый свод правил поведения на мировой арене, правил, адекватных вызовам нашего времени и столь необходимых сегодня в условиях глобализации.",284,145,4
15535,5087,"Уважаемые члены Федерального Собрания!",284,146,1
15536,5087,"Граждане России!",284,146,2
15537,5088,"В заключение еще раз отмечу, что сегодняшнее и предыдущие послания дают основу внутренней и внешней политике на ближайшие десятилетия.",284,147,1
15538,5088,"Они направлены на долгосрочную перспективу и не носят сиюминутного характера.",284,147,2
15539,5089,"В прошлых посланиях назывались задачи по строительству политической системы, совершенствованию государственной власти и местного самоуправления, подробно обсуждались вопросы модернизации и социальной сферы, неоднократно ставились новые экономические задачи.",284,148,1
15540,5090,"Сегодня были изложены подходы к тому, каким должно быть наше место в мировом разделении труда, в новой архитектуре международных отношений.",284,149,1
15541,5090,"Мы подробно остановились и на том, как будем решать сложнейшую демографическую проблему, развивать наши Вооруженные Силы.",284,149,2
15542,5091,"Предложенные шаги предельно конкретны.",284,150,1
15543,5091,"А у России есть колоссальные возможности для развития, есть огромный потенциал, который надо эффективно реализовать для улучшения жизни людей.",284,150,2
15544,5092,"Без сомнения, мы видим масштаб предстоящей работы.",284,151,1
15545,5092,"Уверен, мы с этой работой справимся.",284,151,2
15546,5093,"Спасибо за внимание.",284,152,1
