"sent_id","par_id","source","book_id","par_pos","sent_pos"
17186,5637,"Марин Ле Пен стала кандидатом на пост главы Франции",367,1,1
17187,37505,"Дочь основателя Национального фронта имеет все шансы на победу в выборах.",367,2,1
17188,5638,"Кандидатом на выборы главы государства в 2012 году стала лидер французского крайне правого Национального фронта (FN) Марин Ле Пен, сообщает РИА «Новости».",367,3,1
17189,5638,"Её выдвинуло политбюро партии.",367,3,2
17190,5639,"Вот как об этом сообщается в заявлении Нацфронта, распространённом в понедельник, 16 мая:",367,4,1
107466,5639,"«Политическое бюро Национального фронта на собрании в понедельник, 16 мая 2011 года, единогласно поддержало кандидатуру своего председателя Марин Ле Пен на выборах президента Республики».",367,4,2
17191,5640,"Напомним, что отцом Марин Ле Пен является основатель Национального фронта Жан-Мари Ле Пен.",367,5,1
17192,5640,"По итогам проведённых опросов, у его дочери есть все шансы выйти во второй тур президентских выборов во Франции, которые состоятся 22 апреля (первый тур) и 6 мая (второй тур) 2012 года.",367,5,2
17193,5641,"О французском национальном самосознании читайте в статье Частного корреспондента «Французы по носу и по паспорту»",367,6,1
