"sent_id","par_id","source","book_id","par_pos","sent_pos"
16408,5331,"Министерство внутренних дел Пакистана заявило о том, что Беназир Бхутто освобождена из-под домашнего ареста, сообщает France-Presse.",324,1,1
16409,5332,"Правительство Пакистана объясняло арест необходимостью защиты Бхутто на митинге оппозиции в пятницу.",324,2,1
16410,5333,"За последние дни было арестовано 5000 активистов Народной партии, возглавляемой Бхутто.",324,3,1
16411,5334,"Бхутто заявила по телефону агенству France-Presse:",324,4,1
16412,5334,"«Я не боюсь их тактики.",324,4,2
16413,5334,"Моя борьба — за людей Пакистана, за их права и за конец диктатуры».",324,4,3
