"sent_pos","source"
0,"Жара."
1,"BDSM-хоррор Сегодняшний интерес к поэзии – от того, что почти нет прозы."
2,"О чем же тогда говорить, когда не о чем говорить?"
3,"Осенью станет полегче."
4,"Пойдут хоть какие-то книги, пойдут дожди, перестанут плавиться мозги, а пока — мозг плавится, книг нет, а журналы читать невозможно."
5,"И вовсе не из-за жары."
6,"Жара, как известно, разжижает мозги."
7,"Они плавятся."
8,"В том числе и мозги критические."
9,"Но бывает и так, что критические мозги разжижает ещё даже не сама жара, а её предчувствие... И, если доживём, послевкусие..."
10,"Коллективное подведение критиками итогов литературного сезона удивляет не столько разноголосицей в оценке отдельных имён и названий (она естественна) и даже не столько заведомой и вынужденной скудостью сводного шорт-листа — этакого воистину «короткого списка», — сколько парадоксально оксюморонным видением общей ситуации."
11,"У одних упадок, у других — расцвет; у одних «новый реализм», у других — «новый романтизм» (он же, если я ничего не путаю, «неогогольянство»)."
12,"У одних торжество истории над современностью, у других — полная победа non fiction над fiction."
13,"У одних развесисто-кровавые «Сумерки», у других страдающие хроническим несварением читательского желудка «Елтышевы», у третьих «Подстрочник»."
14,"И, похоже, никто ничего не понимает."
15,"Оказывается, нужно, например, объяснять и то, почему «литературный сезон», а не «литературный год»."
16,"Объясняю."
17,"Издательская жизнь замирает в мае и возобновляется только к сентябрю."
18,"Летом книг не выпускают, потому что их никто не купит в первые два месяца, когда, собственно говоря, их и полагается покупать."
19,"А на третий месяц появятся и попадут в приоритетную выкладку в книжных магазинах уже другие новинки."
20,"Это «доказательство от противного»."
21,"Но есть и прямое объяснение: начиная с ноября (если не с октября), книги принято метить не заканчивающимся годом, а ещё не начавшимся."
22,"Потому что завтрашняя дата для покупателя предпочтительнее вчерашней (по крайней мере, так полагают книготорговцы)."
23,"Премиальные циклы «плавают» в полутора-двухгодичном режиме и ориентиром служить не могут."
24,"Так что счёт «на года» обманчив."
25,"Литературный год (он же литературный сезон) у нас начинается в сентябре книжной ярмаркой на ВДНХ, а заканчивается в июне — книжным фестивалем во дворике ЦДХ."
26,"А в промежутке — танцы."
27,"Как у Славы Курицына в питерском клубе на Гороховой, который так и называется «Танцы» — и в котором по субботам, воскресеньям и понедельникам дружно пляшут литературную кадриль."
28,"Но сейчас из-за жары закрыты и «Танцы»."
29,"Любопытно, кстати, особенно в июльский зной, что, прочитав тысячи зарубежных романов и переведя на русский десятки, я постепенно постиг некую странность (на наш взгляд) западного календаря, в словарях и справочниках не указываемую."
30,"Западный год куда дисциплинированнее и точнее нашего делится на сезоны: зима начинается в январе, весна — в апреле, лето — в июле и, наконец, осень — в октябре."
31,"Вот и у нас сейчас только начало лета... Что же касается «толстых» журналов с их вроде бы выверенным календарным циклом, то эти «национальные достояния» давно уже никто не принимает в расчёт."
32,"В последние два года у «толстяков» появился было шанс воспрять на фоне забуксовавшего книгоиздания, но все они как один этим шансом блистательно проманкировали."
33,"Раньше говорили: «Пушкин заплатит»."
34,"Теперь в «толстых» журналах надеются на то, что за них заплатит Путин."
35,"А что у нас, братцы, с толстожурнальной литературой?"
36,"Она утонула."
37,"Я отслеживаю новинки: и напрямую, и через рецензии коллег по критическому цеху."
38,"Сейчас вот больше всего пишут про переводную книгу о мобильных телефонах — и Данилкин и другие."
39,"И про шведские детективы."
40,"И бедняга Немзер — уже не в службу, а в дружбу — про Слаповского."
41,"Пишут ещё про «Ладу» Тимура Кибирова."
42,"Хороший человек Кибиров, и поэт тоже хороший."
43,"Ну и как тут быть мне?"
44,"Про мобильные телефоны мне не интересно."
45,"Про шведские детективы тем более."
46,"Формула шведского детектива проста как палец: Агата Кристи в «шведской семье»."
47,"Со Слаповским я не дружу, а про «Ладу» деликатно помалкиваю."
48,"Или прикажете замахнуться на монументально-исторического «Евстигнея»?"
49,"Но то, что печатают в «Октябре», читать вообще невозможно, — а то, что печатают в «Октябре» с продолжением из номера в номер, невозможно вдвойне."
50,"В «Новом мире» печатают роман Александра Мелихова."
51,"Целый роман."
52,"«Изгнание из ада»."
53,"Звучит завлекательно, хотя «тени зада» мелькали уже у Брюсова («Предстала тень из ада»)."
54,"Но Мелихова печатают и в «Октябре», а ведь то, что печатают в «Октябре»... Или в «Знамени»..."
55,"Волей-неволей возвращаешься к новинкам издательским, а их нет как нет."
56,"Нет, потому что нет, или нет, потому что конец сезона?"
57,"Вот он, вопрос вопросов!"
58,"Или уже началась пресловутая литературная забастовка?"
59,"Один из последних номеров «Искусства кино» полностью посвящён американским телесериалам."
60,"Разумеется, качественный американский телесериал стал в XXI веке аналогом американского же романа в XX веке и русского романа — в XIX-м. Но ведь не настолько же?"
61,"Захожу на сайт «Питербук»."
62,"Рецензируют какую-то лежалую ерунду."
63,"Захожу на сайт «Прочтение»."
64,"То же самое."
65,"Захожу в раздел «Книги» ресурса «Частный корреспондент» То же самое + «Первый отряд» Анны Старобинец + «Йод» Андрея Рубанова («Йод», впрочем, ругают, причём повсюду )."
66,"Захожу на новомодную «Соль» — и сыплю её всё на те же раны."
67,"Вот спорят, есть у нас критика или нет (и дружно сходятся на том, что её нет), а я вам скажу, что исчез или вот-вот исчезнет и сам предмет критического исследования!"
68,"То есть проза."
69,"Сегодняшний интерес к поэзии (мой включительно) — он ведь, знаете ли, тоже не от хорошей жизни."
70,"О чём говорить, когда не о чем говорить?"
71,"Может быть, о рукописях?"
72,"Мне в последнее время приходит немало рукописей, в том числе довольно пристойных."
73,"Но такого разговора на пальцах, боюсь, не поймёт читатель."
74,"Не говоря уж о том, что рукописи с монитора в тридцатипятиградусную жару — это всё же особый жанр."
75,"BDSM-хоррор."
76,"Изгнание из ада (напомню, так называется последний роман Мелихова; знать бы наверняка, что он последний, я бы его, глядишь, и осилил) в заунывную асистолию; коллективная кома Елтышевых; чёртово колесо (оно же правый руль) Первого отряда; а главное, повсеместные ЛЮДИ В ГОЛОМ!!!"
77,"На «Эхе Петербурга» дискуссия: в метро, мол, сплошные люди в голом, и от них плохо пахнет."
78,"Звонок в студию: а как же нам мыться, если повсеместно отключили горячую воду?"
79,"Да так вот и мыться — внутрь!"
80,"Петербургские фундаменталисты временно перешли на красное вино пополам с минералкой; третьим у них — электровентилятор в «Борее»."
81,"Сергей Носов задумал роман об Индии, куда главный герой отбывает из Питера в поисках неземной прохлады."
82,"Сам он только что сошёл на расплавившийся асфальт с Гималаев."
83,"Павел Крусанов написал больше половины своего вроде бы уже пятого романа: говорит, на сей раз получается слишком много экшна."
84,"Кашу маслом не испортишь, уверяю я его, но жара предполагает многочасовую сиесту."
85,"Сергей Коровин — помните такого?"
86,"— закончил новый роман, но тот пока не нравится ему самому."
87,"А вот Наль Подольский новый роман аж выпустил!"
88,"Называется «Время культурного бешенства»."
89,"Повезло, что я успел прочитать его ещё до начала жары, — повезло и мне, и главным образом Налю."
90,"Василий Аксёнов (наш, питерский) тоже выпустил роман и подумывает о собрании сочинений: у него есть спонсор."
91,"Заканчивает новую книгу Илья Бояшов."
92,"Предыдущая — «Братец Кролик» — у меня как-то не пошла, но весь «лимбусовский» тираж уверенно перекуплен «АСТ»."
93,"В «Амфоре» — аврал."
94,"Завязавшееся сотрудничество популярного книжного издательства с продовольственным ритейлом обещает принести первые дивиденды уже к осени."
95,"То есть к сентябрю?"
96,"Или всё-таки, на западный лад, к октябрю?"
97,"Но «Кто в «Амфоре» служил, тот в цирке не смеётся», как говорят у нас в Питере."
98,"Или в «Азбуке»... В далёком уже 1992-м, в чёрную годину ранней гайдарономики, тогдашний президент Ельцин посулил к осени определённое облегчение."
99,"А вице-премьер Бурбулис разъяснил эту мысль: пойдут грибы, ягоды... Вот и я говорю коллегам, семи литературным критикам, запарившимся в поисках одного-единственного писателя, то же самое."
100,"Осенью станет полегче."
101,"Пойдут хоть какие-то книги, пойдут дожди, перестанут плавиться мозги... И всё-таки: Нет, потому что нет, или нет, потому что конец сезона?"
