"sent_id","par_id","source","book_id","par_pos","sent_pos"
14550,4711,"На столичных перронах запретили проверять билеты",265,1,1
14551,4711,"Перронный контроль на станциях и остановочных пунктах отменён по инициативе транспортной прокуратуры.",265,1,2
14552,4712,"Столичная транспортная прокуратура сумела добиться снятия перронного контроля пассажиров подмосковных электричек на наличие у них проездных билетов.",265,2,1
14553,4712,"«ММТП при осуществлении надзора за соблюдением федерального законодательства в ОАО «Центральная пригородная пассажирская компания» выявлен правовой акт, нарушающий права пассажиров на железнодорожном транспорте.",265,2,2
14554,4712,"Согласно правилам оказания услуг по перевозкам на железнодорожном транспорте пассажиров, утверждённым постановлением правительства, контроль наличия у пассажира проездного документа осуществляется при проходе пассажира к поезду пригородного сообщения через пункт контроля проездных документов, в пути следования поезда пригородного сообщения и при выходе пассажира через пункт контроля проездных документов после окончания поездки в поезде пригородного сообщения», — цитирует infox.ru доводы прокуратуры.",265,2,3
14555,4712,"Другими словами, перронный контроль на станциях и остановочных пунктах российскими законами не предусмотрен.",265,2,4
