"sent_id","par_id","source","book_id","par_pos","sent_pos"
22061,7126,"National Geographic Adventure ушёл в Сеть",523,1,1
22062,7126,"Журнал отказался от печатной версии.",523,1,2
22063,7127,"Издательский дом, входящий в состав научно-образовательного института National Geographic Society, решил отказаться от издания бумажной версии журнала National Geographic Adventure.",523,2,1
22064,7127,"Сдвоенный номер за декабрь-январь будет последним.",523,2,2
22065,7127,"Такое решение было принято в целях сокращения расходов.",523,2,3
22066,7128,"«Учитывая нынешнюю обстановку в рекламном бизнесе и растущие возможности цифровых платформ, мы решили, что настало время для изменения бренда», — цитирует сайт Гильдии издателей периодической печати президента издательского дома National Geographic Society Джона Гриффина.",523,3,1
22067,7128,"По его словам, теперь Adventure, у бумажной версии которого было 625 тыс. подписчиков, будет выходить только в электронном виде, а также в виде различных мобильных приложений.",523,3,2
22068,7129,"Об издателях, которые надеются на интернет, читайте в статье Частного корреспондента «iTunes для журналов »",523,4,1
