"sent_id","par_id","source","book_id","par_pos","sent_pos"
7529,2380,"В понедельник 28 июня у здания мэрии Москвы на Тверской площади состоялась очередная несанкционированная акция протеста «День гнева», в этот раз направленная, главным образом, против политики московских и подмосковных властей.",100,1,1
7530,2380,"Среди требований, выдвигаемых организаторами акции: «немедленная отставка мэра Москвы Юрия Лужкова, расследование итогов его деятельности», «созыв московского общественного форума для обсуждения путей реформирования основных сфер жизнедеятельности в Москве», «восстановление прямых выборов глав регионов России», «роспуск нелегитимной Мосгордумы», отставка подмосковного губернатора Бориса Громова и др.",100,1,2
7531,2380,"Участникам акции предлагалось принести с собой лист бумаги или кусок ткани чёрного цвета, символизирующие «чёрную метку» для Юрия Лужкова.",100,1,3
7532,2381,"Начало акции было намечено на 19 часов; подчёркивалось, что она состоится несмотря на запрет властей.",100,2,1
7533,2381,"Освещающие акцию блоггеры сообщили, что автобусы с милицией стали занимать площадь у памятника Юрию Долгорукому ещё с 15 часов дня, центральная часть площади была огорожена.",100,2,2
7534,2381,"Ко времени начала акции вокруг огороженной территории собралось множество журналистов и прохожих, по мере прибытия самих участников акции милиция начала планомерно их задерживать и заталкивать в автобусы.",100,2,3
7535,2382,"Всего, по сообщениям блоггеров и СМИ, было задержано более 30 человек.",100,3,1
7536,2382,"Пользователь ЖЖ zyalt сообщает, что среди задержанных оказался депутат муниципального собрания района Отрадное, сопредседатель московского отделения движения «Солидарность» Михаил Вельмакин, известный правозащитник Лев Пономарев, координатор движения «Левый фронт» Сергей Удальцов.",100,3,2
7537,2383,"Организаторами акции выступили движение «За права человека», Союз координационных советов (СКС), институт «Коллективное действие», «Жилищная солидарность», Движение общежитий Москвы, Движение в защиту Химкинского леса, движение «Московский совет», «Координационный совет пострадавших соинвесторов».",100,4,1
