"sent_pos","source"
0,"Ватикан имеет наибольшую норму преступности В 2005 году в суде Ватикана было проведено 486 гражданских и 472 уголовных процесса."
1,"При населении 492 человек, Ватикан имеет наивысший криминальный рейтинг."
2,"Правда, надо сказать, что преступления совершались паломниками, а не гражданами Ватикана, среди которых числятся служащие швейцарской гвардии, кардиналы, церковные служащие и сам Папа Римский."
3,"Ежегодно Ватикан посещают около 20 млн."
4,"паломников."
5,"Во многих случаях уголовное преследование иностранцев в Ватикане связано с трудностями."
6,"Поэтому управление Ватикана обдумывает возможность вступления в «Шенгенское соглашение» Европейского союза."
7,"Особый феномен был вызван сменой Папы Римского в прошлом году."
8,"Во время церемонии похорон и выборов нового Папы, несмотря на огромный наплыв людей, не было зафиксировано ни одного правонарушения."
