"sent_pos","source"
0,"Президент отказался увольнять губернатора Краснодарского края."
1,"Вопрос об отставке Александра Ткачёва поднял лидер ЛДПР Владимир Жириновский."
2,"Дмитрий Медведев накануне обсудил с лидерами парламентских фракций ряд актуальных проблем, в числе которых было и массовое убийство на Кубани."
3,"В связи с жестокими преступлениями в станице Кущёвской вице-спикер Госдумы Владимир Жириновский предложил отправить в отставку губернатора Краснодарского края Александра Ткачёва."
4,"Однако, несмотря на весь резонанс этого преступления и вскрывающиеся всё новые и новые факты коррупции в силовых органах региона, президент однозначно отверг это предложение, сообщает РБК."
5,"Как бы то ни было, в связи с ситуацией в Кущёвской ряд фракций предложили провести комплексное расследование ситуации со слиянием власти и преступности в российских регионах."
6,"Напомним также, что накануне губернатор Краснодарского края обвинил СМИ в том, что они преждевременно «отправляют его в отставку» и сгущают краски вокруг ситуации в регионе."
7,"Александр Ткачёв также заметил, что в любом российском регионе, как и на Кубани, есть свои преступные группировки, покрываемые силовиками."
