"sent_id","par_id","source","book_id","par_pos","sent_pos"
31354,9976,"Хромированный планшет",1014,1,1
31355,9976,"Продажи ПК от Google могут начаться под Рождество",1014,1,2
31356,9977,"Если верить слухам, долгожданный планшетный компьютер от Google на базе Chrome OS появится на прилавках американских магазинов ровно за месяц до Рождества — 26 ноября, когда начнутся рождественские распродажи.",1014,2,1
31357,9977,"Производить этот компьютер будет то ли HTC, то ли Motorola, а продавать — Verizon, причём чуть ли не бесплатно.",1014,2,2
31358,9978,"Слухам верить обычно не стоит, тем более в IT-индустрии.",1014,3,1
31359,9978,"Количество несбывшихся ожиданий и невыполненных обещаний здесь настолько велико, что для них придуман даже специальный термин — vapourware («паровое обеспечение») — по аналогии с программным обеспечением, software.",1014,3,2
31360,9978,"В распространённую техноблогом Download Squad информацию о сроках продаж планшетного компьютера с Chrome OS верится, впрочем, легко, поскольку всё логично.",1014,3,3
31361,9978,"Во всяком случае в информацию поверили и поспешили разнести благую весть все профильные издания, даже добавив подробностей.",1014,3,4
31362,9979,"Google официально пообещала выпустить Chrome OS в 2010 году.",1014,4,1
31363,9979,"А конец года уже близок.",1014,4,2
31364,9979,"Близок и самый активный — с точки зрения маркетинга — месяц продаж бытовой электроники: традиционный для США период заготовки рождественских подарков, который начинается в «чёрную пятницу», 26 ноября.",1014,4,3
31365,9979,"Так что срок, который молва даёт Google, вполне реалистичный.",1014,4,4
31366,9980,"Что касается HTC, то и это похоже на правду.",1014,5,1
31367,9980,"В конце концов именно HTC была первой компанией, которая взялась за производство смартфонов с операционной системой Android.",1014,5,2
31368,9980,"И даже первый «настоящий» гуглофон от самой Google — Nexus One — выпускает эта же тайваньская фирма.",1014,5,3
31369,9980,"По другой версии, впрочем, пальму первенства производителя планшетника Google может получить Motorola.",1014,5,4
31370,9981,"Кто бы ни был производителем железа, наблюдатели сходятся на том, что основой аппаратной начинки будет платформа Tegra 2 фирмы NVidia и 10-дюймовый сенсорный дисплей с размерами 1280 на 720 пикселей.",1014,6,1
31371,9981,"В планшетнике будет 2 Гб оперативной памяти и твердотельный жёсткий диск на 32 Гб.",1014,6,2
31372,9981,"Кроме того — полный набор беспроводных интерфейсов: Wi-Fi, Bluetooth и LTE, а также модуль GPS, веб-камера и ридер карт памяти.",1014,6,3
31373,9982,"Но главное, конечно, — это не столько железо планшетника, сколько его программное обеспечение.",1014,7,1
31374,9982,"Chrome OS, официально представленная публике 19 ноября 2009 года, — принципиально новая операционная система, базирующаяся целиком на интернет-браузере.",1014,7,2
31375,9982,"Файловой системы для жёсткого диска в Chrome OS не предусмотрено: файлы можно будет хранить только онлайн.",1014,7,3
31376,9982,"Это непривычно и, может быть, не слишком удобно, но, с другой стороны, меньше риск их потерять вместе с устройством.",1014,7,4
31377,9982,"Впрочем, у пользователя останется доступ к картам памяти, которые, по всей вероятности, и будут выполнять привычную для многих функцию локального хранения файлов.",1014,7,5
31378,9983,"Все приложения в «онлайновой» операционной системе будут веб-приложениями, а потому планшетка будет полноценно работать только онлайн, что по нынешним временам, впрочем, не слишком сложно устроить.",1014,8,1
31379,9983,"Не исключено, что офисные программы из пакета Google Docs смогут работать и офлайн — в конце концов, когда-то они были на это способны.",1014,8,2
31380,9983,"Но основная масса приложений будет онлайновой.",1014,8,3
31381,9983,"Более того, Google уже анонсировала будущий Chrome Web Store, в котором разработчики смогут размещать свои приложения.",1014,8,4
31382,9983,"Причём в том числе и платные.",1014,8,5
31383,9983,"Google собирается взимать с программистов скромную плату — 5 долларов, но будет отдавать им 95% собранных с пользователей денег.",1014,8,6
31384,9983,"Условия более чем конкурентные в сравнении с App Store у Apple, которая отдаёт продавцам софта 70% денег, получая с них минимум 99 долларов за годовую лицензию.",1014,8,7
31385,9984,"Сравнение с Apple неизбежно.",1014,9,1
31386,9984,"Компания Стива Джобса фактически заново (если считать провальный старт с интернет-устройствами, сделанный несколько лет назад на базе Windows) открыла рынок планшетных компьютеров.",1014,9,2
31387,9984,"И пока, в сущности, целиком его и занимает, продав только за первые 80 дней 3 млн штук.",1014,9,3
31388,9984,"Успех iPad оказался, судя по всему, неожиданным и для самой Apple, которая была вынуждена отложить начало продаж в других странах, и для производителей нетбуков, которые начали потихоньку сокращать поставки, испытывая серьёзное давление со стороны «яблочной таблетки».",1014,9,4
31389,9985,"Продажи планшетника от Google в результате начнутся в крайне непростых условиях: iPad до сих пор разлетается как пирожки, несмотря на свою приличную цену.",1014,10,1
31390,9985,"И, потом, Apple не дремлет.",1014,10,2
31391,9985,"По слухам, компания Джобса готовит уменьшенную, 7-дюймовую версию iPad, возможно, уже с новым — «сетчатым» — дисплеем с повышенной контрастностью.",1014,10,3
31392,9985,"Кроме того, к рождественским распродажам, не исключено, подоспеют планшетники и других производителей, уже обзавидовавшихся успеху Apple.",1014,10,4
31393,9986,"Сможет ли Google (вместе с производителем железа) составить конкуренцию Apple и всем желающим откусить от «планшетного пирога» — большой вопрос.",1014,11,1
31394,9986,"За Google нет такой же армии поклонников продукции Apple.",1014,11,2
31395,9986,"Отказаться от возможности автономной работы с документами сможет и захочет не каждый пользователь.",1014,11,3
31396,9986,"Нелишним будет заметить, что и доверие к Google, учитывая последние скандалы по поводу сканирования «гугломобилями» частных Wi-Fi-сетей, никак не повышают желания доверять Google хранение своих частных данных.",1014,11,4
31397,9987,"На эти «против», однако, могут найтись аргументы и «за».",1014,12,1
31398,9987,"Значимость бренда Google вряд ли можно переоценить — её поисковик как был, так и остаётся самой популярной и посещаемой веб-страницей в мире.",1014,12,2
31399,9987,"Google — и об этом тоже шепчет молва — выводит планшетник в США при поддержке оператора Verizon, который, возможно, станет продавать устройства по минимальной цене а-ля iPhone, всего лишь нагружая пользователей тарифным контрактом на беспроводную передачу данных.",1014,12,3
31400,9987,"Наконец, Google, возможно, припасёт для пользователей тот же сюрприз, что и Джобс, выведший на рынок iPad как многофункциональное устройство с функцией букридера.",1014,12,4
31401,9987,"Планировавшийся на лето запуск онлайнового книжного магазина Google Editions уже фактически отложен.",1014,12,5
31402,9987,"Не исключено, что его запуск компания приурочит к старту продаж планшетника.",1014,12,6
31403,9987,"Учитывая, что в «закромах» Google есть несколько миллионов книг, то выбор планшетника Google именно в качестве букридера для многих покупателей подарков под ёлку может стать определяющим.",1014,12,7
31404,9987,"Я бы от такого подарка точно не отказался.",1014,12,8
