"sent_id","par_id","source","book_id","par_pos","sent_pos"
78795,27553,"Безработный?",3302,1,1
78796,27553,"Держи ноутбук!",3302,1,2
78797,27554,"Правительство Великобритании будет раздавать лэптопы безработным.",3302,2,1
78798,27555,"Кабинет министров Туманного Альбиона намерен в самое ближайшее время запустить новую государственную программу, в рамках которой планирует раздавать дешёвые ноутбуки всем, кто не может найти себе работу.",3302,3,1
78799,27555,"Напомним, число безработных в Великобритании из-за экономического кризиса резко увеличилось, и власти не в состоянии трудоустроить людей традиционными способами.",3302,3,2
78800,27556,"Чиновники уверены, что вместо того чтобы впустую тратить время, граждане смогут искать работу при помощи интернета, а также повышать свой уровень профессиональной квалификации и IT-образованности.",3302,4,1
78801,27556,"Более того, некоторой части безработных власти будут готовы оплатить даже услуги широкополосного доступа в Сеть.",3302,4,2
78802,27556,"Министры надеются, что данная инициатива в перспективе поможет правительству избавиться от центров по трудоустройству, которые функционируют, понятное дело, на бюджетные деньги.",3302,4,3
78803,27557,"Не исключено, что кто-нибудь из этих безработных, получивших ноутбук, сможет найти какую-то онлайновую подработку, например у сервиса Amazon.",3302,5,1
