"sent_id","par_id","source","book_id","par_pos","sent_pos"
22737,7325,"Channel 4 сменил директора",565,1,1
22738,37579,"Канал возглавил топ-менеджер UKTV.",565,2,1
22739,7326,"Британский телеканал Channel 4 назначил нового исполнительного директора.",565,3,1
22740,7326,"Проработавшего на этой должности пять лет Энди Данкана сменил Дэвид Абрахам, с 2007 года возглавляющий кабельную сеть UKTV.",565,3,2
22741,7326,"Пока не сообщается, уйдёт ли он в отставку с нынешнего поста или будет совмещать руководство двумя компаниями.",565,3,3
22742,7327,"Как пишет The Guardian, зарабатывать новый директор Channel 4 будет существенно меньше, чем его предшественник.",565,4,1
22743,7327,"Годовой оклад Абрахама составит 490 тыс. фунтов стерлингов, в то время как Энди Данкан зарабатывал 580, а до последнего сокращения зарплат в компании — 670 тыс. фунтов.",565,4,2
22744,7328,"См. также  «Кошелёк или жизнь».",565,5,1
