"sent_id","par_id","source","book_id","par_pos","sent_pos"
31913,10126,"Сьюзан Бойл перепела Рианну и 50 Cent",1038,1,1
31914,10126,"Дебютный диск шотландской домохозяйки стал лидером британских хит-парадов и почти добрался до вершины американских чартов.",1038,1,2
31915,10127,"Первый диск 48-летней певицы Сьюзан Бойл I Dreamed a Dream, появившийся в свободной продаже всего неделю назад, уже завоевал первую позицию в британском хит-параде.",1038,2,1
31916,10127,"Альбом шотландской домохозяйки разошёлся 410-тысячным тиражом и претендует на лидерство в музыкальных чартах США.",1038,2,2
31917,10127,"Амбиции эти, кстати, вполне обоснованны: несмотря на то, что пластинка содержит 12 треков перепевок известных композиций, она уже оставила позади по продажам альбомы таких музыкальных гигантов, как Рианна, Леди Гага и рэпер 50 Cent.",1038,2,3
31918,10128,"Музыкальный импресарио Саймон Коуэлл (бывший ведущий телеконкурса «Британия ищет таланты», выступление на котором и прославило Сьюзан) заявил, что безумно счастлив за свою подопечную.",1038,3,1
31919,10128,"Как известно, Коуэлл покинул шоу ради того, чтобы помочь невзрачной шотландке сделать карьеру.",1038,3,2
31920,10128,"«Стоило ей только раскрыть рот в передаче «Британия ищет таланты», как мир её тут же полюбил, и именно поэтому её пластинка стала раскупаться быстрее, чем какой бы то ни было другой певицы-дебютантки», ― комментирует феноменальный успех Бойл Коуэлл.",1038,3,3
31921,10129,"Об удивительном феномене Сьюзан Бойл читайте в материале «Английская бабушка».",1038,4,1
