"sent_id","par_id","source","book_id","par_pos","sent_pos"
29143,9443,"Всем миром",957,1,1
29144,9443,"Король Испании Хуан Карлос I и президент США Барак Обама предложили помощь в тушении российских пожаров.",957,1,2
29145,9444,"«Король Испании отметил, что Испания, народ которой всегда испытывал дружеские добрые чувства к России, готова предоставить необходимую помощь, передать противопожарные средства».",957,2,1
29146,9445,"«Барак Обама выразил солидарность с масштабными усилиями, предпринимаемыми в России по ликвидации и преодолению последствий стихийного бедствия, соболезнования в связи с имевшими место человеческими жертвами, сочувствие пострадавшим в результате пожаров, а также выразил готовность предоставить необходимое оборудование для пожаротушения и оказать экспертное содействие»,",957,3,1
29147,9445,"— сообщила пресс-служба Кремля.",957,3,2
29148,9446,"Ответ президента России Дмитрия Медведева не сообщался.",957,4,1
