"sent_id","par_id","source","book_id","par_pos","sent_pos"
104688,36640,"В Москве появился первый бесплатный книжный магазин.",3789,1,1
104689,36641,"Теперь книги можно не только купить за деньги, прочитать и поставить на книжную полку мёртвым грузом.",3789,2,1
104690,36641,"В Москве, в клубе «Сквот», открыт первый бесплатный книжный магазин «Акция. Обменник», посетители которого могут обменять свои, уже не нужные им книги, журналы и DVD с фильмами на новые, пока ещё не прочитанные и не просмотренные.",3789,2,2
104691,36641,"Принцип работы магазина прост: приходишь, кладёшь на полку принесённые с собой книги и забираешь понравившиеся из числа уже лежащих там.",3789,2,3
104692,36641,"Честность и равноправность обмена приветствуются.",3789,2,4
104693,36641,"Таким образом, организаторы надеются предоставить людям возможность не только приобретать новые книги, но и разгрузить книжные полки, пустив прочитанные тома в путешествие по новым владельцам.",3789,2,5
104694,36641,"Магазин расположен в самом центре, в районе Кузнецкого моста, работает ежедневно и круглосуточно.",3789,2,6
