"sent_pos","source"
0,"В Москве появился первый бесплатный книжный магазин."
1,"Теперь книги можно не только купить за деньги, прочитать и поставить на книжную полку мёртвым грузом."
2,"В Москве, в клубе «Сквот», открыт первый бесплатный книжный магазин «Акция."
3,"Обменник», посетители которого могут обменять свои, уже не нужные им книги, журналы и DVD с фильмами на новые, пока ещё не прочитанные и не просмотренные."
4,"Принцип работы магазина прост: приходишь, кладёшь на полку принесённые с собой книги и забираешь понравившиеся из числа уже лежащих там."
5,"Честность и равноправность обмена приветствуются."
6,"Таким образом, организаторы надеются предоставить людям возможность не только приобретать новые книги, но и разгрузить книжные полки, пустив прочитанные тома в путешествие по новым владельцам."
7,"Магазин расположен в самом центре, в районе Кузнецкого моста, работает ежедневно и круглосуточно."
