"sent_id","par_id","source","book_id","par_pos","sent_pos"
35754,11320,"Том Уэйтс приезжает в Москву",1231,1,1
35755,11320,"Знаменитый музыкант отказался от ранее принятого решения и все-таки приедет в Россию.",1231,1,2
35756,11321,"Культовый музыкант Том Уэйтс отменил свое давнее решение никогда не приезжать в СССР, а после Россию и даст один концерт в Москве.",1231,2,1
35757,11322,"По сообщению, сделанному его пресс-секретарем, на его решение повлиял обыкновенный грипп.",1231,3,1
35758,11322,"Заболев, Уэйтс три дня пролежал дома, где смотрел DVD-диски со старыми советскими фильмами, такими как «Девчата», «Служебный роман», «Сталкер», «Бриллиантовая рука» и др.",1231,3,2
35759,11323,"После просмотра он сказал, что не ожидал, что русские — последние романтики на планете, и он должен сам в этом убедиться.",1231,4,1
