"sent_pos","source"
0,"НАСА назвал экипаж для миссии «Дискавери» STS-122 NASA назвал экипаж для миссии «Дискавери» STS-122, которая доставит на орбиту и европейский исследовательский модуль «Колумбус» и смонтирует его на Международной космической станции."
1,"Командиром экипажа назначен Стефен Фрик (Stephen Frick), пилотом — Алан Пойндекстер (Alan Poindexter)."
2,"Специалисты миссии: Рекс Вальхайм (Rex Walheim), Стэнли Лав (Stanley Love), Леланд Мелвин (Leland Melvin) и астронавт Европеского космического агентства Ханс Шлегель (Hans Schlegel) (Германия)."
3,"Пойндекстер, Лав и Мелвин — новички космических полётов."
4,"Для Стефена Фрика и Рекса Вальхайма это будет второй космический полёт, первый полёт они также совершили вместе на шаттле «Атлантис» STS-110 в 2002 году."
5,"Для Ханса Шлегеля это также второй космический полёт, первый полёт — «Колумбия» STS-55 в 1993 году."
