"sent_pos","source"
0,"Названы самые быстрорастущие социальные сети Рунета В лидеры вырвались Facebook и Twitter, обогнавшие «Вконтакте» и «Одноклассников»."
1,"Исследовательская компания comScore подсчитала, что самыми быстрорастущими социальными сетями Рунета являются Twitter и Facebook."
2,"Так, с января по октябрь 2010 года аудитория этих сервисов увеличилась на 345 и 257% соответственно."
3,"Кстати, помимо Twitter и Facebook, наибольший прирост в российском сегменте Сети демонстрируют сайты бесплатных объявлений, адресованные женщинам проекты, файлообменники и ресурсы по онлайн-просмотру видео."
4,"При этом, пишут «Ведомости», лидерами по числу русскоязычных пользователей всё ещё остаются «Вконтакте» и «Одноклассники»."
5,"Однако по наращиванию аудитории эти порталы отстают от сервиса микроблогов и Facebook."
6,"Так, аудитория «Вконтакте» выросла с начала этого года на 80%, «Одноклассников» — на 96,2%, а «Мой мир Mail.Ru» — на 58%."
7,"При этом общая аудитория Рунета стала больше на 17,3%, в том числе социальных сетей — в среднем на 52,4%."
