"sent_id","par_id","source","book_id","par_pos","sent_pos"
39006,12476,"Антидолларовое сукре",1374,1,1
39007,12476,"В странах Латинской Америки появилась региональная альтернатива зелёным банкнотам.",1374,1,2
39008,12477,"С высоты венесуэльских нефтяных вышек и с неистовой жаждой заткнуть за пояс Соединённые Штаты Уго Чавес может очень далеко пойти.",1374,2,1
39009,12477,"По крайней мере экономический хук президента Венесуэлы явно достиг цели.",1374,2,2
39010,12477,"Пока нефтяные шейхи и страны Востока подумывали о создании ближневосточной или азиатской единой валюты, ряд латиноамериканских стран, входящих в Боливарианский альянс (ALBA), уже официально заявили о переходе на общую виртуальную валюту, которая станет альтернативой доллару.",1374,2,3
39011,12477,"Таким образом, воспользовавшись небывалой слабостью американской валюты, Боливия, Эквадор, Никарагуа, Куба, а также ряд мелких островов Карибского бассейна поддержали Венесуэлу в её антиамериканской финансовой позиции.",1374,2,4
39012,12478,"Новую денежную единицу назвали «сукре» (так ранее называлась национальная валюта Эквадора, а ещё ранее звучала фамилия героя Латинской Америки, боровшегося за независимость).",1374,3,1
39013,12478,"Впрочем, смысл единой латиноамериканской валюты вложен совсем иной — это аббревиатура от «Единой системы региональной компенсации» (Sistema Unico de Compensacion Regional).",1374,3,2
39014,12478,"Антидолларовое сукре пока носит статус виртуальной валюты, немногим позже оно станет и вполне осязаемой единой денежной единицей Южной Америки.",1374,3,3
