"sent_id","par_id","source","book_id","par_pos","sent_pos"
34968,11137,"Президент призвал ускорить работу по развитию центра в Сколково.",1191,1,1
34969,11137,"Руководство подмосковного иннограда объяснило, почему «мы немного буксуем» в этом направлении.",1191,1,2
34970,11138,"На заседании комиссии по модернизации, работа которой проходит в рамках XIV Питерского Давоса, глава российского государства призвал ускорить работу над созданием Центра разработки и коммерциализации новых технологий в Сколково.",1191,2,1
34971,11138,"Дмитрий Медведев поручил урегулировать вопросы с финансированием и режимом функционирования иннограда, сообщают РИА «Новости».",1191,2,2
34972,11139,"В свою очередь руководитель Фонда развития Центра разработки и коммерциализации новых технологий Виктор Вексельберг заявил, что уже к осени инноград приступит к формированию экспертных советов, которые займутся отбором инновационных проектов для реализации в инновационном центре.",1191,3,1
34973,11139,"При этом бизнесмен отметил, что в данном направлении есть некоторые проблемы.",1191,3,2
34974,11139,"«Мы немного буксуем с точки зрения решения немаловажного вопроса по утверждению бюджетов хотя бы на этот год, и хотелось бы ускорить этот процесс в рамках взаимодействия с министерством финансов.",1191,3,3
34975,11139,"Мы уже говорили о том, что нужно приступить к созданию так называемой виртуальной среды до момента строительства реальных физических объектов.",1191,3,4
34976,11139,"Мне кажется, что это надо обязательно предусмотреть в законе, и такие предложения нами уже подготовлены», ― уточнил Вексельберг.",1191,3,5
