"sent_pos","source"
0,"В Тбилиси прогремел взрыв Возле штаб-квартиры грузинской оппозиционной Партии труда в Тбилиси перед рассветом в воскресенье раздался взрыв."
1,"Как сообщила полиция, вылетевшими стеклами и обломками была тяжело ранена в своей квартире женщина, скончавшаяся затем в больнице."
2,"Согласно информации на веб-сайте оппозиции Civil.GE, взрывом поврежден ряд соседних домов."
3,"Причины акции пока неясны, однако руководство Партии труда, находящейся в оппозиции президенту Михаилу Саакашвили, заявило, что инцидент был политически мотивированной атакой на их партию."
4,"Позднее в пригороде грузинской столицы прогремел второй взрыв, выбивший окна в окрестных домах."
5,"Сообщений о травмах не поступало."
