"sent_pos","source"
0,"Алессандро Калиостро: колдун в чужом отечестве Второго июня 1743 года в Италии родился авантюрист, называвший себя графом Калиостро Тайны всегда привлекали людей."
1,"В том числе тайны истории."
2,"Хотя, если рассуждать логически, у истории не может быть тайны (если только это не псевдоистория), а у тайны не может быть истории: если её рассказать, тайна сразу перестанет быть тайной и превратится в факт, в точку на линии последовательности событий."
3,"Граф Калиостро (он же Джузеппе Бальзамо, он же граф Феникс, он же маркиз де Анна, он же маркиз де Пеллегрини, он же Тискио, он же Мелина, он же Бельмонте) оставил нам вместо точки на линии лишь множество корявых запятых."
4,"Одни говорили, что он сын португальского еврея из Бразилии, другие верили, что он сын неаполитанского парикмахера, третьи считали незаконнорождённым отпрыском Людовика XV, четвёртые утверждали, что его родители — чета набожных католиков, торговавших сукном в Палермо... Одна история гласит, что будущего «графа Калиостро» (который позаимствовал свою звучную фамилию и никак не причитавшийся ему графский титул у безвременно почившей тёти) ещё в детстве выгнали из школы за кражу, фактически лишив возможности получить образование."
5,"А после того как несчастные родители для перевоспитания поместили нерадивого сынка в монастырь, его, уличив в мошенничестве, вскоре прогнали взашей и оттуда."
6,"По другой, более таинственной, версии (озвученной небезызвестной Е.П. Блаватской), «свои университеты» граф получил от «великого герметического мудреца» Альтотса сперва на Родосе, а затем на Мальте, был в высшей степени честным человеком и, как выдающийся оккультист, обладал удивительными магическими секретами."
7,"Никто толком не знал и не знает, что это был за человек."
8,"Не дознались даже инквизиторы, пытавшие его 43 раза на протяжении четырёх лет… Когда после долгого дознания церковь наконец вынесла ему смертный приговор (в последнюю минуту сожжение на костре было заменено на пожизненное заключение), против Калиостро были выдвинуты сразу два исчерпывающе доказанных, но взаимоисключающих обвинения: первое — в том, что он чернокнижник, то есть колдун, и второе — что он мошенник, то есть лишь выдавал себя, с корыстными целями, за колдуна, а сам таковым вовсе не являлся… Калиостро умудрился запутать не только кровожадных инквизиторов, но и менее пристрастных исследователей его биографии, историков."
9,"Есть две основные версии."
10,"По сути, они повторяют приговор Священной инквизиции: либо граф был одним из плеяды выдающихся людей восемнадцатого века, дерзновенным исследователем природы, талантливым химиком и врачом, продвинутым адептом тайных доктрин востока и чудотворцем, «Великим Коптом» масонов; либо этот выскочка вообще был никем и всю жизнь занимался надувательством легковерных с целью наживы на родине и за рубежом."
11,"Любопытно, что и в случае вынесения ему приговора, и при жизни графа его зачастую считали и тем, и другим одновременно."
12,"Калиостро по праву был одним из самых почитаемых и ненавидимых людей своего времени."
13,"Он покорил Лондон, Париж, Рим: добился там неслыханной роскоши и почестей, обычно оказываемых только принцам крови, заслужил уважение сильных мира сего и выдающихся мыслителей (среди его верных почитателей были Шиллер и Гёте), наконец, наслаждался настоящим поклонением толпы — только для того, чтобы каждый раз в конце концов быть развенчанным и изгнанным (и всегда без достаточных оснований)."
14,"Похожая история увенчала и необыкновенные приключения итальянца в России, с той разницей, что здесь его встречали без особого восторга и обожания, а провожали без жгучей ненависти."
15,"Несмотря на основательную саморекламу (Калиостро заявил, что именно в России он откроет своё истинное имя и предстанет во всём величии), в граде Петра итальянец был принят без особых почестей: этакий бесславный и не понятый «пророк в своём отечестве»."
16,"История этого знаменательного визита подробно и увлекательно, хотя, возможно, и не всегда исторически достоверно, была описана поэтом-символистом Михаилом Кузминым в трёхтомном романе «Чудесная жизнь Иосифа Бальзамо, графа Калиостро» (1919) и вдохновила Алексея Толстого на мистический и трогательный рассказ «Граф Калиостро» (1921)."
17,"«Граф Феникс», как представлялся Калиостро в России, сумел немало поразвлечь православный народ, создав «немного чуда в холодной стране», вызвав к жизни разные события, совместившие его подлинное и вымышленное бытие, правду и вымысел, показавшие его с разных сторон: бескорыстным целителем и бессовестным авантюристом, щедрым меценатом и меркантильным дельцом."
18,"Современники затруднялись отличить одно от другого, а теперь уж и подавно не разберёшься."
19,"Въехав в Россию по поддельным документам как «господин граф Калиостро, гишпанский полковник», предприимчивый итальянец поначалу не вызвал никаких подозрений: главным образом благодаря рекомендации по линии масонства."
20,"По приезде Калиостро снял просторные апартаменты на Дворцовой набережной, в генеральском доме."
21,"Кроме личных покоев, у него там была устроена комната для врачебной практики и зал для спиритических сеансов."
22,"Богатую клиентуру среди столичной знати Калиостро приобрёл почти сразу после приезда, вылечив от хрипоты своего земляка, итальянского тенора Джованни Локателли."
23,"В скором времени граф Феникс прославился своими чудесными исцелениями на весь Санкт-Петербург."
24,"Он лечил не только фаворита Екатерины Г.А. Потёмкина, влиятельного масона И.П. Елагина и богатого барона А.С. Строганова, но и простолюдинов: лакеев, поваров, кучеров, форейторов и горничных."
25,"С бедных он денег не брал, а иногда даже спонсировал нуждающихся; с богатых же брал без стеснения сумасшедшие суммы, давая повод многим утверждать, что его благотворительность, выражаясь современным языком, — чистый пиар."
26,"Впрочем, известный советский историк Валентин Пикуль всё равно назвал его потом «другом бедных»."
27,"Самым нашумевшим чудом графа Феникса в России было избавление асессора Ивана Исленева от тяжёлой формы рака, опять же «чудесным» способом."
28,"Исцеление действительно было мгновенным и полным, но повлекло за собой лёгкое блаженное слабоумие излечившегося: выздоровев, Исленев стал пить и шататься по улицам, без конца прославляя Калиостро и повергая всем этим в ужас свою добропорядочную жену."
29,"Впрочем, трудно удивляться такому вполне естественному поведению Исленева!"
30,"Самым курьёзным делом Калиостро в России был случай с бесноватым Василием Желугиным, которого престарелые родители были вынуждены заковать в цепи, так как он избивал их, называя «рабами» и приговаривая, что он якобы «бог Саваоф»."
31,"Рассказывают, что в данном случае Феникс не применял никакой чёрной магии, а повёз Желугина кататься на лодке и на середине Невы неожиданно сбросил бесноватого в холодную воду (дело было зимой)."
32,"Расчёт Калиостро оказался верен: после такой «шоковой терапии» больной полностью пришёл в себя, бросил поминать бога Саваофа, признал родителей и даже умудрился тут же стянуть у мага золотую табакерку!"
33,"А самым влиятельным покровителем графа Феникса в России был сам светлейший князь Григорий Александрович Потёмкин, фаворит Екатерины II."
34,"Калиостро предложил Потёмкину, который был одним из богатейших людей Европы, утроить его золотой запас, если князь согласится уплатить ему третью часть прибыли: то есть по такой договорённости Потёмкин получал вдвое больше золота, чем у него было."
35,"Потёмкин то ли из коммерческой выгоды, то ли из чистого любопытства согласился."
36,"И самое интересное, что после сомнительных магических манипуляций Калиостро золота действительно стало ровно втрое больше!"
37,"Итальянец получил свой гонорар, а Потёмкин поневоле проникся к нему доверием и расположился к нему, а с ним отчасти и Екатерина, и весь двор."
38,"Сама «матушка императрица» была человеком приземлённым и чудесными услугами «гишпанского» мага пренебрегала, но подданным своим его рекомендовала, как она выражалась, «для пользы во всяком отношении»."
39,"Калиостро (продолжая свою благотворительную медицинскую практику!"
40,"), буквально купался в славе и деньгах благодаря гонорарам за различные «магические услуги», спиритические сеансы и успешной продаже «эликсира молодости», составленного из обычных лекарственных трав... Однако счастье гастролирующего пророка продолжалось недолго."
41,"Вскоре открылся скандал: Потёмкин, человек властный и решительный, завёл интригу с женой Калиостро Лоренцей Феличиане (которая была в Риме первой красавицей), причём открыто появлялся с ней в свете и чуть ли не официально сделал своей любовницей."
42,"Узнав о таком поведении фаворита, Екатерина осерчала, повелела Калиостро с супругой убираться из России «елико возможно поспешно» и даже сочинила пьесу комического содержания «Обманщик», призванную высмеять и опорочить графа (выведенного в ней под именем Калифлакжерстона)."
43,"Вскоре за этим последовало ещё худшее."
44,"У князя Г.П. Гагарина смертельно заболел годовалый сын Павел, и все лучшие врачи Северной столицы признали, что положение его совершенно безнадёжно."
45,"У графа оставалась одна надежда — колдун Калиостро."
46,"Осмотрев малыша, маг признал, что дело плохо, но всё же взялся лечить ребёнка при условии, что родители отдадут его на время лечения в дом итальянца и не смогут какое-то время видеть."
47,"Что было делать?"
48,"Родители дали согласие."
49,"Через две недели (наполненных для Гагариных, как говорится, томительным ожиданием) граф заявил, что ребёнок поправился, и вернул мальчика."
50,"Сразу же поползли слухи, что Калиостро просто подменил ребёнка, купив похожего мальчика у бедных крестьян за две тысячи рублей, а настоящего Павлушу Гагарина якобы залечил до смерти; рассказывали даже, что труп ребёнка сгорел во время неудачного магического ритуала оживления."
51,"Но как бы то ни было, сам граф своего сына признал и на радостях подарил Калиостро тысячу золотых империалов (почти 12 кг чистого золота!)."
52,"А Павел Гагарин, кем бы там он ни являлся в действительности, вырос здоровым и крепким, стал офицером, воевал и вышел в отставку генералом… Однако для медицинской карьеры Калиостро в Петербурге этот случай, получивший такую негативную огласку, стал фатальным."
53,"На него и раньше наговаривали петербургские эскулапы «старой школы», причём особенно преуспел на этом поприще лейб-медик самой императрицы Роджерсон."
54,"Он всеми правдами и неправдами пытался доказать, что его конкурент Калиостро — медик никудышный и вообще шарлатан."
55,"В какой-то момент Калиостро даже предложил ему решить дело по-джентльменски, своеобразной «медицинской дуэлью»: они обменяются пилюлями с ядом, и тот, кто сумеет составить противоядие, останется жив и, пожалуй, станет знаменит."
56,"Лейб-медик от дуэли отказался."
57,"После случая с якобы залеченным младенцем «легенда» о «гишпанском полковнике» подверглась проверке."
58,"Итальянский посланник в Санкт-Петербурге проверил военные списки, в которых фамилии Калиостро, понятное дело, не оказалось."
59,"В апреле 1780 года проштрафившегося колдуна ославили как самозванца и объявили в уголовный розыск… В конце концов ему и его очаровательной супруге, преследуемым по пятам царскими агентами, удалось безнаказанно бежать из России (не иначе опять масонские связи помогли)."
60,"Эти события и вдохновили Алексея Толстого на рассказ «Граф Калиостро», в советское время с успехом превращённый Марком Захаровым и Григорием Гориным в телефильм «Формула любви»."
61,"Так и завершился — до срока — визит непризнанного пророка в холодную Россию."
62,"Тайна Калиостро — то ли выдающегося адепта тайных наук, то ли не менее выдающегося мошенника — так никем и не была раскрыта."
63,"Считается, что маг умер в заточении, в замке-крепости Сан-Лео на отвесной скале, но когда впоследствии была вскрыта его могила, никаких останков там не нашли."
64,"Некоторые поклонники его сомнительных талантов считают даже, что освобождённый благодаря своей магии Калиостро тайно вернулся в Россию (или Америку), где жил инкогнито до конца своих дней, а может быть, и до сих пор живёт: ведь он, говорят, владел эликсиром бессмертия."
65,"P.S. У нас с вами есть всё-таки возможность раскрыть наконец секрет Калиостро и проверить «на зубок» его магическое искусство."
66,"Дело в том, что в свой приезд в Россию граф раскрыл Потёмкину масонский секрет: дескать, в подвалах павильона «Ротонда» Елагинского дворца в Петербурге зарыт саркофаг Гомера."
67,"Расследуя эту тайну, секретарь Елагина повредился рассудком."
68,"Однако у здравомыслящих исследователей современности есть все шансы поставить точку в этой таинственной истории."
