"sent_pos","source"
0,"В прошлом году вновь значительно уменьшился долг России другим странам."
1,"Это стало возможным благодаря рекордно высоким ценам на нефть, что предопределило большие прибыли для государства."
2,"В течение 2005 года внешний долг России уменьшился с 114 миллиардов до 81,5 миллиардов долларов."
3,"В этом году Премьер-министр Михаил Фрадков предполагает досрочно выплатить «парижскому клубу» ещё 12 миллиардов долларов."
4,"Переговоры по этому вопросу уже проходят."
5,"Россия берёт под полный контроль проблемы внешнего долга, одновременно увеличивается долг больших государственных концернов."
6,"Хотя, соотношение между иностранным капиталом и возможностями экономики России в настоящее время не является критичным."
7,"Только для частных предприятий становится всё более трудно получить внешний кредит, так как большую часть зарубежных кредитов забирают государственные и полугосударственные концерны."
