"sent_pos","source"
0,"Е-mail должен быть у каждого Гражданам Турции государство выдаст почтовые адреса."
1,"Турецкие власти намерены обеспечить всех граждан страны адресом электронной почты."
2,"С этой целью учреждён проект Anapost."
3,"В соответствии с ним адреса электронной почты будут выдаваться всем новорождённым и заноситься в удостоверение личности."
4,"Каждому из 70 млн уже живущих жителей Турции будет выдан почтовый ящик ёмкостью до 10 Гб."
5,"Кроме того, в 2010 году Турция собирается запустить собственную поисковую систему."
6,"Эксперты сомневаются в том, что «обязательные» адреса электронной почты будут пользоваться большой популярностью в ближайшее время: пользователи будут опасаться слежки за собой в интернете."
7,"Подробнее о том, как сохранить приватность в Сети, читайте в статье Частного корреспондента «Веб-сёрфинг: техника безопасности»"
