"sent_pos","source"
0,"США объявили часть Луны памятником Речь идёт о Море Спокойствия, где более 40 лет назад произошла первая высадка человека на Луне."
1,"Американский штат Калифорния назвал часть Луны (Море Спокойствия) охраняемым памятником истории."
2,"На этом месте 40 лет назад американцы высадились на естественном спутнике Земли."
3,"Как выяснилось, речь идёт об охране более 100 объектов, которые экипаж «Аполлона-11» оставил на поверхности Луны."
4,"Данное решение, как передаёт РГРК «Голос России», принято комиссией исторических ресурсов штата, которая всерьёз рассчитывает, что место высадки американцев (что, кстати, многие считают неправдой) попадёт в перечень объектов Мирового культурного наследия ООН."
5,"В США заявляют, что в июле 1969 года американцами были оставлены на Луне сейсмографы, инструменты, камеры, контейнеры, антенны, пустые бутылки для хранения еды и воды, американский флаг, посадочная ступень лунного модуля с табличкой и выгравированными на ней картой полушарий Земли и словами «Здесь люди с планеты Земля впервые ступили на Луну."
6,"Июль 1969 года новой эры."
7,"Мы пришли с миром от имени всего человечества»."
8,"О спорах вокруг возможной высадки американцев на Луну 40 лет назад читайте в статье Частного корреспондента «Лунный камень преткновения»"
