"sent_id","par_id","source","book_id","par_pos","sent_pos"
34977,11140,"Более всего кредитные организации не жалуют милиционеров, дворников и военнослужащих.",1192,1,1
34978,11140,"Названа тройка профессий, представителям которых банки хуже всего выдают ипотеку.",1192,1,2
34979,11141,"Перечень профессий, представителям которых банки хуже всего выдают ипотечные кредиты, составлен экспертами компании Penny Lane Realty.",1192,2,1
34980,11141,"Помимо милиционеров, дворников и военнослужащих, которые заняли в этом списке лидирующие позиции, кредитные организации также не жалуют водителей, сельхозработников, сотрудников туристических и риелторских фирм, а также судей, строителей и предпринимателей.",1192,2,2
34981,11142,"Как отмечает Infox.ru, представители одних профессий (дворники, маляры) отпугивают банки низкими доходами, низким коэффициентом интеллекта, склонностью к пьянству.",1192,3,1
34982,11142,"Милиционерам и военным кредитные организации отказывают из-за того, что они негативно воспринимаются обществом, высоко коррумпированы и имеют низкую финансовую грамотность.",1192,3,2
34983,11142,"Водителей не жалуют по той причине, что они находятся в зоне риска — если их лишат водительского удостоверения, то вернуть деньги им будет очень тяжело.",1192,3,3
34984,11142,"Также в зоне риска, но уже из-за погоды, находятся фермеры, которых банки также отнесли к категории нежелательных клиентов.",1192,3,4
