"sent_id","par_id","source","book_id","par_pos","sent_pos"
77441,26614,"Причина и следствие",3246,1,1
77442,26615,"РК, КНДР и США не могут решить, с чего начать примиряться.",3246,2,1
77443,26616,"Руководство Северной Кореи продолжает настаивать на своём варианте урегулирования конфликта с мировым сообществом.",3246,3,1
77444,26616,"Пхеньян предлагает сначала заключить документальный мир с Южной Кореей и официально покончить с корейской войной середины прошлого века.",3246,3,2
77445,26616,"Кроме того, КНДР, прежде чем вернуться за стол шестисторонних переговоров по проблеме денуклеаризации Корейского полуострова, намерена добиться тёплых отношений с Соединёнными Штатами и склонить мировые державы к отмене экономических санкций по отношению к Пхеньяну.",3246,3,3
77446,26617,"Однако другие участники конфронтации на такое предложение от Северной Кореи не польстились.",3246,4,1
77447,26617,"Южная Корея отказалась от мирных переговоров, а США заявили, что ни о какой оттепели не может быть и речи, пока Пхеньян не свернёт свои ядерные программы.",3246,4,2
77448,26617,"Министр обороны Южной Кореи Ким Тай Йонг, в частности, заявил, что отказ КНДР от ядерных проектов станет главным условием заключения возможного мира.",3246,4,3
