"sent_pos","source"
0,"Посол Евросоюза на Южном Кавказе Питер Семнеби и представители ПАСЕ (Парламентской ассамблеи Совета Европы) призывают руководство Грузии отменить чрезвычайное положение, при котором запрещены митинги, демонстрации и вещание независимых теле- и радиостанций, как можно скорее."
1,"Евросоюз уже приостановил работу миссии в Грузии, объяснив это заботой о безопасности работников."
2,"«Демократия - не простая вещь и не всегда означает мир."
3,"Демонстрация, критика власти и свобода власти создает другую ситуацию, но со стороны полиции разгон митинга, закрытие телеканалов и ограничение свободного распространения информации — абсолютно неприемлемо для демократического общества», — заявил Матиас Йорш, докладчик ПАСЕ, сообщает BBC."
4,"Тем временем парламент Грузии утвердил чрезвычайное положение, которое должно действовать до 22 ноября."
5,"Агенство France-Presse предполагает, что чрезвычайное положение будет отменено раньше."
6,"Также, государственный департамент США выслал в Грузию сотрудника, который должен сообщить правительству Грузии мнение США."
7,"Ранее, в пятницу, американские власти выразили одобрение решению о проведении досрочных президентских выборов."
