"sent_id","par_id","source","book_id","par_pos","sent_pos"
77461,26629,"Новый мировой рекорд для электровозов",3249,1,1
77462,26630,"2 сентября 2006 года Электровоз ES64U4/ ÖBB 1216 050-5 концерна Сименс (Simens) установил новый мировой рекорд скорости для электровозов.",3249,2,1
77463,26630,"Прежний рекорд был установлен французским электоровозом BB-9004 на участке пути Бордо — Дакс (Bordeaux — Dax) 29 марта 1955 года.",3249,2,2
77464,26631,"Новый мировой рекорд установлен на скоростном участке Нюрнберг — Ингольштадт (Nürnberg — Ingolstadt) между населёнными пунктами Киндинг (Kinding) и Аллерсберг (Allersberg).",3249,3,1
77465,26631,"Электровоз концерна Сименс достиг скорости — 357 км/час.",3249,3,2
