"sent_id","par_id","source","book_id","par_pos","sent_pos"
28819,9363,"28 марта 2011 года открылась сессия эдускунты (финского парламента) нового состава.",937,1,1
28820,9363,"На открытии выступили президент Финляндии Тарья Халонен и спикер парламента Бен Зыскович.",937,1,2
28821,9364,"Накануне открытия сессии прошли выборы спикера парламента.",937,2,1
28822,9364,"На этот пост был избран Бен Зыскович, представитель Национальной коалиционной партии",937,2,2
28823,9365,"По результатам прошедших 17 апреля парламентских выборов 44 депутата в эдускунте будут представлять Национальную коалиционную партию, 42 — Социал-демократическую партию, 39 — партию Истинные финны, 35 — Партию центра, 14 — Левый союз, 10 — Зелёный союз, 9 — Шведскую народную партию, 6 — Христианских демократов (ещё один мандат — у кандидата от коалиции нескольких местных партий Аландских островов).",937,3,1
