"sent_pos","source"
121,"Теперь на редакционных летучках в «Слоне» обсуждается, какими заголовками можно делиться с другими ресурсами."
122,"Арифметика вопроса очень понятна."
123,"При CTR в 1% один человек нажал на баннер и прочёл текст, а 99 человек увидели название издания и его заголовок и на этом основании составили своё представление об издании."
124,"Так что при CTR в 1% думать надо не об этом 1%, а об остальных 99%."
125,"Об этом говорил ещё Тёма Лебедев, создавая рекламную сеть Reklama.ru в 1998 году."
126,"Но он-то говорил это про имиджевые баннеры, а людей, которые потом занялись генерацией трафика, ещё в природе не было."
127,"Когда вся эта индустрия трафикогенерации создалась, эти люди были свободны от имиджевых соображений, а их работа оценивалась только по CTR."
128,"Поэтому они ни в чём себе не отказывали, рожая порнозаголовки."
129,"Сегодня негативные последствия таких заголовков уже доведены до сознания баннермейкеров."
130,"А в Lenta.ru им изначально были навязаны очень строгие ограничения."
131,"— А если не брать Lenta.ru?"
132,"— У BFM.ru — 1,8 млн посетителей в месяц через год после создания, и безо всякой Ксюши Собчак."
133,"Фокус заключается в том, что, когда ты сужаешь свою нишу, ты сужаешь её относительно некоего универсума, который сегодня составляет 80 млн человек для Рунета: 40 — в России, 40 — снаружи."
134,"Если ты работаешь для 10% — это 8 млн человек."
135,"Пока твоя аудитория в разы меньше этих 10%, ты даже не можешь почувствовать этого сужения."
136,"Поэтому посылка «давайте все будем выглядеть как одна газета «Жизнь», иначе нас никто не будет читать» — ложная."
137,"Выживание качественной прессы состоит не в маскировке под некачественную, а в том, чтобы брать за рекламу на своих полосах принципиально иные деньги."
138,"И рекламодатель будет их исправно платить, если получит искомую отдачу."
139,"А если он её не получит, то никакие мажорные отчёты об успехах трафикогенерации его не удержат."
