"sent_id","par_id","source","book_id","par_pos","sent_pos"
35623,11286,"Уполномоченный вместо лидера",1221,1,1
35624,11286,"Сопредседатель партии «Правое дело» Георгий Бовт назначен уполномоченным по созданию московского отделения.",1221,1,2
35625,11287,"Сопредседатель партии «Правое дело» Георгий Бовт назначен уполномоченным по созданию московского отделения, которым ранее должен был заниматься уехавший в Лондон и заочно арестованный экс-совладелец «Евросети» Евгений Чичваркин.",1221,2,1
35626,11287,"«Это совсем не означает, что человек, назначенный ответственным за создание московского отделения, будет руководить московской организацией», — сказал Бовт.",1221,2,2
35627,11287,"Бовт уточнил, что партия хочет устранить суету, которая наблюдается в последнее время вокруг создания московского отделения, и спокойно зарегистрировать столичную ячейку.",1221,2,3
35628,11287,"Он также сообщил, что московское отделение может быть создано и без лидера, лишь федеральным политсоветом.",1221,2,4
35629,11287,"При этом сопредседатель партии подчеркнул, что не собирается становиться главой столичной парторганизации.",1221,2,5
35630,11287,"«Отделение может быть зарегистрировано без руководителя, а с политсоветом — для того, чтобы оно могло участвовать в выборах в Мосгордуму», — цитирует Бовта РИА «Новости».",1221,2,6
