"sent_id","par_id","source","book_id","par_pos","sent_pos"
18595,6094,"В Twitter появились фотогалереи",431,1,1
18596,6094,"Галерея может вмещать до ста изображений, которые следуют в хронологическом порядке, начиная от самых новых.",431,1,2
18597,6095,"Сервис микроблогов будет отображать добавленные пользователями изображения в виде фотогалерей.",431,2,1
18598,6095,"Ссылка на фотогалерею находится в профиле пользователя.",431,2,2
18599,6095,"Она может вмещать до 100 изображений, которые следуют в хронологическом порядке, начиная от самых новых.",431,2,3
18600,6095,"В неё попадают как снимки, загруженные пользователем через собственный фотосервис Twitter, так и через сторонние ресурсы наподобие yfrog, Twitpic и Instagram.",431,2,4
18601,6096,"Чтобы убрать то или иное изображение из галереи, пишет «Лента.ру», нужно удалить твит, который содержит соответствующую ссылку.",431,3,1
18602,6096,"Фотографии из сообщений-ретвитов в галерею попадать не будут.",431,3,2
18603,6096,"Отметим также, что собственным сервисом загрузки изображений Twitter обзавёлся в первой половине августа.",431,3,3
