"sent_pos","source"
0,"Около 3,8 миллиона резидентов Великобритании платят подоходный налог по неправильной ставке из-за неоправданной сложности налоговой системы."
1,"Об этом говорится в докладе экспертов лондонского Сити, подготовленном по заказу Bow Group."
2,"Эксперты отмечают, что британским налогоплательщикам очень трудно разобраться во все более запутанных формах, которые применяются для налоговой отчетности."
3,"Авторы доклада призвали правительство Великобритании упростить налоговую систему, в частности, сократив количество различных льгот."
4,"По словам экспертов, реформа необходима, чтобы компании и физические лица тратили меньше времени и денег на налоговую отчетность."
5,"Кроме того, реформа упростит процесс сбора налогов и облегчит работу налоговых инспекторов."
6,"В прошлом году правительство Великобритании из-за ошибки в налоговой системе переплатило 2,2 миллиарда фунтов стерлингов в качестве налоговых льгот."
7,"В результате у налогоплательщиков образовалась задолженность, часть которой впоследствии была списана."
8,"Депутаты британского парламента выразили ""грубокую обеспокоенность"" по поводу допущенной ошибки, обвинив правительство в неспособности обеспечить стабильную работу системы налоговых льгот."
