"sent_id","par_id","source","book_id","par_pos","sent_pos"
33740,10792,"С 11 по 18 октября в Чебоксарах будет проходить 14 Международный Фестиваль языков.",1137,1,1
33741,10792,"Мероприятия пройдут в Художественном музее, центре 'Эдельвейс', Педуниверситете и ДК им. Ухсая, Национальнай библиотеке, Институте культуры и искусств.",1137,1,2
33742,10793,"В программу мероприятий входят поэтические концерты, презентации письменности различных народ(Китайская, Руническая, Арабская письменности).",1137,2,1
33743,10793,"Также пройдёт КВН среди студенческих команд ЧГПУ им. И.Я.Яковлева.",1137,2,2
33744,10793,"В план мероприятий входит встреча с иногородними гостями фестиваля и экскурсия по городу.",1137,2,3
33745,10793,"А закроет фестиваль интернациональный концерт.",1137,2,4
33746,10794,"Контактная информация: тел. 68-50-51.",1137,3,1
