"sent_pos","source"
0,"С террористами будут бороться с экрана Спецслужбы берут на вооружение телеэфир."
1,"Российские спецслужбы собираются бороться с терроризмом при помощи телевидения и уже даже разработали соответствующую концепцию."
2,"Цитаты из документа под названием «Требования к оказанию услуг для государственных нужд по созданию цикла специализированных телевизионных передач по вопросам профилактики терроризма и противодействии идеологии терроризма» опубликовал «Московский комсомолец»."
3,"С помощью телевидения силовики намерены заняться разъяснением «разрушительной противоправной человеконенавистнической сущности терроризма» и сформировать у россиян иммунитет «к попыткам вовлечения в террористическую деятельность»."
4,"На конкретных примерах из фильмов и телепрограмм гражданам будут рассказывать о неотвратимости наказаний за теракты и формировать в массовом сознании положительный образ спецслужб, противостоящих экстремистам."
5,"Какие именно телеканалы будут привлечены к антитеррористической пропаганде, пока не уточняется."
