"sent_pos","source"
0,"Неоцифрованные «Книги России» Главная проблема с электронными книгами — их просто мало На ХIII Национальной выставке-ярмарке «Книги России», которая обычно проходит в начале весны на ВВЦ, в 2010 году собрались профессионалы — издатели, торговцы, юристы — поговорить о «цифровом настоящем и будущем российской книги»."
1,"Большинство разговоров было посвящено тому, что электронных книг в России мало, и понятно почему, но непонятно, как сделать так, чтобы их стало больше."
2,"Желающих узнать о том, какое же цифровое будущее ждёт книги, на конференции было столько, что даже удачно, что речь шла о продукте нематериальном, а то бы организаторы понаставили стеллажей по стенкам, уменьшив и без того невеликое помещение, отведённое под конференцию."
3,"Организаторы конференции, судя по всему, не были готовы к такому интересу к теме и искренне радовались наплыву участников."
4,"Какие уж там стулья?"
5,"Конференцию открыл профессор Борис Ленский, который очень бодро рассказал, как всё плохо, но, видимо, скоро пройдёт."
6,"Если верить приведённым им данным — пройдёт совсем."
7,"Судите сами: количество выпущенных в 2009 году книг в России упало почти на 6% (до 716 млн книг), а традиционно любимые согражданами книги в переплёте вытесняются более дешёвыми книжками в мягкой обложке."
8,"Согласно одному из наиболее устойчивых советских мифов, когда-то СССР был самой читающей страной в мире."
9,"Даже если и так, то теперь её место, учитывая сокращение числа книжных магазинов (8455 в 1990 году, 3600 в 2008-м и 3400 в 2009-м), если считать по числу вышедших наименований — 127 тысяч в 2009 году, далеко позади США (300 тысяч), Китая (275 тысяч) и Великобритании (133 тысячи)."
10,"Причём больше половины книг выходит тиражами менее 1000 экземпляров, которые в приличном обществе и тиражами-то пока не считаются."
11,"А если сравнивать обороты книжных бизнесов в долларах, то книжный рынок России в денежном выражении просел в 2009 году на 20%, заняв 9-е место после крупнейших международных книжных холдингов."
12,"После цифр пришёл черёд неофитов, практиков и пророков электронных книг."
13,"Роль неофита умело исполнил Михаил Столяров, глава издательства «Игра слов»), который призвал всех издателей относиться к электронной книге, как к Книге."
14,"То есть её верстать, а не конвертировать из PDF, подготовленного для типографии."
15,"И скромно заметил, что его издательство разрабатывает собственный формат электронных книг, наотрез отказавшись уточнять, какой именно, сославшись на то, что издательство ведёт переговоры с одним венчурным фондом… Ольга Масленикова из издательства «Дрофа» была более практична, рассказав, какие чудесные мультимедиа-книги и учебные пособия издательство готовит для средней школы."
16,"И когда они поставляются на CD-дисках вместе с учебниками, то идут на ура."
17,"Жаль только, посетовала докладчик, спрос на онлайновые версии пока невелик."
18,"Что, впрочем, не очень удивительно — написанный на Flash учебник заставил вентилятор моего ноутбука взвыть так, как будто он собирается взлететь."
19,"В роли пророка и оракула выступал Алексей Кузьмин, уже отыгравший другую роль — генерального директора  «Литрес», главного, потому что самого большого и практически единственного в России онлайнового магазина электронных книг."
20,"Оракул заметил, что детские интерактивные книги — далёкое будущее, бумажная книга не умрёт ещё 50—100 лет, но Chrome OS  (открытая операционная система Google для нетбуков."
21,"— «Часкор») можно будет поставить хоть на iPad (планшетный компьютер Apple, славящейся трепетным отношением к тому, кто, что и как устанавливает на её устройства."
22,"— «Часкор»), и все книги рано или поздно будут в Сети, и брать роялти надо не с издателей, а с провайдеров."
23,"Производителей книг на конференции сменили люди из, так сказать, post-production — библиографы и библиотекари."
24,"Их взгляд на электронные книги был более грустным, поскольку с ними, как с продуктом нематериальным, не очень понятно, что делать."
25,"Ну в самом деле, бумажные могут считаться книгами, иметь ISBN, то есть международные стандартные книжные номера, храниться в Книжной палате на радость грядущим поколениям, рассылаться в виде обязательных экземпляров по крупнейшим библиотекам страны."
26,"А электронные?"
27,"Закон требует регистрировать только материальные объекты, из целлюлозы или, на худой конец, «на сменных носителях»."
28,"Электронные книги никто посылать в Книжную палату не собирается, а уж в библиотеки тем более!"
29,"Тут как раз подоспели, так сказать, билетёры с охраной — представители фирм, кровно заинтересованных или в получении как можно большего количества денег за каждый прочитанный читателем абзац, или в посадке как можно большего количества читателей, за этот абзац не заплативших."
30,"Чудом оказался в этом строе суровых бизнесменов главный библиотекарь страны — директор Ленинки Александр Вислый."
31,"Он не был чужим на этом празднике имени 146-й статьи Уголовного кодекса, который добрым словом поминали, кажется, все выступавшие: его речи, с некоторой точки зрения, вполне на эту статью тянули."
32,"Во всяком случае притянуть его было бы можно или даже нужно?"
33,"А как иначе?"
34,"Оцифровывать книги библиотекам нынешний закон позволяет только и исключительно с письменного согласия правообладателей."
35,"Грядущие поколения, которые могут и не увидеть бумажных книг, затопленных канализацией или выброшенных по совершенно объективной причине отсутствия места, тут совершенно ни при чём."
36,"До них ли?"
37,"Разрешить библиотекам оцифровать все книги!"
38,"Да ещё без прямого разрешения правообладателей, которым, например, старается стать электронная библиотека «Книгафонд», скупающая электронные права на учебники и учебные пособия, чтобы давать их почитать за жалкие 5000 рублей в год или 150 рублей в день!"
39,"(Кстати, замечу в скобках: раньше, читая действующий закон о библиотеках, я наивно полагал, что библиотеки должны давать читать книги бесплатно.)"
40,"Теми же, кто хочет просто почитать, явно скоро займутся гвардейцы копирайта."
41,"Защита от копирования стала лейтмотивом следующего раунда обсуждений на конференции, посвящённого проблемам распространения электронных книг."
42,"Только тут, собственно, и прозвучали первые цифры о том, сколько денег есть на электронном рынке."
43,"По оценкам Алексея Кузьмина, не слишком много — порядка 2 млн долларов (это на совокупном книжном рынке страны, где в 2009 году было продано книг на 2,4 млрд долларов)."
44,"Одна десятая процента — доля столь незначительна, что её даже хочется написать буквами, а не цифрами."
45,"Правда, Алексей Кузьмин не преминул уточнить, что это без пиратства: рынок стихийного скачивания контента составляет порядка 3—7 миллионов."
46,"Это и те книги, которые пользователи не захотели покупать у «Литреса», или те, которых просто никто не продаёт."
47,"При этом «Литрес» занимает примерно половину всего рынка, продавая в день по 2—3 тыс. книг напрямую (и ещё 5—6 тысяч через партнёрские программы)."
48,"Как же продавать электронные книги?"
49,"Как угодно."
50,"Можно файлами, можно давать читать бесплатно, заставляя смотреть рекламу, а можно вводить абонентскую плату за доступ к ограниченному (как в «Литрес») или неограниченному (как в «Книгафонде») количеству книг, а можно даже по частям, по главам, по статьям."
51,"Мелкую нарезку, правда, никто на российском рынке пока не предлагает, но всё ещё впереди."
52,"Идеальными, впрочем, участники конференции признали две модели: привязка конкретного устройства к магазину книг или предоставление доступа к любому контенту с компенсацией правообладателям из платежей провайдеров за доступ в Сеть."
53,"Первая модель, по которой работают Amazon, Sony и Barnes&Noble, предоставляющие своим пользователям доступ к онлайновым магазинам электронных книг, в России не реализована — международных мейджоров официально нет и неизвестно, появятся ли."
54,"Своих же сил и талантов не хватает ни на производство букридеров, ни на решение непосильной задачи оцифровки: готовых к продаже электронных книг отчаянно не хватает."
55,"В каталоге «Литрес», который все докладчики на конференции, не тая при этом никакого зла и не имея в виду ничего плохого, и ФАС в один голос обзывали монополистом, есть всего около 24 тыс. книг («Книгафонд» предлагает больше 30 тысяч, однако не скачивать, а почитать за деньги)."
56,"Для сравнения: в реальной продаже на рынке есть 200 тыс. книг, во всяком случае столько насчитывает каталог крупнейшего книжного интернет-магазина страны «Озона» («Озон», заметим в скобках, торгует и электронными книгами от того же «Литреса», но на эти продажи приходится от силы те же доли процента всех его книжных продаж)."
57,"Для сравнения: ассортимент только электронных книг, продающихся только Amazon, уже превышает 300 тысяч."
58,"Главное препятствие в наполнении ассортимента — нерасторопность издателей, которым для выпуска книги в электронном виде, согласно действующей с 2008 года 4-й части Гражданского кодекса РФ, необходимо заключать для этого с авторами специальный договор (или учитывать эту перспективу в новых договорах)."
59,"Издатели сумрачно смотрят на рынок электронных книг, с одной стороны, не видя больших денег, с другой стороны, как чёрт от ладана, шарахающихся от самой возможности попадания книги в Сеть."
60,"(О существовании сканеров большинство издателей, видимо, не подозревают.)"
61,"Пока издатели медлят, неподъёмный документооборот по договорам с авторами решил взять на себя «Литрес»."
62,"Его титанические и благородные усилия, однако, имеют не слишком удачный побочный результат, на который указала Екатерина Воронина, представитель книжного интернет-магазина «Библион»: в условиях неизбежного в такой ситуации монополизма почти на всех торговых площадках, на которых продаются электронные книги с очищенными правами, выбор книг ограничивается ассортиментом «Литреса»."
63,"А его, нисколько не обижая «Литрес», но просто констатируя факт, можно определить как масскульт и ширпотреб."
64,"Возможным спасением рынка — и не только электронных книг, но всего цифрового контента — Алексей Кузьмин считает движение к тому, что можно было бы назвать «налогом на Сеть»."
65,"Диагноз ведь печален: профессиональные участники рынка не могут самостоятельно насытить книгами, организовать его юридическую (обеспечение правами), техническую (распространение контента) и финансовую (самая популярная система оплаты через SMS оказывается и самой невыгодной для продавцов, поскольку операторы связи делают наценку в 70—100% за платёж) инфраструктуру."
66,"Самый простой выход — взимать деньги если не с провайдеров контента, то с провайдеров доступа в Сеть (а последним — повышать стоимость доступа для пользователей)."
67,"Просто оптом, под одну гребёнку."
68,"Примерно так, кстати, хочет обложить пошлиной на копирование все чистые DVD, карты флеш-памяти и жёсткие диски новоявленный Российский союз правообладателей."
69,"Может, такой исход будет самым логичным для «самой читающей страны в мире»: бумажные книги и так уже читают всё меньше, а с налогом на Сеть и электронные книги могут лишиться шанса добраться до читателя."
70,"Зато в России много писателей и правообладателей!"
