"sent_pos","source"
0,"Увольнения на CBS."
1,"Американская телесеть урезает расходы."
2,"Американская телерадиосеть CBS готовится к масштабным сокращениям."
3,"Увольнения коснутся работников новостного подразделения компании."
4,"Как пишет The New York Times, в первую очередь потеря работы угрожает журналистам из программы «60 минут» и утреннего шоу."
5,"По словам Шона Макмануса, президента CBS News and Sports, решиться на радикальные меры третью по влиятельности американскую телекомпанию вынудил финансовый кризис."
6,"СBS больше не может позволить себе содержать штат из 1400 человек."
7,"Как ожидается, в первую очередь будут уволены не больше сотни сотрудников, большинству из них просто не продлят контракты, сроки которых истекают в ближайшее время."
