"sent_id","par_id","source","book_id","par_pos","sent_pos"
45959,14867,"Это случится 8 апреля в Праге",1654,1,1
45960,14867,"Дмитрий Медведев и Барак Обама назначили дату и место подписания договора СНВ-2.",1654,1,2
45961,14868,"Лидеры России и США наконец поставили точку в девятимесячном обсуждении пунктов нового договора о стратегических наступательных вооружениях (СНВ).",1654,2,1
45962,14868,"Окончательно решено, что Барак Обама и Дмитрий Медведев поставят под ним свои подписи 8 апреля в чешской столице.",1654,2,2
45963,14868,"Об этом президенты обеих стран условились во время телефонного разговора, который состоялся накануне.",1654,2,3
45964,14869,"Как сообщает Lenta.ru, новый американо-российский договор предполагает сокращение численности боеголовок до 1550 штук для каждой из сторон — это почти на треть ниже максимума, предусмотренного предыдущим соглашением, срок которого официально истёк ещё в декабре прошлого года.",1654,3,1
45965,14869,"СНВ-2 будет действовать 10 лет.",1654,3,2
45966,14869,"По словам Дмитрия Медведева, новый договор «отражает баланс интересов обеих стран».",1654,3,3
