"sent_pos","source"
0,"На заре первого дня Нового года нефть начали качать по трубам, протянувшимся более, чем на 3600 км из Восточной Сибири в северовосточный китайский город Дацин."
1,"Будучи крупнейшим в мире экспортером нефти, Россия планирует отправлять крупнейшему потребителю энергоносителей — Китаю — более 300 тысяч баррелей в день."
2,"Сделка способствует укреплений растущих связей между странами."
3,"Председатель КНР Ху Цзиньтао и российский президент Дмитрий Медведев символически открыли нефтепровод в конце сентября 2010-го, и до конца года эксплуатация проходила в испытательном режиме."
4,"Новые поставки нефти почти вдвое увеличат объем «черного золота», поставляемого Россией в Китай."
5,"До сих пор доставка сырой нефти осуществлялись по железной дороге в тихоокеанский порт Козьмино."
6,"По договору между двумя странами о нефтепроводе от 2009 года, Поднебесная будет получать нефть 20 лет в обмен на 25 миллиардов долларов кредитов."
