"sent_id","par_id","source","book_id","par_pos","sent_pos"
7375,2327,"На заре первого дня Нового года нефть начали качать по трубам, протянувшимся более, чем на 3600 км из Восточной Сибири в северовосточный китайский город Дацин.",99,1,1
7376,2327,"Будучи крупнейшим в мире экспортером нефти, Россия планирует отправлять крупнейшему потребителю энергоносителей — Китаю — более 300 тысяч баррелей в день.",99,1,2
7377,2328,"Сделка способствует укреплений растущих связей между странами.",99,2,1
7378,2328,"Председатель КНР Ху Цзиньтао и российский президент Дмитрий Медведев символически открыли нефтепровод в конце сентября 2010-го, и до конца года эксплуатация проходила в испытательном режиме.",99,2,2
7379,2329,"Новые поставки нефти почти вдвое увеличат объем «черного золота», поставляемого Россией в Китай.",99,3,1
7380,2329,"До сих пор доставка сырой нефти осуществлялись по железной дороге в тихоокеанский порт Козьмино.",99,3,2
7381,2329,"По договору между двумя странами о нефтепроводе от 2009 года, Поднебесная будет получать нефть 20 лет в обмен на 25 миллиардов долларов кредитов.",99,3,3
