"sent_pos","source"
0,"В конце 2007 года в испанской Валенсии ученые открыли кладбище динозавров."
1,"Как показали последующие исследования, оно является крупнейшим в Европе."
2,"И вот новая находка: прекрасно сохранившийся скелет зауропода."
3,"Уже определено, что этому динозавру 120 миллионов лет."
4,"Размеры этого растительноядного животного пока не установлены, поскольку палеонтологи продолжают раскопки."
5,"Но даже часть раскопанного хвоста, превыщающая 3 метра, говорит о гигантских размерах древнего ящера."
